title,subreddit,score,num_comments,created_date,author,platform,sentiment,sentiment_score
How A/B Testing Works and How to Use It With Google Analytics,analytics,1,0.0,2014-05-12 12:08:04,designbox,Reddit,neutral,0.0
"Social Media Marketing,Target Market Analysis &amp; Research | Blueocean Marketing Intelligence",analytics,0,1.0,2014-05-12 13:25:22,sahanbn,Reddit,positive,0.4767
When You're Too Lazy to Read The Official Help: Google Analytics FAQ,analytics,2,0.0,2014-05-12 16:47:47,honzafelt,Reddit,positive,0.0516
"Google Analytics now mixes Web and App Data, help",analytics,2,2.0,2014-05-12 20:43:55,12Troops,Reddit,positive,0.4019
AMA about analytics over at Yabbly,analytics,0,2.0,2014-05-13 02:17:42,[deleted],Reddit,neutral,0.0
Let your Analysis Flow with Google Analytics’ Events Flow,analytics,1,0.0,2014-05-15 10:36:50,[deleted],Reddit,neutral,0.0
Putting a classic &amp; universal GA on the same page,analytics,0,8.0,2014-05-16 00:05:37,partiallypro,Reddit,neutral,0.0
Tracking YouTube Videos using Google Analytics,analytics,6,0.0,2014-05-16 22:09:54,megalytic,Reddit,neutral,0.0
Good sample size over five years in GA for analysis?,analytics,1,3.0,2014-05-18 22:14:00,[deleted],Reddit,positive,0.4404
Help with Google Analytics,analytics,1,15.0,2014-05-19 10:06:27,kkin1995,Reddit,positive,0.4019
How to make a Web Analytics presentation to the CEO,analytics,8,2.0,2014-05-19 18:55:27,megalytic,Reddit,neutral,0.0
Universal Google Analytics for Wordpress,analytics,4,2.0,2014-05-20 18:27:32,svolinsky,Reddit,neutral,0.0
Why you should buy from a startup,analytics,2,1.0,2014-05-20 20:27:56,avazlqd,Reddit,neutral,0.0
Can I use more than one utm_content entry?,analytics,2,1.0,2014-05-20 21:55:14,BevansDesign,Reddit,neutral,0.0
How To Track Facebook Advertising Campaigns in Google Analytics,analytics,4,0.0,2014-05-21 02:59:34,megalytic,Reddit,neutral,0.0
Using Heatmaps in Retail,analytics,2,1.0,2014-05-21 17:43:35,dodge901,Reddit,neutral,0.0
Business Experiments Explained: Factors and Levels,analytics,1,0.0,2014-05-21 18:08:38,TheCorrFocus,Reddit,neutral,0.0
"It's the metadata, stupid: The New York Times misses the point of article tagging",analytics,1,1.0,2014-05-21 22:32:02,JetsmanJ,Reddit,negative,-0.6486
How to choose a digital analytics vendor,analytics,1,1.0,2014-05-22 19:30:50,[deleted],Reddit,neutral,0.0
Here's a plugin to simplify form tracking w/ Mixpanel (x-post from r/javascript),analytics,1,0.0,2014-05-23 01:58:50,squishy_boots,Reddit,neutral,0.0
Aluminium semi-fabricated markets in Asia; The presentation is intended to provide the reader a flavor of the aluminium semi fabricated markets in Asia and has been collated from various published sources and the library of Madras Consultancy Group.,analytics,1,0.0,2014-05-23 14:13:05,daisypete,Reddit,neutral,0.0
Improve your Web Analytics Reports with Compelling Comments,analytics,1,0.0,2014-05-23 15:30:23,[deleted],Reddit,positive,0.5859
How I Improved my Web Analytics Reports with Compelling Comments,analytics,2,0.0,2014-05-23 15:31:48,megalytic,Reddit,positive,0.6124
Spinnakr - Making Real-Time Web Analytics Actionable,analytics,0,1.0,2014-05-26 19:03:42,[deleted],Reddit,neutral,0.0
Everyday exercises to improve skills | Where do I start?,analytics,1,2.0,2014-05-27 23:11:44,seby408,Reddit,positive,0.4404
Suggestions on interesting topics for an analytics meetup group?,analytics,2,2.0,2014-05-28 00:47:04,gutterandstars,Reddit,positive,0.4019
"3 analytics tools to manage your Twitter, Facebook, G+ and other Socials",analytics,1,0.0,2014-05-28 11:59:08,techvoize,Reddit,neutral,0.0
Measure Content Engagement with Google Analytics and this Free WordPress Plugin,analytics,1,0.0,2014-05-29 00:15:20,megalytic,Reddit,positive,0.783
An Inbound Approach To Turning More Leads Into Customers.,analytics,1,1.0,2014-05-29 14:23:59,canddialice,Reddit,neutral,0.0
"Q: When Alexa says that X% of traffic to site came via Search Engines, does it mean only organic?",analytics,4,2.0,2014-06-02 17:49:24,gutterandstars,Reddit,neutral,0.0
hotel pricing forecast,analytics,0,1.0,2014-06-03 20:21:18,Jack_Wellington,Reddit,neutral,0.0
Anyone else getting this error while setting up an advanced segment in GA?,analytics,3,4.0,2014-06-04 18:30:45,gutterandstars,Reddit,negative,-0.2789
How To Solve The Biggest Problems With Analytics,analytics,1,0.0,2014-06-05 15:28:28,jmolz,Reddit,negative,-0.2263
hotel pricing forecasting tool for revenue managers,analytics,0,0.0,2014-06-06 04:43:22,Jack_Wellington,Reddit,neutral,0.0
Google Tag Manager question,analytics,3,2.0,2014-06-06 18:45:10,deesquared,Reddit,neutral,0.0
How I used Google Analytics and Cohort Analysis to measure the effectiveness of our Blog Marketing,analytics,1,0.0,2014-06-06 20:11:23,megalytic,Reddit,neutral,0.0
Where to develop SAS skills?,analytics,3,4.0,2014-06-06 20:44:41,[deleted],Reddit,neutral,0.0
What Tutorial or Courses for SEM and Analytics would you recommend/used to learn?,analytics,3,1.0,2014-06-07 00:30:47,nipoco,Reddit,neutral,0.0
11 Free Ways to Track your Competitors | Practical Ecommerce,analytics,3,0.0,2014-06-07 09:23:02,gutterandstars,Reddit,positive,0.5106
"Does anyone here use Piwik instead of/ along with GA? Pros/Cons and feedback, please?",analytics,7,4.0,2014-06-09 10:08:28,gutterandstars,Reddit,positive,0.3939
Custom Alert Help - Monitoring product SKU increases/spikes,analytics,1,0.0,2014-06-09 19:54:35,Emerald_Triangle,Reddit,positive,0.5994
Web Analytics - How to Create a Meaningful Measurement Model ?,analytics,3,0.0,2014-06-16 21:40:22,adityakhannamech,Reddit,positive,0.5267
AT&amp;T and Udacity partner to launch Nanodegrees | including in Data Analytics,analytics,2,0.0,2014-06-17 12:07:47,[deleted],Reddit,neutral,0.0
Can I Load Google Tag Manager Twice on a Page?,analytics,3,0.0,2014-06-18 04:58:06,volomike,Reddit,neutral,0.0
Top 5 Filters for Accurate Analytics (GA),analytics,1,0.0,2014-06-18 07:31:41,madhumitac,Reddit,positive,0.2023
How to calculate offline billboard impressions?,analytics,1,0.0,2014-06-18 09:48:14,surajgadage,Reddit,positive,0.1027
5 Things Every Social Media Analytics Report Must Have,analytics,1,0.0,2014-06-18 13:37:31,sendsocialmedia,Reddit,neutral,0.0
need serious help - Various views/properties,analytics,1,0.0,2014-06-20 13:07:16,SEM_123,Reddit,positive,0.34
Ecommerce Tracking in Universal Analytics,analytics,2,0.0,2014-06-20 14:45:10,megalytic,Reddit,neutral,0.0
Why am I getting visitors from India??,analytics,1,2.0,2014-06-20 15:24:19,BarryB64,Reddit,neutral,0.0
How Marketers Can Get A Better Handle on Data,analytics,3,0.0,2014-06-20 18:24:36,pdebois,Reddit,positive,0.4404
Event Tracking: Action is Reddit. Label is shared page. Possible to find the subreddit posted too?,analytics,1,1.0,2014-06-20 21:21:46,kittenbrutality,Reddit,positive,0.34
Know your websites worth!,analytics,3,0.0,2014-06-20 23:05:02,WebStatsO,Reddit,positive,0.2942
Ever have a huge change on a variation that was winning?,analytics,1,0.0,2014-06-21 04:05:39,chronomagus,Reddit,positive,0.6908
Datameer fighting crime with social data analytics,analytics,2,0.0,2014-06-22 01:32:05,thefranster,Reddit,negative,-0.7184
Xtra.ga - Google Analytics by Email,analytics,2,0.0,2014-06-23 10:38:25,kislitsyn,Reddit,neutral,0.0
Looking for entry level solution engineers,analytics,1,1.0,2014-06-23 23:09:01,[deleted],Reddit,positive,0.3182
How to translate business goals to analytics goals,analytics,1,1.0,2014-06-27 16:31:15,megalytic,Reddit,neutral,0.0
Don’t Trust Your Google Analytics Data Just yet: Get Rid of Noise With These Fundamental 9 Filters,analytics,2,3.0,2014-07-01 13:46:42,ynavot,Reddit,positive,0.5106
Making Google Analytics predictive with forecasting. Free tool,analytics,5,6.0,2014-07-02 00:32:14,ryno,Reddit,positive,0.5106
Improve your Digital Marketing with Insight from Geographic Stats in Google Analytics,analytics,1,0.0,2014-07-03 15:49:34,megalytic,Reddit,positive,0.4404
Have any of you analysts used SiSense?,analytics,2,0.0,2014-07-03 18:50:28,johnnyauburn,Reddit,neutral,0.0
"A More Modern Approach to Analytics, Part 1",analytics,1,0.0,2014-07-04 18:43:21,seanmeverett,Reddit,neutral,0.0
"Analytics, Experimentation, and Results of Building a Blog: Month Three",analytics,1,0.0,2014-07-06 06:58:42,[deleted],Reddit,neutral,0.0
Full Screen Google Analytics via Bookmarklet,analytics,0,0.0,2014-07-07 05:34:37,_manchester_,Reddit,neutral,0.0
Visual Mobile Analytics – The Key to App Optimization,analytics,1,0.0,2014-07-07 10:15:50,JannyGarrets,Reddit,positive,0.3818
UC Berkeley Breeds Data Scientists Exclusively Online: $60K for 18 Months,analytics,1,0.0,2014-07-08 02:20:40,[deleted],Reddit,neutral,0.0
The History of BI: The 1980's and 90's,analytics,1,0.0,2014-07-08 02:33:48,[deleted],Reddit,neutral,0.0
The Ultimate Guide for Upgrading to Universal Analytics,analytics,1,0.0,2014-07-09 14:08:53,bsatani,Reddit,neutral,0.0
Podcasts?,analytics,2,0.0,2014-07-10 06:27:06,DataWave47,Reddit,neutral,0.0
Predicting Startup Success,analytics,1,0.0,2014-07-10 20:38:22,czuriaga,Reddit,positive,0.5719
Something is broken! GA Campaign Tracking isn't working.,analytics,1,0.0,2014-07-11 02:06:46,karghkbdzx,Reddit,negative,-0.5255
Groupon Finds ‘Direct’ Traffic Is Really Organic Search - Husky SEO,analytics,1,0.0,2014-07-11 16:08:18,Huskyseo,Reddit,neutral,0.0
Luna Metrics: 7-Minute UX Audit for Landing Pages,analytics,0,0.0,2014-07-12 12:33:40,gutterandstars,Reddit,neutral,0.0
Help adding an IP filter,analytics,2,3.0,2014-07-14 21:32:35,black_eyed_susan,Reddit,positive,0.4019
Universal Analytics vs Classic GA - basic metrics don't match,analytics,1,0.0,2014-07-15 19:56:31,[deleted],Reddit,neutral,0.0
Viewing average page load time all pages of same type,analytics,1,3.0,2014-07-16 17:24:26,jwjody,Reddit,neutral,0.0
Help Searching for Analytics Positions,analytics,5,7.0,2014-07-16 18:23:23,Wiskeybadger,Reddit,positive,0.4019
Why do I have some days where my average page load time is zero yet there's 10s of thousands of page views?,analytics,5,7.0,2014-07-16 22:05:45,jwjody,Reddit,neutral,0.0
"*sigh* Google Analytics, why do you make me feel so stupid? (A question about ecommerce tracking)",analytics,1,5.0,2014-07-17 18:45:35,[deleted],Reddit,negative,-0.6447
Google Analytics App User Accuracy vs iTunes Connect &amp; Google Dev Console,analytics,2,0.0,2014-07-17 22:50:24,zanzibarmangosteen,Reddit,neutral,0.0
I Am Super Stumped: Why Are My New Users 102% of Total Users? (more details in comments),analytics,1,5.0,2014-07-18 01:43:38,coldenbu,Reddit,positive,0.5994
Analytics Referral Traffic For Internal Quotes,analytics,1,1.0,2014-07-18 16:56:54,Swiss91,Reddit,neutral,0.0
Google Launches Analytics Download For iOS,analytics,0,1.0,2014-07-19 23:07:52,timezonlinemarketing,Reddit,neutral,0.0
What are some of the most interesting metrics you've come across or discovered?,analytics,7,0.0,2014-07-20 14:48:43,Poop_shark,Reddit,positive,0.4576
The History of BI: The 2000's and Now,analytics,2,0.0,2014-07-20 16:38:39,[deleted],Reddit,neutral,0.0
How can Google Analytics help my business?,analytics,3,6.0,2014-07-21 00:16:13,AllforAll100,Reddit,positive,0.4019
"Three Forecasts You Should Know: Big Data, Business Intelligence &amp; Analytics",analytics,3,0.0,2014-07-21 17:07:24,[deleted],Reddit,positive,0.4767
Operations and Analytics Go Hand in Hand – Here’s 3 Reasons Why,analytics,1,0.0,2014-07-21 21:27:29,aaronkumar,Reddit,positive,0.7506
Separating Paypal purchases from on-site payment in GA Goals,analytics,1,0.0,2014-07-22 23:18:30,jeremyers,Reddit,neutral,0.0
Track social efforts via Google Analytics,analytics,0,1.0,2014-07-23 13:47:03,InboundInfantry,Reddit,neutral,0.0
Tips for Cross-Domain Tracking in Google Analytics,analytics,0,0.0,2014-07-23 14:45:32,megalytic,Reddit,neutral,0.0
Using Website Analytics to Understand Your Prospects,analytics,0,0.0,2014-07-24 15:27:32,megalytic,Reddit,positive,0.296
Sharing Google Analytics Reports with Your Organization,analytics,0,0.0,2014-07-24 21:30:17,megalytic,Reddit,positive,0.4215
Analytics in Different Areas,analytics,1,1.0,2014-07-25 07:51:11,srinimf,Reddit,neutral,0.0
redictive analytics real estate marketing startup raises $12M [x/RETech],analytics,1,0.0,2014-07-26 07:06:28,CitizenJosh,Reddit,neutral,0.0
Need Help! Issue with Google Tag Manager,analytics,1,0.0,2014-07-28 09:14:36,surajgadage,Reddit,positive,0.4574
"If you are not buying traffic you have a hobby not a business, 10 secrets to become a media buying expert",analytics,1,0.0,2014-07-29 18:36:52,jadaswardd,Reddit,neutral,0.0
Configure Google Analytics Cross Domain Tracking for the Booking Engine,analytics,1,0.0,2014-07-30 14:03:28,anrois,Reddit,neutral,0.0
How to Approach a Redesign with Digital Analytics in Mind,analytics,5,0.0,2014-07-30 16:09:08,PlaidPiperPup,Reddit,neutral,0.0
Daily cohort analysis in Google Analytics,analytics,1,2.0,2014-07-30 21:27:55,nukeio,Reddit,neutral,0.0
Dangers of Shortened URLs for Analytics,analytics,4,0.0,2014-07-30 23:13:33,megalytic,Reddit,negative,-0.4939
Consistent Google Analytics Tagging for Better Campaign Tracking,analytics,1,0.0,2014-08-01 14:27:34,megalytic,Reddit,positive,0.4404
Facebook Analytics. What’s all the Fuss about?,analytics,1,0.0,2014-08-01 14:53:24,[deleted],Reddit,neutral,0.0
Here's a great scenery pic I saw today - majestic mountains. (thought I'd share for any without a view),analytics,1,0.0,2014-08-02 10:25:57,Emerald_Triangle,Reddit,positive,0.743
The Skills Recruiters Look for When Hiring Analytics Talent,analytics,0,0.0,2014-08-04 08:23:13,poojaprakash,Reddit,positive,0.4215
Any Google Analytics or Adword Specialists?,analytics,3,8.0,2014-08-04 09:41:51,jkbizman,Reddit,neutral,0.0
Xiaomi is world's fifth largest smartphone maker: Strategy Analytics,analytics,1,0.0,2014-08-04 12:00:32,BEyond_INSOFE,Reddit,neutral,0.0
How Data Analytics Can Help In Better Pricing Decisions?,analytics,2,1.0,2014-08-05 03:49:25,jagran1,Reddit,positive,0.6808
Unlimited insights from web and mobile sites,analytics,1,0.0,2014-08-05 23:55:44,[deleted],Reddit,neutral,0.0
Tealeaf Users,analytics,3,14.0,2014-08-06 04:17:09,DarthQuerious,Reddit,neutral,0.0
Make the Most of Your Website with Google Analytics,analytics,0,0.0,2014-08-06 15:49:12,[deleted],Reddit,neutral,0.0
Is there a service to simplify the important/easily-forgotten SEO/conversion info from GA?,analytics,1,1.0,2014-08-06 22:58:50,pieandablowie,Reddit,neutral,0.0
How To Use Google Analytics To Filter Out The Bots And Spiders,analytics,1,0.0,2014-08-07 14:27:42,ubaid77,Reddit,neutral,0.0
Adobe ad hoc (discover) - time segmenta,analytics,2,0.0,2014-08-07 18:43:45,laperlanecktie,Reddit,neutral,0.0
Active Users App: Google Analytics Real-time in your Mac menu bar (Free),analytics,3,0.0,2014-08-07 22:41:29,SimpleMetrics,Reddit,positive,0.7184
How to reduce the bounce rate by using Google analytics for SEO,analytics,1,0.0,2014-08-09 17:59:52,ubaid77,Reddit,neutral,0.0
Multiple A/B/n Tests in Marketing with ANOVA and R,analytics,1,0.0,2014-08-10 23:44:53,whiteraven2,Reddit,neutral,0.0
Free Webinar: Universal Analytics,analytics,1,0.0,2014-08-11 05:55:06,bsatani,Reddit,positive,0.5106
Software/Service to generate behavior flow reports from GA,analytics,1,2.0,2014-08-11 16:59:47,PotterOneHalf,Reddit,neutral,0.0
Measure engagement / account health metrics for your SaaS app,analytics,1,0.0,2014-08-12 08:29:19,[deleted],Reddit,positive,0.4588
Segmenting Brand and Generic Paid Search Traffic in Google Analytics,analytics,1,0.0,2014-08-12 08:43:08,jessxkcd,Reddit,neutral,0.0
Smart Dashboard Modules: Insightful Dimensions And Best Metrics,analytics,2,1.0,2014-08-12 10:24:40,jessxkcd,Reddit,positive,0.7845
Show Reddit: Measure engagement / account health metrics for your SaaS app,analytics,2,0.0,2014-08-12 10:44:18,prateekbhatt,Reddit,positive,0.4588
Question: What are the best resources to learn about mobile app UX ? (and how it impacts metrics... x-post from /r/Userexperience),analytics,2,0.0,2014-08-12 16:37:01,gutterandstars,Reddit,positive,0.6369
I'm not sure which web tools I should be using to measure stuff I'm interested in tracking. Can you please give me some insight?,analytics,1,0.0,2014-08-12 18:43:27,[deleted],Reddit,positive,0.4657
Try a business analytics course,analytics,1,0.0,2014-08-13 13:33:42,learningimarticus,Reddit,neutral,0.0
Google Webmaster tools,analytics,1,5.0,2014-08-13 22:12:04,waverlyposter,Reddit,neutral,0.0
Filtered Views Just Not Adding Up,analytics,1,3.0,2014-08-14 11:27:59,Swiss91,Reddit,neutral,0.0
Resolving Differences in Data between Google AdWords and Analytics,analytics,2,0.0,2014-08-15 19:02:10,megalytic,Reddit,positive,0.3818
Information Is Power: Investing in Your Analytics,analytics,0,0.0,2014-08-16 04:36:07,DistilNetworks,Reddit,neutral,0.0
What is Business Analytics?,analytics,1,0.0,2014-08-16 10:32:17,learningimarticus,Reddit,neutral,0.0
Custom GA Dashboard w/ Assisted Conversions?,analytics,1,1.0,2014-08-19 19:08:46,db1189,Reddit,neutral,0.0
Interested in analytics as possible profession - all education in accounting.,analytics,1,3.0,2014-08-19 22:39:17,jerseyse410,Reddit,positive,0.4019
Mobile web traffic has nearly tripled on one app developer’s website,analytics,1,0.0,2014-08-20 02:04:05,[deleted],Reddit,neutral,0.0
Awesome Analytics Chrome Extension by Google,analytics,1,0.0,2014-08-21 02:05:46,dar1an,Reddit,positive,0.6249
Is anyone else having problems with Real-Time Overview crashing?,analytics,2,2.0,2014-08-21 11:11:24,fuutott,Reddit,negative,-0.4019
Happy to help you with Enhanced Ecommerce,analytics,3,6.0,2014-08-23 06:52:14,bsatani,Reddit,positive,0.7506
Google Voice Analytics: Is it possible?,analytics,2,10.0,2014-08-25 04:40:10,Dj_Nussdog,Reddit,neutral,0.0
[Dev] Tool to check how well your Google Analytics account is set up,analytics,1,1.0,2014-08-26 04:22:39,[deleted],Reddit,positive,0.2732
50+ Incredible Resources to learn Google Analytics,analytics,3,0.0,2014-08-26 12:01:50,webgoms,Reddit,neutral,0.0
What is Data Analytics,analytics,1,1.0,2014-08-26 12:55:35,alicebradly,Reddit,neutral,0.0
FB is on the Radar – Organizations Begin to Analyze Social Data in Earnest,analytics,1,0.0,2014-08-26 20:02:19,manikashah,Reddit,positive,0.5106
Business Analytics at Imarticus,analytics,1,0.0,2014-08-27 13:26:12,learningimarticus,Reddit,neutral,0.0
Using Google Tag Manager for Mobile,analytics,1,0.0,2014-08-27 23:23:29,dmbdba,Reddit,neutral,0.0
Twitter Opens Its Analytics Dashboard To Everyone!,analytics,14,1.0,2014-08-28 01:26:40,kkoolook,Reddit,neutral,0.0
Reduce or avoid the flicker of AB tests - jQuery .available() plugin,analytics,2,4.0,2014-08-28 02:43:33,johnanish,Reddit,negative,-0.296
The best way to pursue a business analytics,analytics,1,0.0,2014-08-28 13:12:01,learningimarticus,Reddit,positive,0.6369
What does '&lt;1' mean in Page Depth report / GA...?,analytics,2,5.0,2014-08-28 15:42:40,gutterandstars,Reddit,neutral,0.0
Twitter 2.0: Bigger and Better,analytics,1,0.0,2014-09-01 03:12:57,FR314,Reddit,positive,0.4404
Ptengine is disrupting website analytics,analytics,1,0.0,2014-09-02 18:19:23,rancea,Reddit,neutral,0.0
Want Your Company to Succeed? Use Your Head When It Comes to Marketing Analytics,analytics,1,0.0,2014-09-03 05:19:03,LillianPierson,Reddit,positive,0.5423
How A Data Scientist Thinks.,analytics,1,0.0,2014-09-03 09:42:30,kuna99,Reddit,neutral,0.0
What are visitors/sessions called after bounce rate? (or any other level),analytics,2,2.0,2014-09-05 05:57:04,MrMag00,Reddit,neutral,0.0
Optimize your business cost and revenue through banking &amp; financial services.,analytics,1,0.0,2014-09-08 08:44:49,lisataylor00,Reddit,positive,0.4939
Address specific business and operations challenges through ASAP,analytics,1,0.0,2014-09-08 08:57:01,ransinha,Reddit,positive,0.0772
Even my Grandma Can Do This Course- Jigsaw Academy Launches ‘Analytics for Business’ Course,analytics,1,0.0,2014-09-09 12:31:06,poojaprakash,Reddit,neutral,0.0
What is Data Analytics,analytics,1,0.0,2014-09-09 15:09:19,alicebradly,Reddit,neutral,0.0
The Hidden SaaS Metric: Cost of Cancellation,analytics,1,0.0,2014-09-09 15:42:50,scottmcquin,Reddit,neutral,0.0
Real estate agents and brokers will have better selection of apps as data standards catch on [x/RealEstateTechnology],analytics,1,0.0,2014-09-10 15:43:56,CitizenJosh,Reddit,positive,0.4404
4 SaaS Metrics That You Might Not Know,analytics,1,0.0,2014-09-10 21:29:50,scottmcquin,Reddit,neutral,0.0
Reduce your loss ratio through Claim Analytics.,analytics,0,0.0,2014-09-11 13:11:17,mariaswan007,Reddit,negative,-0.3182
Will the Cost of Customer Acquisition Kill Your Company?,analytics,1,0.0,2014-09-11 19:33:41,scottmcquin,Reddit,negative,-0.6908
Value of Advanced Analytics in Insurance.,analytics,1,0.0,2014-09-12 17:19:04,dineshkarthik1420,Reddit,positive,0.5267
How to Buy Services for Bot Detection and Mitigation - | Distil Networks,analytics,1,0.0,2014-09-12 21:11:36,DistilNetworks,Reddit,neutral,0.0
Business leaders prefer gut feeling to data,analytics,1,0.0,2014-09-13 09:39:36,lindiabradley,Reddit,positive,0.128
Could someone please explain what is tag management and Qubit Opentag?,analytics,2,11.0,2014-09-15 10:13:23,behrangsa,Reddit,positive,0.3182
Referral Traffic doesn't make sense,analytics,3,6.0,2014-09-15 12:39:24,Swiss91,Reddit,neutral,0.0
Essential Vitamins &amp; Minerals Your Body Requires.,analytics,1,0.0,2014-09-16 13:27:43,robo1990,Reddit,neutral,0.0
How to Use Google Analytics Website Search Reports,analytics,1,0.0,2014-09-16 23:52:20,funpakmaza,Reddit,neutral,0.0
How to get Google Analytics statistics directly on your own website?,analytics,1,0.0,2014-09-18 01:02:11,lionsground,Reddit,neutral,0.0
The Most Overlooked Thing Site Owners Forget About Conversion,analytics,0,2.0,2014-09-18 08:19:24,flowspark,Reddit,negative,-0.3167
Tips to Build a Successful Data Analytics Career In United Kingdom,analytics,1,0.0,2014-09-19 20:36:45,poojaprakash,Reddit,positive,0.765
Implementing Google Analytics Event Tracking,analytics,5,7.0,2014-09-22 11:51:03,LuizCentenaro,Reddit,neutral,0.0
The Administrator of the analytics page has disappeared off the face of the earth. Can I add a page with the web property id?,analytics,1,1.0,2014-09-22 15:17:14,dylansavage,Reddit,negative,-0.2263
Clarification regarding Google Analytics &amp; Multiple Properties,analytics,2,2.0,2014-09-23 11:19:00,nellyshark,Reddit,neutral,0.0
5 Ways to Boost Customer Retention for Insurers through Social Analytics,analytics,1,0.0,2014-09-23 11:58:59,riyasen007,Reddit,positive,0.4019
Piwik vs Google Analytics. A detailed review.,analytics,4,0.0,2014-09-24 02:21:44,brilliantzen,Reddit,neutral,0.0
Help with google analytics. Age demographics appearing as keywords.,analytics,1,3.0,2014-09-25 05:37:09,SilkAzula,Reddit,positive,0.4019
Calculating Lead Generation Value,analytics,1,0.0,2014-09-29 04:31:25,cometton,Reddit,positive,0.34
Help with analyzing 25 million data points.,analytics,4,11.0,2014-09-29 16:42:45,[deleted],Reddit,positive,0.4019
3 Google Analytics Hacks for Marketers,analytics,2,1.0,2014-09-30 13:56:03,kieranwils,Reddit,neutral,0.0
Getting a lot of spam referral traffic to my Home Page (what to do?) - Google Analytics,analytics,1,2.0,2014-10-01 13:29:31,SEOoBserve,Reddit,negative,-0.3612
eCommerce Analytics: Why you need it?,analytics,6,0.0,2014-10-02 19:34:22,MineWhat,Reddit,neutral,0.0
How does Google (Universal) Analytics set a first-party cookie? Thought only,analytics,1,8.0,2014-10-02 21:00:58,WAMP_WAMP,Reddit,neutral,0.0
"Newb question - by supporting Display Advertising, what exactly am I doing to my site or my users?",analytics,1,0.0,2014-10-03 15:27:03,super_serious_guy,Reddit,positive,0.4404
New Job with a large focus on analytics - Have questions about events and goals.,analytics,1,0.0,2014-10-03 17:10:23,Voxbox_1,Reddit,neutral,0.0
Tracking event goals. I'm pulling my hair out over this,analytics,0,7.0,2014-10-03 19:18:20,Dharma_Monkey,Reddit,neutral,0.0
Why Not A/B Testing is For Idiots,analytics,3,0.0,2014-10-03 19:47:31,cdrux,Reddit,neutral,0.0
"Survey of 1,000+ Websites Uses Google Analytics Data to Compare Engagement from Social Networks, Acquisition Channels, Mobile Devices",analytics,6,0.0,2014-10-06 17:27:47,megalytic,Reddit,positive,0.4588
Insurers Leveraging Social Media to Improve Customer Retention,analytics,1,0.0,2014-10-07 11:14:45,samdris,Reddit,positive,0.4404
Insurers Leveraging Social Media to Improve Customer Retention,analytics,1,0.0,2014-10-07 12:08:39,dineshkarthik1420,Reddit,positive,0.4404
Can anyone help me build a customized Google Analytics report?,analytics,1,3.0,2014-10-07 21:31:21,GoodTravelYoung,Reddit,positive,0.4019
Track our conversions back to the initial referrer to the website?,analytics,2,6.0,2014-10-07 23:45:43,mcrob,Reddit,neutral,0.0
How to calculate total time of all sessions?,analytics,2,2.0,2014-10-08 04:24:02,zanzibarmangosteen,Reddit,neutral,0.0
Discover Facts &amp; Myths about a Data Scientist,analytics,1,0.0,2014-10-08 09:02:03,akashdp,Reddit,neutral,0.0
Visualize Real Time Twitter Trends With Kibana,analytics,1,0.0,2014-10-08 11:19:04,harsh067,Reddit,neutral,0.0
Can we have a real talk about paid search?,analytics,1,0.0,2014-10-10 01:24:56,[deleted],Reddit,neutral,0.0
Classic GA still logs Linux box spiders as visits,analytics,4,1.0,2014-10-10 16:25:51,konamikode,Reddit,neutral,0.0
Анализ конкурентов в сервисе Spywords,analytics,1,0.0,2014-10-10 17:50:32,abramov-a-m,Reddit,neutral,0.0
GA iOS app: possible to see full referral paths?,analytics,1,0.0,2014-10-11 06:41:47,jackjohnbrown,Reddit,neutral,0.0
Web Analytics to Insights using Google Analytics,analytics,7,7.0,2014-10-11 23:22:14,WardMaker,Reddit,neutral,0.0
Predictive Analytics key to great software quality? Intro to Grip.QA,analytics,1,0.0,2014-10-12 20:00:11,TechID,Reddit,positive,0.6249
