title,subreddit,score,num_comments,created_date,author,platform,sentiment,sentiment_score
Using Google Analytics For Keyword Research,analytics,1,0.0,2012-11-09 17:13:45,onlinere,Reddit,neutral,0.0
Do You Know What Your Bounce Rate Is?,analytics,1,0.0,2012-11-09 18:12:47,michellestevens,Reddit,neutral,0.0
N00b GA E-commerce tracking question,analytics,2,5.0,2012-11-11 21:05:25,savocado,Reddit,negative,-0.3818
Business Outcomes | Strategy Analytics | Financial Analytics | Investment Analytics,analytics,1,0.0,2012-11-12 14:26:55,seenath,Reddit,neutral,0.0
What the Obama Emails teach us about Email Marketing,analytics,1,0.0,2012-11-14 22:09:55,[deleted],Reddit,neutral,0.0
Analysis,analytics,1,0.0,2012-11-16 01:27:01,[deleted],Reddit,neutral,0.0
Designing your Analytics Strategy | SALO Consulting,analytics,1,0.0,2012-11-19 22:58:58,SALOconsulting,Reddit,neutral,0.0
The Future of Online Display Ads (Infographic),analytics,1,0.0,2012-11-21 13:04:48,Bemuzed,Reddit,neutral,0.0
Big Data Analytics: How Moneyball has changed the game for everyone,analytics,1,0.0,2012-11-22 12:57:37,Beyondroid,Reddit,neutral,0.0
Omniture question - benchmarking our blog site,analytics,1,0.0,2012-11-23 17:00:24,[deleted],Reddit,neutral,0.0
Android vs iOS: which users are happier?,analytics,2,0.0,2012-11-26 21:55:38,Ifinoi,Reddit,positive,0.5267
"Web Analytics: How to Handle Direct Traffic, Not Provided, Dark Social and Do Not Track",analytics,1,0.0,2012-11-27 21:13:58,rightsource,Reddit,neutral,0.0
"Why your dashboards suck, and 4 things you can do about it",analytics,1,0.0,2012-11-27 23:41:18,HaveWhatShesHaving,Reddit,negative,-0.4404
"""On marketing's """"big data"""" opportunity and how small businesses can capitalize""",analytics,1,0.0,2012-11-28 00:37:09,JulianneOmlam,Reddit,positive,0.4215
Which analytics should my friend (really) believe? cirtex web statistics vs google analytics?,analytics,1,0.0,2012-11-29 23:33:20,captain_goodnight,Reddit,positive,0.5514
Dharmik ALL (Daily analysis for Dow Jones &amp;amp; Daily analysis for EUR/USD),analytics,1,0.0,2012-11-30 03:04:39,bartmartin252,Reddit,neutral,0.0
SEO Tools: Making Google Analytics Work For You,analytics,0,0.0,2012-12-02 20:57:27,Clundge,Reddit,neutral,0.0
Is there a tool that will let me manage multiple analytics?,analytics,2,11.0,2012-12-04 02:15:27,ragnvaldr2,Reddit,neutral,0.0
Mapping the Future: 3 Essential Terms You Must Redefine Today,analytics,1,0.0,2012-12-06 05:09:39,TL212,Reddit,neutral,0.0
Exporting a custom attributes report to Excel?,analytics,1,0.0,2012-12-07 01:31:38,[deleted],Reddit,positive,0.4588
Pimp your Analytics with multi-attribution marketing,analytics,1,1.0,2012-12-11 08:14:06,jbarb2903,Reddit,neutral,0.0
Is Your Brand Great At Digital Marketing? A Diagnostic Framework.,analytics,3,0.0,2012-12-12 09:42:07,Codefly,Reddit,positive,0.6249
Check out the SiteCatalyst Users Community on G+,analytics,0,2.0,2012-12-13 23:59:49,[deleted],Reddit,neutral,0.0
Need Help w/ Regular Expressions?  Here is a Handy RegEx Generator to Make Life Easy.,analytics,0,0.0,2012-12-19 14:48:11,sck419,Reddit,positive,0.6808
Google Chrome To Further Increase Not Provided,analytics,0,1.0,2012-12-20 23:51:35,roiwriter,Reddit,positive,0.3182
Bounce Rate: Die Absprungrate bei Einstieg - gradlinig.com,analytics,1,0.0,2012-12-21 10:12:47,gradlinigcom,Reddit,negative,-0.5994
How to Find Google Analytics Tracking Code? ,analytics,1,0.0,2012-12-26 13:12:04,rosesmark,Reddit,neutral,0.0
App Annie: Dashboard for App and Ad Revenue,analytics,0,0.0,2014-01-01 20:34:32,[deleted],Reddit,neutral,0.0
Learn Advanced Web Analytics and Get Certification,analytics,0,0.0,2014-01-02 13:51:07,daiaindia,Reddit,positive,0.25
Official Google Webmaster Central Blog: More detailed search queries in Webmaster Tools,analytics,3,1.0,2014-01-07 19:33:24,Fiddler_s_green,Reddit,neutral,0.0
App Giveaway: 3 Months of Clicky Pro Plus FREE,analytics,0,0.0,2014-01-08 15:52:22,treppin,Reddit,positive,0.6166
"Formisimo, A U.K. Startup Tackling Web Form Friction, Exits Beta &amp;amp; Launches Price Plans",analytics,1,0.0,2014-01-08 18:53:42,tomcnew,Reddit,neutral,0.0
Need help with my internship.,analytics,1,4.0,2014-01-09 02:28:06,mostdiabolical,Reddit,positive,0.4019
Need help connecting the dots,analytics,2,5.0,2014-01-10 00:26:55,northwoodrow,Reddit,positive,0.4019
What does your Analytics reports look like?,analytics,10,9.0,2014-01-10 22:36:15,havock,Reddit,positive,0.3612
How to display exit page per city in GA?,analytics,1,2.0,2014-01-12 23:44:33,hugepnus,Reddit,neutral,0.0
(not provided) - How do I solve it?,analytics,2,4.0,2014-01-13 12:16:00,nooki1,Reddit,positive,0.2023
Big Data Analytic Trends for 2014,analytics,1,0.0,2014-01-13 14:49:59,sunita00,Reddit,neutral,0.0
snorkel - open source event analytics with mongo,analytics,2,1.0,2014-01-13 23:12:25,okayzed,Reddit,neutral,0.0
Is it possible to do this?,analytics,1,3.0,2014-01-14 12:08:14,no-one_ever,Reddit,neutral,0.0
Predictive Analytics &amp; Hadoop Consulting Services - Aureus,analytics,0,0.0,2014-01-14 15:27:28,lalit00,Reddit,neutral,0.0
Quick Site Status Report,analytics,1,2.0,2014-01-15 17:42:40,havock,Reddit,neutral,0.0
Aureus - Detect Fraud &amp; Improve your Finance Status,analytics,1,0.0,2014-01-16 07:08:45,Swaraj3,Reddit,negative,-0.2263
"Hey Reddit, help! We have some interesting ideas on how to improve subscriptions and freemium, esp. for games, and need your help",analytics,2,0.0,2014-01-17 00:55:39,wwvuillemot,Reddit,positive,0.8832
Need help with creating an independent study project!,analytics,3,0.0,2014-01-17 23:09:24,yxjxy,Reddit,positive,0.636
Add Sensor Data Experience to Your Analytics Toolbox,analytics,4,0.0,2014-01-18 08:34:28,LillianPierson,Reddit,neutral,0.0
Real Time Dashboard widget for page load times and performance.,analytics,2,1.0,2014-01-21 04:56:39,hugepnus,Reddit,neutral,0.0
Metrigen just added new option to track your activity on Google+ social network!,analytics,2,0.0,2014-01-21 19:45:20,andiscesnieks,Reddit,neutral,0.0
"Tool to track user scroll position, hover, anything, in Google Analytics",analytics,1,0.0,2014-01-22 14:19:18,[deleted],Reddit,neutral,0.0
Easy ways to track metrics in mobile app user acquisition funnels,analytics,1,0.0,2014-01-22 22:21:30,pratik87,Reddit,positive,0.5106
"Who is using Google Tag Manager? Any Tips, Tricks, or Pitfalls? (X-Post from r/PPC)",analytics,3,1.0,2014-01-23 07:02:36,Emerald_Triangle,Reddit,negative,-0.2168
Anyone in /r/analytics looking for a new role? I am hiring someone to one of my teams at Accenture. It is a level 9 or 10 (depending on experience) and will specialize in customer experience analytics.,analytics,1,3.0,2014-01-23 16:54:44,cronkytonk,Reddit,neutral,0.0
Google Analytics In Real Life - Landing Page Optimization,analytics,2,0.0,2014-01-23 18:53:55,chasincaroline,Reddit,positive,0.3818
Can anyone direct me to a good website for analytics/statistics internships?,analytics,2,2.0,2014-01-24 00:23:20,thirdfryeblind,Reddit,positive,0.4404
"Dear Reddit, how do you find out which web analytics software is a website using?",analytics,7,12.0,2014-01-26 14:03:34,chukchacha,Reddit,positive,0.3818
Tablet Reporting - Landscape vs. Portrait. Is it worthwhile to report on this?,analytics,3,2.0,2014-01-27 00:38:46,chinchillin88,Reddit,positive,0.34
Economía útil y de la buena,analytics,1,0.0,2014-01-29 02:09:04,DomingoFHdezA,Reddit,neutral,0.0
Analyzed,analytics,1,0.0,2014-01-30 01:22:09,[deleted],Reddit,neutral,0.0
"""Analytics Event Tracking code DOESN'T WORK. Please help me. Using Universal Analytics (analytics.js) and checking to see if its working with Chrome Add-on """"Event Tracking Tracker""""""",analytics,1,4.0,2014-01-31 00:24:51,helpmeanalytics,Reddit,negative,-0.4973
Handling my company's addiction to precision.,analytics,8,7.0,2014-01-31 19:23:39,Bravot,Reddit,neutral,0.0
Syllabusrate,analytics,3,0.0,2014-02-01 12:42:01,kr200,Reddit,neutral,0.0
Trend-Setting Products in Data for 2014,analytics,1,0.0,2014-02-05 16:42:17,ipachanga,Reddit,neutral,0.0
New Vs Returning Report,analytics,1,6.0,2014-02-06 12:30:04,XblraCe,Reddit,neutral,0.0
Discovering Your Audience in YouTube Analytics,analytics,1,0.0,2014-02-07 01:12:38,BoomKareena,Reddit,neutral,0.0
"For those of you using Google Tag Manager, can you help me out with my dataLayer? (X-Post from /r/PPC)",analytics,2,6.0,2014-02-07 06:09:50,Emerald_Triangle,Reddit,positive,0.4019
"Next generation analytics with yarn, spark and graph lab",analytics,1,0.0,2014-02-07 16:01:15,amishjain,Reddit,positive,0.2263
How to I customize exports?,analytics,1,3.0,2014-02-08 20:26:28,advrobot,Reddit,neutral,0.0
ROI Factory is the ultimate marketing analytics and custom dashboard platform for mid-sized companies.,analytics,0,0.0,2014-02-09 10:59:26,[deleted],Reddit,neutral,0.0
The upcoming trends for 2014: Big Data &amp; Analytics.,analytics,0,0.0,2014-02-10 10:31:10,rishinair,Reddit,neutral,0.0
BrightTag is the most popular Tag Management System across all US auto makers,analytics,0,1.0,2014-02-10 11:06:32,iastream,Reddit,positive,0.4754
Transformation in Insurance Industry using Advanced Analytics.,analytics,0,0.0,2014-02-10 11:47:38,rishinair,Reddit,positive,0.25
Google Analytics Content Groups for Higher Ed Marketing,analytics,1,0.0,2014-02-10 23:19:47,blanchek,Reddit,neutral,0.0
Curse you excel,analytics,15,1.0,2014-02-11 00:19:37,TwoScoopsPlease,Reddit,negative,-0.128
13 Free Google Analytics Tools To Use Everyday,analytics,1,0.0,2014-02-11 14:00:37,graemebenge,Reddit,positive,0.5106
Mismatch between back end e-commerce transaction data and Universal Analytics Conversion Reports (Using Magento extension),analytics,0,6.0,2014-02-11 15:34:49,gutterandstars,Reddit,neutral,0.0
Can anyone point me in the direction of training material for CoreMetrics?,analytics,1,2.0,2014-02-11 17:52:36,mikegaz,Reddit,neutral,0.0
Keyword Not Provided in Google Analytics - Part 1: Queries Report,analytics,5,6.0,2014-02-12 00:43:06,Julesssss,Reddit,neutral,0.0
"Understanding Search Analytics: Making Better, Data-Driven Decisions",analytics,1,0.0,2014-02-12 07:20:14,BoomKareena,Reddit,positive,0.4404
Article+video: Join your CRM data with Google Analytics using BigQuery.,analytics,2,1.0,2014-02-12 19:33:33,fhoffa,Reddit,positive,0.296
SIX things you can do to be a better web analyst.,analytics,0,3.0,2014-02-13 05:03:19,jrhose,Reddit,positive,0.4404
Revamping the Insurance Industry using Big Data Analytics.,analytics,1,0.0,2014-02-13 08:25:37,rishinair,Reddit,neutral,0.0
Riddle me this: Most transactions are before the property was created,analytics,1,4.0,2014-02-13 17:30:19,Expressman,Reddit,positive,0.25
Google analytics - need data for a uni project,analytics,1,0.0,2014-02-13 20:39:35,notmudkipfucker,Reddit,neutral,0.0
Tag Inspector: Find tags firing on your site,analytics,3,1.0,2014-02-14 00:41:32,fnurtfnurt,Reddit,negative,-0.34
Only 40% of Global Web Traffic Comes From Humans - Pinoria,analytics,3,2.0,2014-02-14 02:12:11,jinjin3662521,Reddit,neutral,0.0
Love is a Number Data by Aureus Analytics,analytics,1,0.0,2014-02-14 12:01:33,rishinair,Reddit,positive,0.6705
Noob question: trackevent goal tracking counts,analytics,2,4.0,2014-02-14 23:37:18,random_nickname,Reddit,negative,-0.0516
"Free marketing ROI calculator includes all costs for true marketing ROI, not just Return on Ad Spend. Download and modify in Excel as needed.",analytics,3,0.0,2014-02-15 21:08:48,afm528,Reddit,positive,0.8442
Revamping the Insurance Industry using Big Data Analytics.,analytics,1,0.0,2014-02-17 01:35:22,[deleted],Reddit,neutral,0.0
Google Analytics App - I have dashboard (free) - kinda sucks for any real metrics I want - Is the upgrade worth it?,analytics,2,3.0,2014-02-18 07:46:06,Emerald_Triangle,Reddit,positive,0.5095
Transformation of Technology using Big Data &amp; Analytics,analytics,1,0.0,2014-02-18 09:44:53,rishinair,Reddit,neutral,0.0
“Not provided” soon at 100%,analytics,2,0.0,2014-02-18 12:42:10,Julesssss,Reddit,neutral,0.0
Custom Alerts,analytics,1,0.0,2014-02-19 16:50:31,lauradolores,Reddit,neutral,0.0
Web analytics projects: get off to a good start by avoiding these 10 errors,analytics,1,0.0,2014-02-21 15:53:59,david33000,Reddit,negative,-0.2263
Anyone using Heap Analytics to track interactions on their site?,analytics,0,1.0,2014-02-21 16:12:03,[deleted],Reddit,neutral,0.0
GA API returning different results,analytics,1,6.0,2014-02-21 17:01:49,havock,Reddit,neutral,0.0
" """"visits""""", C$2,189,,For example in excel to get organic visits: =getgadata(getgaauthenticationtoken(D$1, C$8,Reddit,neutral,0.0
Is it possible to track visitors after leaving your site without going through external links?,analytics,1,1.0,2014-02-22 00:28:36,[deleted],Reddit,neutral,0.0
Page Console,analytics,1,0.0,2014-02-25 18:11:46,Veradley,Reddit,neutral,0.0
Google Analytics,analytics,1,0.0,2014-02-26 15:45:54,deepasri,Reddit,neutral,0.0
What will happen to Adobe Analytics?,analytics,5,18.0,2014-02-27 00:21:17,jrhose,Reddit,neutral,0.0
Managing a rebrand,analytics,1,1.0,2014-02-27 12:22:46,XblraCe,Reddit,neutral,0.0
GA reporting different stats today than it was yesterday,analytics,1,4.0,2014-02-27 13:23:16,konamikode,Reddit,neutral,0.0
5 dirty little secrets about Google Analytics funnels,analytics,3,10.0,2014-02-27 16:34:24,cyssou,Reddit,negative,-0.3612
"""We need more responses! Four Question Marketing Analytics Survey extends Adobe's report """"Digital Distress: What Keeps Marketers Up At Night"""". 60 seconds and you could win $50.""",analytics,3,0.0,2014-02-28 14:00:41,afm528,Reddit,positive,0.2942
How do you guys use API in your line of work?,analytics,5,10.0,2014-03-01 08:13:07,ferae_naturae,Reddit,neutral,0.0
GA: Two funnels with same goal?,analytics,0,1.0,2014-03-02 00:29:40,jwjody,Reddit,positive,0.1027
What's the best way to filter your own IP address from google analytics reports? My IP keeps changing,analytics,1,4.0,2014-03-02 17:09:13,ThePumptrackDudeGuy,Reddit,positive,0.6369
BigML + Tableau = Powerful Predictive Visualizations for Everyone,analytics,1,0.0,2014-03-03 19:50:09,osroca,Reddit,positive,0.4215
Want to become a analyst; which graduate program should I look at?,analytics,4,6.0,2014-03-04 03:01:43,Feurbach_sock,Reddit,positive,0.0772
Getting valuable Insights from the 16th Global Conference of Actuaries,analytics,1,0.0,2014-03-05 07:52:04,robo1990,Reddit,positive,0.4767
Customized Pens that suits your needs.,analytics,1,0.0,2014-03-05 11:32:25,[deleted],Reddit,neutral,0.0
Removing Session Duration Outliers from GA,analytics,1,0.0,2014-03-05 20:47:36,brentlarue,Reddit,neutral,0.0
Upload offline conversion into GA,analytics,3,5.0,2014-03-05 21:22:44,gregsfriend,Reddit,negative,-0.128
"Google's Q4 2013 In Review, Higher Education Search Analysis Report",analytics,1,0.0,2014-03-05 21:38:17,PhilippeTaza,Reddit,neutral,0.0
"Any time I submit a link from my site to StumbleUpon, six visitors in Beverly Hills immediately show in GA - what's that about?",analytics,2,7.0,2014-03-06 18:32:17,goleg,Reddit,neutral,0.0
Retail web analytics must broaden: News from warc.com,analytics,0,0.0,2014-03-08 17:34:12,bradyjiang,Reddit,neutral,0.0
"I'm starting an entry-level analytics job next week. I have little-to-no experience working with analytics. What are some good resources for me to learn more on my own? (blogs, YouTube channels, books, etc.)",analytics,1,0.0,2014-03-09 18:19:50,[deleted],Reddit,positive,0.4404
Google analytics broken?,analytics,1,5.0,2014-03-09 21:15:14,beyonsense,Reddit,negative,-0.4767
Tracking Ajax Page-views in Universal Analytics using Tag Manager,analytics,3,2.0,2014-03-10 19:18:35,CZKelly,Reddit,neutral,0.0
1 Reason You Have No Excuse Not to Have Clicky Pro Plus (Hint: We’re Giving It Away for Free!),analytics,0,0.0,2014-03-11 20:25:12,treppin,Reddit,positive,0.6975
Would someone being linked to my website from an email show up on GA?,analytics,3,7.0,2014-03-11 21:48:50,mostdiabolical,Reddit,neutral,0.0
Track your mac os x applications easily and quickly with analytics tools | DeskAppTrack,analytics,0,0.0,2014-03-12 10:54:45,betacrul,Reddit,positive,0.34
A soft tool to build funnels on the go,analytics,0,0.0,2014-03-12 14:22:17,[deleted],Reddit,positive,0.1027
Enhance your business by integrating enterprise application.,analytics,1,0.0,2014-03-12 14:57:09,robo1990,Reddit,neutral,0.0
Which KPIs to measure using mobile analytics?,analytics,3,0.0,2014-03-13 17:19:37,CuriousAboutTech,Reddit,neutral,0.0
Assets &amp; The Grid: A Continuum Story,analytics,1,0.0,2014-03-13 20:36:29,BlackVeatch,Reddit,positive,0.1779
3Scale API Analytics,analytics,0,0.0,2014-03-15 02:17:14,ellisdonald92,Reddit,neutral,0.0
Retailers look to analytics to crack down on fraud,analytics,5,0.0,2014-03-17 17:49:11,mtl1015,Reddit,negative,-0.5859
Crazy Egg – The Best Website To Check What Visitors Do on Your Website,analytics,1,0.0,2014-03-18 19:04:27,xaban,Reddit,positive,0.4215
Hybrid Data Store,analytics,1,0.0,2014-03-19 09:53:14,tapaskannoujia,Reddit,neutral,0.0
Reinforce your business quality through testing methodologies.,analytics,1,0.0,2014-03-19 15:26:39,robo1990,Reddit,neutral,0.0
"Facebook URL tags -- can see it on the Content Overview Dashboard, but not sure where to find it elsewhere?",analytics,2,1.0,2014-03-20 16:49:52,glacierfanclub,Reddit,negative,-0.3491
"Stability Solutions, Microbiology Testing Services",analytics,0,0.0,2014-03-21 08:31:57,Thermolab14,Reddit,positive,0.1779
Optimize your business cost and revenue through banking &amp; financial services.,analytics,1,0.0,2014-03-21 09:21:55,robo1990,Reddit,positive,0.4939
Measuring Offline Transactions in Google Analytics,analytics,1,0.0,2014-03-21 21:16:52,jordanscott7,Reddit,negative,-0.128
How to Enable Google Analytics Demographics and Interest Reports,analytics,1,0.0,2014-03-23 03:19:46,softronixredplanet,Reddit,positive,0.4588
"Phone Call Tracking on a Budget with Twilio and Google Universal Analytics. First post on new blog, feedback appreciated!",analytics,6,0.0,2014-03-23 06:58:12,dbgonz,Reddit,positive,0.5562
Does anyone here uses Semantria?,analytics,1,2.0,2014-03-24 13:05:34,TheDhakkan,Reddit,neutral,0.0
Decision Between two MS Analytics Programs,analytics,4,11.0,2014-03-24 14:40:15,skeeza17,Reddit,neutral,0.0
Build effective strategies through business analytics solutions.,analytics,1,0.0,2014-03-24 16:02:51,robo1990,Reddit,positive,0.5859
Anyone have experience with or thoughts about ExpressVisits?,analytics,1,0.0,2014-03-24 21:13:11,davepe,Reddit,neutral,0.0
Is it possible to track a dialed number in Google Analytics? Details inside,analytics,1,4.0,2014-03-24 22:04:41,jm3281,Reddit,positive,0.0772
Agencies should give clients Google Analytics reports,analytics,3,0.0,2014-03-25 03:01:16,megalytic,Reddit,neutral,0.0
Top 10 Free Real-Time Web Analytics Services,analytics,4,1.0,2014-03-25 11:06:22,danieltandaman,Reddit,positive,0.6249
Tailor Made Enterprise Level Solutions,analytics,1,0.0,2014-03-25 16:30:35,Janedavy123,Reddit,positive,0.1779
How do you make a google spreadsheet that can pull data into it from both Google Analytics and Adwords?,analytics,5,1.0,2014-03-26 17:17:52,kenyob,Reddit,neutral,0.0
How to build a great analytics solution - explained.,analytics,2,1.0,2014-03-27 04:29:29,[deleted],Reddit,positive,0.7506
Social Media Analytics - It's A Never Ending Marathon [Infographic],analytics,1,0.0,2014-03-27 10:52:19,stuartjdavidson,Reddit,neutral,0.0
Infographic on elections Data &amp; Statistics of India 2014.,analytics,1,0.0,2014-03-27 13:24:53,robo1990,Reddit,neutral,0.0
Introducing QQL: The First Social Media Analytics Query Language,analytics,2,2.0,2014-03-27 18:57:15,nierhoff,Reddit,neutral,0.0
Marketing Technologist Implementation Projects and Administration,analytics,0,0.0,2014-03-27 19:37:29,afm528,Reddit,neutral,0.0
Some Conversions not showing up - in AdWords or GA - any ideas? (X-Post-ish from /r/PPC),analytics,1,6.0,2014-03-28 05:18:22,Emerald_Triangle,Reddit,neutral,0.0
In-Page Web Analytics,analytics,1,1.0,2014-03-30 15:26:24,Angel359,Reddit,neutral,0.0
A list of Omniture and Google Analytics Debuggers,analytics,8,2.0,2014-03-30 17:56:28,bmann008,Reddit,neutral,0.0
5 Key SaaS Metrics You Need To Know &amp; How To Calculate Them,analytics,4,0.0,2014-04-01 02:23:22,parzo,Reddit,neutral,0.0
trying to eatimate page views on a competitors sitr,analytics,1,0.0,2014-04-02 05:17:18,[deleted],Reddit,neutral,0.0
Heap Analytics vs Mixpanel - Which is better?,analytics,7,1.0,2014-04-03 22:39:38,radamantium,Reddit,positive,0.4404
Transformation of Big Data in health care industry.,analytics,1,0.0,2014-04-04 15:40:16,arekarrishi90,Reddit,positive,0.4939
[META] Discussion about breaking of web analytics and data analytics into different subs,analytics,1,0.0,2014-04-04 20:12:37,[deleted],Reddit,neutral,0.0
"Google.com Referral Traffic, cannibalizing Google Organic Search Traffic",analytics,5,2.0,2014-04-04 23:21:58,undeadsushi,Reddit,neutral,0.0
A Conversion Hacker’s List of Conversion Optimization Tools,analytics,5,2.0,2014-04-06 15:58:05,yourconversionsucks,Reddit,positive,0.3818
Assess your data through Claim Analytics.,analytics,1,0.0,2014-04-07 16:23:09,arekarrishi90,Reddit,neutral,0.0
Don’t stop your A/B tests part-way through,analytics,5,1.0,2014-04-07 21:20:22,raviparikh2,Reddit,negative,-0.296
Analytics Deep Dive Part One: 4 Metrics Your Company is Probably Reading Wrong,analytics,5,1.0,2014-04-08 21:47:43,adityakhannamech,Reddit,negative,-0.4767
Google Publishes New Technology with the Invention of the Universal Google Analytics | SEM,analytics,1,0.0,2014-04-08 22:41:37,maheshgiri,Reddit,neutral,0.0
Twitter authentication hurts making sense of referrals,analytics,1,0.0,2014-04-09 21:00:54,colinmathews,Reddit,negative,-0.4767
Roll up account but only for some properties ?,analytics,1,3.0,2014-04-10 03:41:01,hippister,Reddit,neutral,0.0
How To Create Your Own Formula For Social Media Success With QQL,analytics,2,0.0,2014-04-15 17:42:58,nierhoff,Reddit,positive,0.7003
Qmonix HTTP communication protocol documentation is now available.,analytics,1,0.0,2014-04-16 11:34:09,qmonix,Reddit,neutral,0.0
LaMetric shows Google Analytics and App figures metrics for the whole team in the office,analytics,0,0.0,2014-04-16 12:57:58,AnastasiaLav,Reddit,neutral,0.0
Analyzing how consumers are using an app - do you agree that it's one of the biggest challenges facing mobile marketers?,analytics,1,1.0,2014-04-16 15:24:02,CuriousAboutTech,Reddit,positive,0.4215
3 tips to ensure your digital strategy doesn’t stall – part 1,analytics,2,0.0,2014-04-17 19:55:34,jhornby64,Reddit,positive,0.2023
Is it possible to separate visits by Google domain?,analytics,1,2.0,2014-04-17 20:23:11,imyxle,Reddit,neutral,0.0
New Relic v. Google Analytics (for marketing),analytics,1,0.0,2014-04-18 15:26:30,atwater1988,Reddit,neutral,0.0
A Case Study About Lead Generation From Our Partner Crafted,analytics,2,7.0,2014-04-22 14:53:23,taniamorgen,Reddit,neutral,0.0
Question on YouTube analytics,analytics,1,0.0,2014-04-23 13:46:07,sanjana_s,Reddit,neutral,0.0
How/Why Agencies use Megalytic for their Google Analytics Client Reports,analytics,0,0.0,2014-04-23 21:42:00,megalytic,Reddit,neutral,0.0
The best iphone app for Google Analytics,analytics,1,0.0,2014-04-24 04:44:34,e-cord,Reddit,positive,0.6369
So one of my GA accounts appears to be missing...,analytics,2,6.0,2014-04-24 17:14:58,gutterandstars,Reddit,negative,-0.296
Box Tech Blog » Solving D3 Graph Interaction In StatusWolf [x-post from d3js],analytics,2,0.0,2014-04-25 04:33:46,discogestalt,Reddit,positive,0.34
Tools for analyzing Tweets content????,analytics,1,4.0,2014-04-27 17:27:51,hsilvar,Reddit,neutral,0.0
What are the biggest problems you face in your job as an analyst?,analytics,6,10.0,2014-04-27 18:18:27,meenamaesa,Reddit,negative,-0.4019
How can I get an internship in Analytics with little/no experience?,analytics,1,9.0,2014-04-28 12:59:13,seby408,Reddit,neutral,0.0
17 Google Analytics Worth Measuring for Local SEO,analytics,0,0.0,2014-04-28 15:53:45,csheehy,Reddit,positive,0.2263
Get your hands on Universal Analytics from Google Analytics,analytics,1,0.0,2014-04-29 16:58:43,farhanfawzer,Reddit,neutral,0.0
Dimension Widening USE-CASE: Integrate Your SEO Data into Universal Analytics,analytics,1,0.0,2014-04-30 13:30:53,bsatani,Reddit,neutral,0.0
Does anyone else have a goal to reach every country in the world?,analytics,5,4.0,2014-05-01 02:44:08,geotagger,Reddit,neutral,0.0258
Google analytics Goal Funnel is weird....,analytics,2,9.0,2014-05-01 19:12:18,thevinesevolve,Reddit,negative,-0.1531
Why do odd cities show up in Google Analytics data for hyperlocal websites?,analytics,3,2.0,2014-05-02 06:53:49,wredlich,Reddit,negative,-0.3182
Calq.io - Analytics for custom data. Looking for feedback. Test for free.,analytics,3,5.0,2014-05-02 15:41:38,RRAway,Reddit,positive,0.5106
Any tips for the graduate analysts?,analytics,2,4.0,2014-05-03 11:51:21,woyalwumble,Reddit,neutral,0.0
Advice on tracking pageviews by Author on Wordpress in Google Analytics,analytics,2,3.0,2014-05-04 21:34:22,glenbelt,Reddit,neutral,0.0
Is there any way of finding out the popularity distribution of audio formats among torrenters/illegal downloaders?,analytics,2,1.0,2014-05-05 00:15:13,Mushraman,Reddit,positive,0.4767
Any analysts here going to the E-Metrics Summit in Toronto?,analytics,1,1.0,2014-05-06 19:56:33,eddyofyork,Reddit,neutral,0.0
Activating Google Universal Analytics with Adobe's DTM,analytics,3,1.0,2014-05-07 00:45:25,RRS_ATL,Reddit,neutral,0.0
Audit an entire website's Google Analytics implementation (Feedback welcomed),analytics,1,2.0,2014-05-07 17:59:27,simohayha,Reddit,positive,0.34
Setting up advanced analytics: Where do you start?,analytics,2,0.0,2014-05-07 18:57:35,mtl1015,Reddit,positive,0.25
Video: Lean Analytics: One Metric That Matters (OMTM),analytics,0,0.0,2014-05-09 12:44:01,Habitualcaveman,Reddit,neutral,0.0258
