title,subreddit,score,num_comments,created_date,author,platform,sentiment,sentiment_score
How To Install Google Analytics On A Self Hosted WordPress In 2015,analytics,1,0.0,2014-10-13 02:53:54,ubaid77,Reddit,neutral,0.0
Kissmetrics or mixpanel?,analytics,1,0.0,2014-10-14 02:27:19,[deleted],Reddit,neutral,0.0
How do you manage during the wild west of analytics?,analytics,0,1.0,2014-10-14 20:12:39,mtl1015,Reddit,neutral,0.0
"My company recently came out with this, Introducing Conversation Anaylitics",analytics,1,0.0,2014-10-14 20:13:33,Bernie_Beaver,Reddit,neutral,0.0
Filtering Your BOT Traffic with Google Analytics,analytics,1,0.0,2014-10-14 22:01:21,VoodooAlerts,Reddit,neutral,0.0
Attribute Content Groups to Conversions,analytics,1,1.0,2014-10-16 02:47:17,essee-bro,Reddit,neutral,0.0
"Benchmarking Analytics Performance: The Options, Dos, Don'ts",analytics,1,0.0,2014-10-16 13:44:53,ShariqEhsan,Reddit,neutral,0.0
Announcing User Insights by Taplytics,analytics,1,1.0,2014-10-16 19:22:42,cdrux,Reddit,neutral,0.0
6 Social Media Analytics Tools for Merchants,analytics,0,0.0,2014-10-18 15:36:36,MineWhat,Reddit,neutral,0.0
Firesale for analytics amongst CIO,analytics,1,0.0,2014-10-20 00:13:04,illuminairi,Reddit,neutral,0.0
How can key visual mobile metrics help you improve your app’s design?,analytics,1,0.0,2014-10-20 14:37:55,CuriousAboutTech,Reddit,positive,0.6808
"Extract, Prepare and Blend your data with Big Data Analytics tools",analytics,1,0.0,2014-10-21 14:58:25,Rohitin34,Reddit,neutral,0.0
Exploring Cohort Analysis - Part One,analytics,3,0.0,2014-10-21 16:44:27,mariotalavera,Reddit,neutral,0.0
84% Of Enterprises See Big Data Analytics Changing Their Industries' Competitive Landscapes In The Next Year,analytics,2,0.0,2014-10-22 19:34:05,worldcupforlife,Reddit,positive,0.1779
TaxHash - Need Assistance in getting Accounting team to 'hash' out streaming accounting system for smart devices. : Accounting,analytics,2,0.0,2014-10-22 20:53:15,onexiv,Reddit,positive,0.4019
Suspected Hacking - Now thousands of sessions from SPAM urls,analytics,3,4.0,2014-10-23 18:35:53,Scottoiler,Reddit,negative,-0.6289
Service provider vs network domain dimension,analytics,2,1.0,2014-10-23 23:05:10,lentebriesje,Reddit,neutral,0.0
A very basic Google Analytics question,analytics,2,4.0,2014-10-24 11:11:17,Waiorua,Reddit,neutral,0.0
Career Advice - progressing up the ladder?,analytics,5,17.0,2014-10-24 19:14:24,failcookie,Reddit,neutral,0.0
All the best GA and GTM blogs collected in one place,analytics,4,4.0,2014-10-24 21:11:44,shawne,Reddit,positive,0.6369
How to Setup Google Analytics: 5 Quick Videos That Make it Easy,analytics,1,0.0,2014-10-24 21:35:27,learninbound,Reddit,positive,0.4404
With Big Data Comes Big Opportunity: Ensure Against Gender Pay Gaps,analytics,1,0.0,2014-10-25 23:43:56,duncanpredicts,Reddit,positive,0.6124
Experiential Learning,analytics,1,0.0,2014-10-27 12:03:09,learnanalyttica,Reddit,neutral,0.0
Bing Ads Launches Universal Event Tracking,analytics,1,0.0,2014-10-27 18:14:21,ScriptilabsIMS,Reddit,neutral,0.0
3 Reasons Why You Should be Monitoring Session Times,analytics,1,0.0,2014-10-29 02:12:40,VoodooAlerts,Reddit,neutral,0.0
Career Advice - Where to Begin,analytics,1,0.0,2014-10-29 03:32:14,EgregiousDeviation,Reddit,neutral,0.0
Brillio Expands Advanced Analytics Capabilities with Acquisition of Marketelligent,analytics,1,0.0,2014-10-29 18:21:14,bethtrier1,Reddit,positive,0.34
Best Practice for GA Tags on Web (Universal VS Standard) &amp; GTM,analytics,1,6.0,2014-10-30 03:54:45,Flichman,Reddit,positive,0.6369
Simplified Big Data Analytics,analytics,1,1.0,2014-10-30 13:19:14,rautsan,Reddit,neutral,0.0
Google Analytics | Beginners Guide - Chapter 1 | Video Blog,analytics,1,0.0,2014-10-30 22:43:07,ericNELSON1964,Reddit,neutral,0.0
Why I Don’t Put Recommendations on Dashboards,analytics,1,0.0,2014-10-31 10:28:20,LukasGrebe,Reddit,neutral,0.0
Using Google Analytics Events to Track Engagement,analytics,1,2.0,2014-10-31 14:53:01,megalytic,Reddit,positive,0.4588
How to create a scatterplot in R [OC],analytics,0,4.0,2014-11-01 16:01:44,SharpSightLabs,Reddit,positive,0.2732
"RFM Customer Segmentation in R, Pandas and Apache Spark",analytics,1,0.0,2014-11-02 21:50:52,whiteraven2,Reddit,positive,0.2263
"10 sites, need one overview for all",analytics,1,0.0,2014-11-03 09:46:44,SEM_123,Reddit,neutral,0.0
thereMustBeA (betterWay) ;,analytics,1,0.0,2014-11-03 17:57:28,mikeylieberman,Reddit,neutral,0.0
How A/B Testing Works (for Non-Mathematicians),analytics,1,0.0,2014-11-04 01:05:02,innoarchitech,Reddit,neutral,0.0
How Webplio provides insights from Google Analytics for easier website optimization,analytics,2,0.0,2014-11-04 02:01:50,WardMaker,Reddit,positive,0.6597
Giving pageviews correct paths from a different subdomain with GTM,analytics,1,6.0,2014-11-04 12:18:35,jh0nn,Reddit,positive,0.34
COMO CONTROLAR LAS ESTADISTICAS DE TU WEB,analytics,1,0.0,2014-11-04 17:20:19,MejorConsejos,Reddit,neutral,0.0
Tracking an iframe form from another site,analytics,2,5.0,2014-11-05 01:05:56,[deleted],Reddit,neutral,0.0
Google Analytics | Beginners Guide - Chapter 2,analytics,1,0.0,2014-11-06 00:29:59,ericNELSON1964,Reddit,neutral,0.0
How to reject and remove SeMalt Traffic today...,analytics,1,0.0,2014-11-07 13:31:17,teddingham,Reddit,negative,-0.4019
How to create a digital analytics portfolio,analytics,7,0.0,2014-11-07 18:11:36,_binnie_,Reddit,positive,0.2732
Regarding implementation what is bi framework?,analytics,3,3.0,2014-11-08 03:11:18,Dr_Monkee,Reddit,neutral,0.0
The Consequences of Workforce Management without Analytics.,analytics,1,0.0,2014-11-10 12:08:36,tickto-inc,Reddit,neutral,0.0
"CDK Global is looking for a Support Analyst in Hungerford, UK",analytics,1,0.0,2014-11-10 17:02:42,JulieMellson,Reddit,positive,0.4019
Data Mining Orange County (Orlando Area) Crime,analytics,0,0.0,2014-11-11 04:47:50,[deleted],Reddit,negative,-0.5423
Making advanced analytics work for you,analytics,2,1.0,2014-11-12 15:28:00,jehb,Reddit,positive,0.25
Google vs Piwik Analytics discrepancy,analytics,2,3.0,2014-11-13 19:01:29,cabear,Reddit,neutral,0.0
"Where the data science jobs are, by sector and by state",analytics,6,0.0,2014-11-15 08:32:11,SharpSightLabs,Reddit,neutral,0.0
Who owns your digital content?,analytics,1,0.0,2014-11-17 09:07:21,charlie7602,Reddit,neutral,0.0
Predictive Modeling: Using R to Understand Heteroskedasticity and Fix it,analytics,1,0.0,2014-11-17 11:26:49,lindiabradley,Reddit,neutral,0.0
Google Analytics Help - 'Tracking Not Installed'?,analytics,2,6.0,2014-11-18 00:24:55,Ajnin123,Reddit,positive,0.4019
Google Analytics Glossary Terms &amp; Definitions,analytics,1,0.0,2014-11-18 02:41:44,ericNELSON1964,Reddit,neutral,0.0
Predictive Analytics in Ecommerce,analytics,1,0.0,2014-11-18 14:56:04,Rpandey099,Reddit,neutral,0.0
Market Media Releases Google Analytics Glossary Terms and Definitions,analytics,1,0.0,2014-11-18 22:09:16,ericNELSON1964,Reddit,neutral,0.0
"Help with Assisted Conversions report in MCF, Google Analytics",analytics,2,4.0,2014-11-18 22:13:53,gutterandstars,Reddit,positive,0.4019
Market Media Releases Google Analytics Glossary Terms and Definitions,analytics,1,0.0,2014-11-18 23:36:24,ericNELSON1964,Reddit,neutral,0.0
"CDK Global is looking for a ‪‎Support‬ ‪Analyst‬ in Hungerford, UK",analytics,1,0.0,2014-11-19 00:48:59,JulieMellson,Reddit,neutral,0.0
Cross domain tracking with analytics,analytics,1,0.0,2014-11-19 06:40:10,steveblom,Reddit,neutral,0.0
Adobe Dynamic Tag Manager (DTM) questions,analytics,1,3.0,2014-11-20 08:22:40,nellyshark,Reddit,positive,0.3818
Possible education for researcher who just finished MBA looking into analytics,analytics,2,3.0,2014-11-21 00:47:13,[deleted],Reddit,neutral,0.0
Tracking WordPress Posts Popularity,analytics,2,1.0,2014-11-21 05:17:05,waverlyposter,Reddit,positive,0.4767
Evolution of the web analytics department,analytics,1,0.0,2014-11-22 06:34:59,charlie7602,Reddit,neutral,0.0
Smashing Magazine discusses how to use visual mobile analytics to refine the onboarding exsperience - Great insights!,analytics,1,0.0,2014-11-23 16:50:14,CuriousAboutTech,Reddit,positive,0.6588
What Google Analytics can tell you about SEO success.,analytics,1,0.0,2014-11-23 17:05:17,sambarnes90,Reddit,positive,0.5719
"Hi all, check out my new Analytics blog",analytics,1,0.0,2014-11-23 23:43:18,Leeds_Analytics,Reddit,neutral,0.0
"How to build an R line chart, step by step (xpost: /r/dataisbeautiful) [OC]",analytics,3,0.0,2014-11-24 16:32:29,SharpSightLabs,Reddit,neutral,0.0
"Awesome way to share content, while also driving traffic! With Metrics too :)",analytics,0,0.0,2014-11-25 17:51:22,Dark-Wing-Duck,Reddit,positive,0.8622
UTM parameters,analytics,1,0.0,2014-11-26 15:16:56,moriyonet,Reddit,neutral,0.0
Find the most-talked conversation/topics around a brand,analytics,1,0.0,2014-11-26 19:49:42,a_methyst,Reddit,neutral,0.0
People who became regular visitors,analytics,2,4.0,2014-11-27 11:31:22,aboustayyef,Reddit,neutral,0.0
A few questions for an expert!,analytics,3,8.0,2014-11-27 19:05:19,itsthe90s,Reddit,neutral,0.0
Help with a Report - Page &amp; Transactions,analytics,1,0.0,2014-11-29 02:42:43,Emerald_Triangle,Reddit,positive,0.4019
"For those interested, Twitter Counter is having a Cyber Monday lifetime deal for 50% off their service",analytics,1,0.0,2014-11-30 20:36:31,Joeynoh,Reddit,positive,0.4019
We all know correlation (r squared) doesn't equal causation. How does one prove/show causation statistically or analytically?,analytics,6,16.0,2014-12-01 19:52:48,kashmoney7,Reddit,neutral,0.0
Market Media Releases Free Google Analytics | Beginners Guide - Chapter 3,analytics,1,0.0,2014-12-01 23:27:39,ericNELSON1964,Reddit,positive,0.5106
Track Contact Form Goal Conversion Rate by Page in One Report?,analytics,3,3.0,2014-12-01 23:48:48,tsunami141,Reddit,neutral,0.0
[Marketing]How I track banner impressions using Google Tag Manager and Universal Analytics,analytics,1,0.0,2014-12-02 17:10:54,suleman1103,Reddit,positive,0.2263
"Case Studies: After Installing Voodoo Alerts, Client Realizes Their Losing $11,200 Monthly Due to IE7 Incompatibility - Website Monitoring Blog by Voodoo AlertsWebsite Monitoring Blog by Voodoo Alerts",analytics,1,0.0,2014-12-02 23:57:00,VoodooAlerts,Reddit,negative,-0.3818
New iOS app that makes it really easy to track basic Google Analytics metrics from your Today view,analytics,2,7.0,2014-12-03 03:35:57,[deleted],Reddit,positive,0.4927
What to learn for potential analytics product?,analytics,3,7.0,2014-12-04 17:19:34,mememuu,Reddit,neutral,0.0
Real time(!) intelligence alerts,analytics,3,2.0,2014-12-04 22:06:08,lentebriesje,Reddit,positive,0.5255
How to Promote Your Business Online? Increase Your Sales and Revenue,analytics,1,0.0,2014-12-06 08:18:04,doodleblue,Reddit,positive,0.5994
Analytics blog for freshers,analytics,1,0.0,2014-12-08 01:01:53,growthfishacademy,Reddit,neutral,0.0
How to make a 'small multiples' chart in R (basic multivariate data visualization),analytics,2,4.0,2014-12-08 19:08:22,SharpSightLabs,Reddit,neutral,0.0
Sessions vs. Pageviews: Which Metric Should You Measure?,analytics,1,0.0,2014-12-08 20:17:29,Bemuzed,Reddit,neutral,0.0
"""GA Help: How to capture """"sitesearch"""" queries occurring within a mobile app...?""",analytics,3,5.0,2014-12-09 07:40:18,gutterandstars,Reddit,positive,0.4019
Measuring SEO Success in Google Analytics,analytics,1,0.0,2014-12-09 09:14:27,jgojocruz,Reddit,positive,0.5719
Predictive Models for your Business,analytics,1,0.0,2014-12-09 11:39:15,shlok123,Reddit,neutral,0.0
Real time Analytics for Insurance Industy,analytics,1,0.0,2014-12-09 11:52:47,awaez,Reddit,neutral,0.0
Tracking/Flagging Individual Pages?,analytics,2,2.0,2014-12-09 15:54:43,Jelly23,Reddit,neutral,0.0
Successfully Completed Google Mobile App Analytic Certification,analytics,1,0.0,2014-12-09 21:29:16,[deleted],Reddit,positive,0.4939
Google Analytics Course,analytics,1,0.0,2014-12-09 21:42:29,ericNELSON1964,Reddit,neutral,0.0
Holiday Sale: 75% off some SAS/Analytics Books,analytics,3,0.0,2014-12-09 23:27:06,horaceGrant,Reddit,positive,0.4019
Google tag manager and firing multiple GA from different containers,analytics,7,6.0,2014-12-10 05:20:20,MrMag00,Reddit,negative,-0.34
Current 1st year MBA student...having a life crisis about switching programs.,analytics,2,5.0,2014-12-10 09:51:28,Munz3215,Reddit,negative,-0.6249
This guy,analytics,16,7.0,2014-12-10 11:03:00,tessellation_rider,Reddit,neutral,0.0
How to setup Search-and-replace filters - Am I being stupid?,analytics,3,6.0,2014-12-10 13:51:04,kit_son,Reddit,negative,-0.5267
Google Analytics | Beginners Guide - Chapter 4,analytics,1,0.0,2014-12-10 23:22:30,ericNELSON1964,Reddit,neutral,0.0
Connecting the dots in cross-device customer paths,analytics,1,0.0,2014-12-11 12:02:57,mikp70,Reddit,neutral,0.0
"What are the best free tools for facebook pages reports, a part from Facebook Insight ?",analytics,3,2.0,2014-12-12 12:43:12,BENNANIALAE,Reddit,positive,0.8176
What symptoms will using old style GA code cause in a UA account with goals linked into Adwords ?,analytics,2,4.0,2014-12-13 00:17:28,MrMag00,Reddit,neutral,0.0
"Deciding what to measure for an event based analytics service (such as Calq, Mixpanel, KISSmetrics etc)",analytics,2,0.0,2014-12-13 21:08:30,RRAway,Reddit,neutral,0.0
Enrolling in BSc Business Analytics - need career advice.,analytics,4,5.0,2014-12-16 03:05:25,yonghf,Reddit,neutral,0.0
"With Universal Analytics, what is the importance of sending a page object with my event tracking?",analytics,1,5.0,2014-12-16 03:10:13,Groggie,Reddit,positive,0.3612
Watch Weekly Cohort Retention from Day One,analytics,0,0.0,2014-12-16 06:09:44,rywalker,Reddit,neutral,0.0
The Pitfalls of Rapid Split-Testing,analytics,1,1.0,2014-12-16 07:26:09,shoreshotweb,Reddit,neutral,0.0
Magnify Your Analytics To A Granular Level With Event Tracking - Website Monitoring Blog by Voodoo AlertsWebsite Monitoring Blog by Voodoo Alerts,analytics,1,0.0,2014-12-16 21:37:56,VoodooAlerts,Reddit,neutral,0.0
Shouldn't Google Tag Manager be simple to use?,analytics,1,17.0,2014-12-17 14:57:14,gverrilla,Reddit,neutral,0.0
Tracking Facebook Users in Google Analytics - An Introductory Guide,analytics,3,0.0,2014-12-17 17:11:43,megalytic,Reddit,neutral,0.0
How to add a tracking code to all links you make?,analytics,2,8.0,2014-12-18 01:47:26,decoy98,Reddit,neutral,0.0
Using Real User Monitoring To Make Your Marketing Relevant Once More - Website Monitoring Blog by Voodoo AlertsWebsite Monitoring Blog by Voodoo Alerts,analytics,1,0.0,2014-12-18 03:21:58,VoodooAlerts,Reddit,neutral,0.0
_setCustomVar Google Analytics issue,analytics,1,0.0,2014-12-18 08:29:13,nellyshark,Reddit,neutral,0.0
How to track articles in the order which they occurred.(Site catalyst) Urgent request Please,analytics,1,1.0,2014-12-18 11:30:47,familypack,Reddit,positive,0.4767
"Im looking for something like SOCIALBAKER but free for my facebook brand pages, any help please?",analytics,0,4.0,2014-12-18 14:17:22,[deleted],Reddit,positive,0.9136
Best place to get some in-depth education on Google Analytics and AdWords etc.?,analytics,1,2.0,2014-12-19 20:35:51,imaworkaholic,Reddit,positive,0.6369
Remove Semalt from Google Analytics,analytics,1,0.0,2014-12-19 23:43:13,acoustics86,Reddit,neutral,0.0
Google Analytics Beginners Course Ch. 3,analytics,1,0.0,2014-12-20 00:31:51,WTF12321,Reddit,neutral,0.0
Google Analytics 101: Getting Started,analytics,0,1.0,2014-12-20 11:20:14,deepanshugahlaut,Reddit,neutral,0.0
Obsolete SEO Techniques - Old SEO Methods that you need to stop in 2014 and 2015,analytics,0,4.0,2014-12-21 15:53:05,Lifets70,Reddit,negative,-0.5267
4 Helpful Things You Can Do With Google Analytics,analytics,1,0.0,2014-12-22 22:59:32,[deleted],Reddit,positive,0.4215
How hard is it to get into an M.S. in Analytics program?,analytics,1,0.0,2014-12-25 01:35:05,[deleted],Reddit,negative,-0.1027
Find timing of campaign referral? (Google Analytics),analytics,2,2.0,2014-12-26 03:31:54,coolandsmartrr,Reddit,neutral,0.0
Tips to increase youtube subscribers and youtube views,analytics,1,0.0,2014-12-26 14:01:51,[deleted],Reddit,positive,0.3182
Weird spammy referral links in my Google Analytics referral channels.,analytics,3,9.0,2014-12-26 15:59:08,nectar75,Reddit,negative,-0.1779
Creating an exclude filter with multiple criteria?,analytics,1,7.0,2014-12-29 21:22:31,msaz87,Reddit,positive,0.0772
How To Install Google Analytics on WordPress,analytics,1,1.0,2014-12-30 15:29:11,mehmetcoskun,Reddit,neutral,0.0
Recommended Web Analytics Software?,analytics,1,18.0,2015-01-01 20:21:21,chewy747,Reddit,positive,0.2023
Google Analytics | Beginners Guide - Chapter 5,analytics,1,0.0,2015-01-01 21:55:33,ericNELSON1964,Reddit,neutral,0.0
Dysfunctional Analytics,analytics,1,0.0,2015-01-02 20:08:53,docligot,Reddit,neutral,0.0
Would anyone be willing to critique my masters in Business Analytics program SOP? Feel free to rip it to shreds.,analytics,8,3.0,2015-01-03 21:13:04,iKidA,Reddit,positive,0.5106
Is there a way to delete multiple Custom Alerts at once?,analytics,2,0.0,2015-01-04 01:40:38,thomasde,Reddit,neutral,0.0
"Simple Scatter Plot of 9,948 Reddit Moderators; click and drag to zoom or pinch on touch devices",analytics,1,1.0,2015-01-04 05:30:19,[deleted],Reddit,negative,-0.2263
"Google Partner, Market Media, Releasing Chapter 5 of Google Analytics Beginners Guide",analytics,1,3.0,2015-01-05 23:05:58,ericNELSON1964,Reddit,neutral,0.0
What tool for auto generate utm-link you use/recommend?,analytics,1,0.0,2015-01-05 23:13:49,PandaLoveFox,Reddit,neutral,0.0
"Created new views for a website, lost previous month's data",analytics,0,4.0,2015-01-06 14:10:56,alexjames213,Reddit,negative,-0.0772
Group report rows by regex,analytics,0,5.0,2015-01-06 16:33:23,dunisq,Reddit,neutral,0.0
Built Product to Automatically Pull Insights from Google Analytics. I could use your feedback.,analytics,8,3.0,2015-01-06 19:16:25,jet311,Reddit,neutral,0.0
Reddit popularity linked to pagerank on Google,analytics,1,0.0,2015-01-06 20:52:41,[deleted],Reddit,positive,0.4767
Reddit popularity linked to pagerank on Google,analytics,0,0.0,2015-01-06 21:38:27,dublinclontarf,Reddit,positive,0.4767
Newb Question: Verifying Goal,analytics,0,6.0,2015-01-07 18:17:07,waverlyposter,Reddit,neutral,0.0
How to Connect Google Analytics with R: A 7 Step Heatmap Tutorial,analytics,1,0.0,2015-01-07 23:43:58,Lukaslo,Reddit,neutral,0.0
Hitsteps Ultimate Web Analytics is Free now!,analytics,1,0.0,2015-01-08 05:51:03,hitsteps,Reddit,positive,0.5562
Track users if they booked a hotel through our website.,analytics,1,0.0,2015-01-08 07:53:32,[deleted],Reddit,neutral,0.0
Google Analytics Write up report.,analytics,1,0.0,2015-01-08 16:08:15,Broosephhhh,Reddit,neutral,0.0
Measuring Active Users,analytics,1,3.0,2015-01-08 17:00:53,failcookie,Reddit,positive,0.4019
Importing data by email,analytics,0,3.0,2015-01-08 21:03:00,Robo-boogie,Reddit,neutral,0.0
Attack of the Spam Referral Sites!,analytics,1,0.0,2015-01-08 23:21:20,thesharc,Reddit,negative,-0.7088
Tracking Campaigns with Google Analytics,analytics,0,2.0,2015-01-09 00:59:05,WishSeo,Reddit,neutral,0.0
How To Fix Common Google Analytics Notifications,analytics,1,0.0,2015-01-09 10:56:33,kushal_shah,Reddit,neutral,0.0
"Google Analytics | TrooTracMedia|Digital Marketing Agency &amp; Affiliate Network, Delhi, India",analytics,1,0.0,2015-01-09 11:32:51,TrooTrac,Reddit,neutral,0.0
Why Do Web Analytics Give Different Numbers?,analytics,1,0.0,2015-01-09 17:34:49,hitsteps,Reddit,neutral,0.0
The State of Digital Analytics in 2015,analytics,9,0.0,2015-01-09 18:12:40,loopymindset,Reddit,neutral,0.0
Creating Goals in Google Analytics,analytics,1,0.0,2015-01-09 22:07:18,WishSeo,Reddit,positive,0.296
Google Analytic Goals,analytics,0,1.0,2015-01-09 22:55:23,WishSeo,Reddit,neutral,0.0
How can I track conversion for a user that hits specific pages?,analytics,1,0.0,2015-01-09 23:52:02,LaTokarz,Reddit,neutral,0.0
Webinar: Google Analytics Data Mining with R (includes 3 Real Applications) - with Google!,analytics,1,0.0,2015-01-10 14:34:17,bsatani,Reddit,neutral,0.0
"I want to develop the ultimate cooking/recipe sharing app ever, please help me collect data for my market research!",analytics,2,2.0,2015-01-10 15:02:28,Buck_McChamp,Reddit,positive,0.8122
Specific page demographics on Google Analytics,analytics,3,3.0,2015-01-11 18:29:31,_Steviiee,Reddit,neutral,0.0
3 Metrics in Google Analytics to Measure User Engagement,analytics,1,0.0,2015-01-12 00:55:09,WishSeo,Reddit,positive,0.4588
Simple iOS app shows you multiple analytics properties in a single Today widget,analytics,4,0.0,2015-01-12 22:02:26,ryno2019,Reddit,neutral,0.0
Google Analytics | Beginners Guide - Chapter 5 | Video Blog,analytics,1,0.0,2015-01-12 23:30:35,777KarenStewart777,Reddit,neutral,0.0
Bounce Rate: Definition and its Importance in Blogging,analytics,1,0.0,2015-01-13 08:23:32,gamingexper,Reddit,positive,0.3612
Introduction to Big Data - Part 1,analytics,0,0.0,2015-01-13 12:40:08,PoojaKulkarni,Reddit,neutral,0.0
How is this possible?,analytics,2,10.0,2015-01-13 19:46:18,kevando,Reddit,neutral,0.0
[Tutorial] Building a dashboard with the Google Analytics Spreadsheet Add-on,analytics,12,1.0,2015-01-14 08:25:24,gutterandstars,Reddit,neutral,0.0
"Hotjar - Detailed insights, includes heatmaps, feedback and exit polls, surveys and others",analytics,0,0.0,2015-01-14 14:32:22,[deleted],Reddit,neutral,0.0
Retrieving Custom Segment List from GA API?,analytics,1,4.0,2015-01-14 16:15:17,smittypants,Reddit,neutral,0.0
Using Google Analytics Data,analytics,1,0.0,2015-01-14 19:18:44,WishSeo,Reddit,neutral,0.0
Google Analytics Checkup for the New Year,analytics,0,0.0,2015-01-14 20:57:31,megalytic,Reddit,neutral,0.0
I need help with this extremely weird problem : Subdomains &amp; Analytics,analytics,1,2.0,2015-01-15 16:23:15,[deleted],Reddit,negative,-0.3119
Referring domain with bounce rate in SiteCatalyst?,analytics,1,0.0,2015-01-15 19:58:20,kp2015,Reddit,neutral,0.0
Your own traffic can be messing up your data.,analytics,1,0.0,2015-01-15 21:42:21,WishSeo,Reddit,neutral,0.0
Moving from Adobe Analytics to Google Premium,analytics,1,10.0,2015-01-16 00:23:16,loungelife,Reddit,neutral,0.0
Master Keyword Research in 7 Days,analytics,1,0.0,2015-01-16 12:46:00,RicharGreearyaih,Reddit,neutral,0.0
Adobe Report Builder and SiteCatalyst Resources Needed,analytics,6,8.0,2015-01-16 16:46:11,failcookie,Reddit,neutral,0.0
The Complete Digital Analytics Ecosystem: How To Win Big,analytics,1,0.0,2015-01-16 17:31:12,[deleted],Reddit,positive,0.5859
The Complete Digital Analytics Ecosystem: How To Win Big,analytics,2,7.0,2015-01-16 18:19:24,Skyruner3,Reddit,positive,0.5859
Best time for GTM Implementation?,analytics,3,8.0,2015-01-16 20:27:31,essee-bro,Reddit,positive,0.6369
Learn how visitors flow through your website,analytics,1,0.0,2015-01-16 23:00:18,WishSeo,Reddit,neutral,0.0
If a Girl Smiles at You Does She Like You? Checkout on this aggregator for analytics and Big data.,analytics,0,2.0,2015-01-17 10:26:59,udyog,Reddit,positive,0.6808
"Uhh, thanks Russia? Can anyone tell me whats up? (More in comments)",analytics,1,12.0,2015-01-17 23:20:42,luckeycat,Reddit,positive,0.504
"Analytics For All- Beginners to Experts: An umbrella course that opens doors to an international community, helps you apply analytics in every walk of life and make data backed decisions! Find a connection between the most unrelatable (It's a word!) events to come to extraordinary conclusions.",analytics,1,0.0,2015-01-19 06:55:37,analytics123,Reddit,positive,0.508
Making Better Business Decisions With Predictive Analytics,analytics,2,0.0,2015-01-19 17:20:59,Meip,Reddit,positive,0.4404
Mobile analytics tools worth looking at,analytics,1,0.0,2015-01-19 17:51:37,ittybittyusability,Reddit,positive,0.2263
Connecting Google Analytics with AppEngine (Python) and d3js,analytics,2,0.0,2015-01-20 04:47:13,Lukaslo,Reddit,neutral,0.0
A Statistical Formula for What Drives Up Your Bounce Rate,analytics,1,1.0,2015-01-20 16:11:28,jet311,Reddit,neutral,0.0
Tracking dynamic links on Wordpress site,analytics,1,1.0,2015-01-20 18:59:03,sfamicom,Reddit,positive,0.3818
"Without analytics, the Internet of Things would provide little value",analytics,0,0.0,2015-01-20 20:02:44,mtl1015,Reddit,positive,0.2748
GA without coding background,analytics,6,11.0,2015-01-20 22:04:49,mizman25,Reddit,neutral,0.0
"""""""What's the best tool for web analytics?"""" A personal review.""",analytics,0,0.0,2015-01-21 02:10:59,FR314,Reddit,positive,0.6369
Professional Associations,analytics,1,1.0,2015-01-21 03:14:43,Short_dawg,Reddit,neutral,0.0
"I need a serious hardcore chat about attribution. Paid search, paid lead sources. Who wants to get into the weeds with me?",analytics,1,0.0,2015-01-21 04:04:46,[deleted],Reddit,negative,-0.0772
Find out the facebook person who shared/posted about my content,analytics,4,4.0,2015-01-21 10:04:53,romeo-onisim,Reddit,neutral,0.0
WebCEO Moves Your Site Quality Checks to a New Level,analytics,0,1.0,2015-01-21 14:49:16,[deleted],Reddit,neutral,0.0
Check it if you are tired to copy filters across GA accounts. Google Analytics filters copy free tool,analytics,1,1.0,2015-01-22 11:42:43,levashovbiz,Reddit,positive,0.1027
Linking AdWords to Google Analytics &amp; Webmaster Tools,analytics,1,0.0,2015-01-22 22:25:38,Bemuzed,Reddit,neutral,0.0
Why do my URLs show up as organic search keywords?,analytics,2,3.0,2015-01-23 16:35:28,ChristianBentanke,Reddit,neutral,0.0
How to Filter Out Fake Referrals and Other Google Analytics Spam,analytics,7,1.0,2015-01-23 17:07:00,megalytic,Reddit,negative,-0.6808
3 Intelligent Ways To Invigorate Your Data Approach,analytics,3,0.0,2015-01-23 18:45:02,essee-bro,Reddit,positive,0.7096
Can I run a Google Analytics A/B test using 2 entirely separate domains?,analytics,1,7.0,2015-01-23 23:16:04,Kthulu666,Reddit,neutral,0.0
