title,subreddit,score,num_comments,created_date,author,platform,sentiment,sentiment_score
YouTube's traffic data for music questioned,analytics,3,0.0,2010-02-10 22:06:17,salvage,Reddit,negative,-0.1027
November Sees Number of U.S. Videos Viewed Online Surpass 30 Billion for First Time on Record [comScore],analytics,1,0.0,2010-02-10 22:06:53,salvage,Reddit,positive,0.0772
So what do you guys all do related to analytics? Why the interest?,analytics,7,4.0,2010-02-11 19:47:22,xtom,Reddit,positive,0.5204
10 Web Analytics Tools For Tracking Your Visitors,analytics,4,1.0,2010-02-12 18:10:36,[deleted],Reddit,neutral,0.0
Improving Your Sense of Site,analytics,2,0.0,2010-02-26 20:26:18,[deleted],Reddit,positive,0.4215
"Google's Invasive, non-Anonymized Ad Targeting: A Quick Confirmation of previously suspected privacy issues",analytics,2,1.0,2010-03-04 20:17:26,xtom,Reddit,negative,-0.2263
700 Million Monthly YouTube Visitors by 2016,analytics,2,0.0,2010-03-21 10:51:48,salvage,Reddit,neutral,0.0
Best Free Web Analytics Tools for Your Websites,analytics,2,0.0,2010-03-24 03:55:43,wpconstructs,Reddit,positive,0.8176
"Twitter Now Growing at a Staggering 1,382 Percent",analytics,1,0.0,2010-04-04 13:40:20,[deleted],Reddit,positive,0.1779
Google Search Funnels: The greatest assist specialist since Magic Johnson,analytics,1,1.0,2010-04-06 23:14:05,dredman,Reddit,positive,0.6808
How To Analyze Your Site Stats,analytics,1,0.0,2010-04-08 13:09:34,blondishnet,Reddit,neutral,0.0
22 Absolutely Free Twitter Web Analytics Tools,analytics,2,1.0,2010-04-16 15:46:22,kittuk,Reddit,positive,0.5563
Analítica Web: herramientas gratuitas para optimizar el uso de nuestro sitio web,analytics,1,1.0,2010-04-26 08:23:25,jlopezto,Reddit,neutral,0.0
The Four Myths of Web Analytics Every Digital Marketer Must Know,analytics,3,0.0,2010-04-26 22:02:58,strategy20,Reddit,neutral,0.0
Study: Online TV Viewers Willing To Watch More Ads,analytics,4,1.0,2010-05-02 22:31:27,salvage,Reddit,neutral,0.0
"Leading online video platform Brightcove: Viewers are increasingly watching longer videos, length-watched grew by an average of 9.46% per month over the past six months... [TubeMogul Report]",analytics,3,0.0,2010-05-10 23:09:55,salvage,Reddit,neutral,0.0
Blog Analytics: Basics of Analyzing Blog Traffic,analytics,0,0.0,2010-05-20 15:04:01,chokobaka,Reddit,neutral,0.0
Online video ads are more effective than TV because viewers are forced to watch them,analytics,2,1.0,2010-05-27 04:26:54,salvage,Reddit,positive,0.101
Making Data-Driven Business Decisions With Website Optimizer,analytics,1,0.0,2010-06-01 00:50:51,kendle5,Reddit,positive,0.3612
Prevent Good Metrics From Going Bad,analytics,2,1.0,2010-06-07 18:48:41,theproductguy,Reddit,negative,-0.128
Piwik: Real-time Open Source Web Analytics Software,analytics,0,2.0,2010-06-09 23:26:56,shopvavavoom,Reddit,neutral,0.0
"Facebook Hits 20 Million Video Uploads, 2 Billion Video Views Per Month",analytics,3,0.0,2010-06-15 18:16:24,salvage,Reddit,neutral,0.0
The 1000 most-visited sites on the web [Google/DoubleClick],analytics,5,0.0,2010-06-18 10:41:27,salvage,Reddit,neutral,0.0
"Google Notches Highest Search Share Ever at 66.4%, Shows ComScore",analytics,2,0.0,2010-06-19 06:13:24,salvage,Reddit,positive,0.296
How We Used Data to Win the Presidential Election [VIDEO],analytics,4,0.0,2010-06-21 16:52:44,salvage,Reddit,positive,0.5859
"Skype has more registered users than Facebook, over 160m more.",analytics,13,2.0,2010-06-25 08:03:23,salvage,Reddit,neutral,0.0
Making Analytics Data Actionable Using Analytics API Tools,analytics,1,0.0,2010-06-25 13:07:07,lilianMM,Reddit,neutral,0.0
Google Analytics Individual Qualification Exam Test Notes,analytics,1,1.0,2010-07-06 18:14:15,jensksorensen,Reddit,neutral,0.0
Twitter Receives 800 Million Search Queries A Day,analytics,6,0.0,2010-07-11 14:44:57,salvage,Reddit,neutral,0.0
"Compete, Quantcast, Alexa and Nielson get reddit wrong, dhuh. These companies gauge totals with tiny tool-bar user groups.",analytics,1,0.0,2010-07-16 05:13:24,[deleted],Reddit,negative,-0.4767
"Compete, Quantcast, Alexa and Nielson get reddit wrong, dhuh. These companies gauge totals by with tiny user groups from tool-bars and other browser extensions. ",analytics,0,0.0,2010-07-16 05:15:52,salvage,Reddit,negative,-0.4767
HitWise Top 20 Sites &amp; Engines,analytics,2,1.0,2010-07-20 19:06:36,salvage,Reddit,positive,0.2023
5 Steps to cleaning up your marketing campaigns with Old Spice Body Wash...,analytics,1,0.0,2010-07-23 17:56:10,SocialPMChick,Reddit,neutral,0.0
number of worldwide email users is projected to increase from over 1.4 billion in 2009 to almost 1.9 billion by 2013. [Radicati],analytics,5,0.0,2010-07-26 18:09:19,salvage,Reddit,positive,0.3818
7 Game Changing Trends Driving by Marketing Analaytis,analytics,1,0.0,2010-08-02 18:23:11,SigmaMktg,Reddit,neutral,0.0
6 Applications of Predictive Analytics,analytics,1,0.0,2010-08-23 15:14:40,DataInfoCom,Reddit,neutral,0.0
Five Analytics Metrics You Can't Afford To Miss ,analytics,1,0.0,2010-09-08 17:45:49,emmaseo,Reddit,positive,0.1139
Mashable Feature Article on SeeVolution Real Time Analytics,analytics,1,0.0,2010-09-10 08:23:17,Quadw,Reddit,neutral,0.0
My startup just launched a webTV show on web innovation and analytics. Please check it out (I'm the producer!). First guest is VP of Analytics at PerkStreet Financial,analytics,6,0.0,2010-09-13 21:04:45,mnic001,Reddit,positive,0.69
"TubeMogul Q2 Report: Facebook and Twitter are growing faster than the major search engines in terms of video streams referred. If current trends continue, Facebook, growing at 48.3% per month, will be second only to Google within the year.",analytics,3,1.0,2010-09-14 07:59:24,salvage,Reddit,positive,0.34
20onFive new episode. This week we interview Phil Sawyer on advertising effectiveness. Last week: Joselin Mane,analytics,1,0.0,2010-09-24 20:31:31,mnic001,Reddit,neutral,0.0
Track ROI with Google Analytics Goals &amp; Funnels,analytics,0,0.0,2010-09-27 23:20:45,[deleted],Reddit,positive,0.1027
A Tool to Help Sites Monitor Web Tracking | Jennifer Valentino-DeVries | Voices | AllThingsD,analytics,1,0.0,2010-09-28 19:19:30,kkohler124,Reddit,positive,0.4019
Data Goes Primetime.,analytics,1,0.0,2010-09-30 17:37:40,SocialPMChick,Reddit,neutral,0.0
"Just posted an interview with Judah Phillips, Host of Web Analytics Wednesdays (#WAW) in Boston. Any feedback?",analytics,1,0.0,2010-10-07 22:04:51,mnic001,Reddit,neutral,0.0
Real time Web analytics service Clicky updates interface… and gets an earful,analytics,3,0.0,2010-10-26 03:02:14,siliconflorist,Reddit,neutral,0.0
What Motivates Analytic Professionals?,analytics,1,0.0,2010-10-26 13:11:29,jaimefitzgerald,Reddit,neutral,0.0
Research: 86.9% of Unique Visitors Never Watch a Pre-Roll Video Ad,analytics,7,0.0,2010-10-28 04:17:55,salvage,Reddit,neutral,0.0
Quantitative Analysis is Only Half The Story,analytics,1,0.0,2010-10-29 18:42:04,geniusofwi,Reddit,neutral,0.0
Why is November getting cut off on the right? I can't figure this out. Window is full sized.,analytics,2,1.0,2010-11-05 03:58:35,kimwim42,Reddit,negative,-0.2732
New WordPress Plugin from SeeVolution Available Today | Analytics News,analytics,1,1.0,2010-11-10 18:59:34,seevolution,Reddit,neutral,0.0
Great new analytical tool for FB advertising,analytics,2,0.0,2010-11-11 07:04:19,salvage,Reddit,positive,0.6249
How to Track JavaScript and Ajax Events with Google Analytics,analytics,1,0.0,2010-11-16 18:19:51,craigbuckler,Reddit,neutral,0.0
How to Monitor Promotional Campaigns with Google Analytics,analytics,1,0.0,2010-11-24 18:43:39,craigbuckler,Reddit,neutral,0.0
Twitter-lytics? Micro blogging giant announces launch of its own analytics platform,analytics,1,0.0,2010-11-29 13:51:09,mattwalkerseo,Reddit,neutral,0.0
Optimizing with SeeVolution Website Analytics for Google Places | Analytics News,analytics,1,1.0,2010-11-30 21:11:05,seevolution,Reddit,positive,0.4588
New SeeVolution Upgrades for Faster Analytics Reporting | Analytics News,analytics,1,1.0,2010-12-01 20:36:46,seevolution,Reddit,neutral,0.0
Preview of SeeVolution Real-Time Mouse Movement Heatmap Analytics! | Analytics News,analytics,1,1.0,2010-12-11 18:03:24,seevolution,Reddit,neutral,0.0
Use SeeVolution Website Analytics to Optimize Text | Analytics News,analytics,1,1.0,2010-12-15 04:19:28,seevolution,Reddit,positive,0.4939
Looking for advanced career opportunities?,analytics,1,0.0,2010-12-15 10:57:54,iqrconsulting,Reddit,positive,0.5574
Piwik &amp;#8211; eine Open-Source Webanalyse-Software als Alternative zu Google Analytics,analytics,1,0.0,2011-01-01 17:31:40,[deleted],Reddit,neutral,0.0
"DotCed - Functional Web Analytics - Tagging, Reporting, Analysis, and Strategy - www.dotced.com",analytics,1,1.0,2011-01-06 04:51:18,dotced,Reddit,neutral,0.0
our global data field [VIDEO],analytics,1,1.0,2011-01-14 07:45:26,matthewcopeland,Reddit,neutral,0.0
Program Details - Data Analytics Course,analytics,0,0.0,2011-01-19 11:45:30,iqrconsulting,Reddit,neutral,0.0
potential job in web analytics... need to analyze some data.  what are they looking for?,analytics,2,4.0,2011-01-19 21:52:28,therewontberiots,Reddit,neutral,0.0
Analytics trend fail.,analytics,1,0.0,2011-01-25 21:36:15,splatt9,Reddit,negative,-0.5423
Speech Analysis | In Obama's Words | The Washington Post,analytics,1,0.0,2011-01-27 23:53:35,[deleted],Reddit,neutral,0.0
The Asymptote of Data Quality,analytics,1,0.0,2011-02-01 08:20:32,FreshOutOfGeekistan,Reddit,neutral,0.0
Web Analytics and Metrics: China Discussion,analytics,1,0.0,2011-02-02 21:37:34,kjshea,Reddit,neutral,0.0
What is the need for Data Analytics?,analytics,1,0.0,2011-02-09 12:51:44,iqrconsulting,Reddit,neutral,0.0
"Hi, /r/analytics. I have a question about Google Analytics that no one on the forum seems able or willing to answer. Any help is most appreciated.",analytics,4,3.0,2011-02-23 20:49:03,fake_again,Reddit,positive,0.624
Webstats - Generierung von aussagekräftigen Zahlen,analytics,1,0.0,2011-02-26 01:09:31,[deleted],Reddit,neutral,0.0
Webstats - Generierung von aussagekräftigen Zahlen,analytics,1,0.0,2011-02-26 12:46:41,csingerat,Reddit,neutral,0.0
A Simple Guide to Setting Up Google Analytics,analytics,1,0.0,2011-03-01 11:18:24,dm28,Reddit,neutral,0.0
I just released a new iPad Google Analytics app! Here's Quicklytics to you all!,analytics,1,0.0,2011-03-15 18:28:39,[deleted],Reddit,neutral,0.0
Have a look at this brochure for Data Analytics course,analytics,0,0.0,2011-03-24 12:53:40,iqrconsulting,Reddit,neutral,0.0
DEA think this could be useful?,analytics,1,0.0,2011-04-23 14:23:42,vadoo,Reddit,positive,0.4404
Analytics mystery... where could a massive spike of direct traffic be coming from?,analytics,3,1.0,2011-05-01 15:48:46,Paranoidmarvin,Reddit,neutral,0.0
Every second website is using Google Analytics now,analytics,4,0.0,2011-05-02 10:48:35,JackS08,Reddit,neutral,0.0
Small Business Solutions: Marchex,analytics,1,1.0,2011-05-02 23:05:21,BasilPuglisi,Reddit,positive,0.1779
TIL Why Gmail referrals don't show up in Google Analytics,analytics,3,1.0,2011-05-03 18:39:38,searchengineoptimist,Reddit,neutral,0.0
Google Analytics: measure page load time,analytics,7,0.0,2011-05-05 11:04:04,luigiagosti,Reddit,neutral,0.0
Google Analytics Advanced Segments are badly broken and are reporting incorrect data,analytics,4,0.0,2011-05-09 11:39:41,jamiembrown,Reddit,negative,-0.6369
Customized your Yahoo! Store with Yahoo! Web Analytics,analytics,3,0.0,2011-05-10 12:12:17,percept09,Reddit,neutral,0.0
"Google Analytics data error is getting worse, not better - serious problems with Google's Advanced Segments",analytics,5,2.0,2011-05-12 11:22:07,jamiembrown,Reddit,negative,-0.8264
Web Usability Analysis for Boost up your Business,analytics,2,0.0,2011-05-13 13:35:18,percept09,Reddit,positive,0.4019
Omniture/DFA genesis integration,analytics,1,0.0,2011-05-14 00:34:41,jojoisphat,Reddit,neutral,0.0
How to identify which Google Analytics account is tracking my site?,analytics,3,3.0,2011-05-20 21:10:00,GoogleAnalyticsQ,Reddit,neutral,0.0
VideoLectures Recommender System Competition is half way through,analytics,2,0.0,2011-05-26 14:46:02,m3g4n3,Reddit,neutral,0.0
Hack for Google Analytics Beta: How to export all keywords to CSV (workaround for the 500 keyword export limit),analytics,5,1.0,2011-05-26 19:38:07,eponymouse,Reddit,neutral,0.0
Better Campaign Tracking in Google Analytics,analytics,0,0.0,2011-06-07 08:00:37,tomdiggity,Reddit,positive,0.4404
How does one get started in the analytic world?,analytics,8,13.0,2011-07-15 00:50:17,SeeDerekRun,Reddit,neutral,0.0
"I noticed a Google Analytics -UA-XXXX-Y javascript code on most websites, does this necessarily mean that tracking is conducted?",analytics,1,0.0,2011-07-18 19:01:17,SeeDerekRun,Reddit,neutral,0.0
Is anyone not using Google Analytics and why? ,analytics,1,0.0,2011-07-22 20:18:05,Gustomaximus,Reddit,neutral,0.0
"""issues with """"include"""" filter """,analytics,3,2.0,2011-07-26 02:13:40,jojoisphat,Reddit,neutral,0.0
Android Analytics referral tracking,analytics,1,0.0,2011-07-30 10:48:37,devarticles,Reddit,neutral,0.0
Help! User deleted google analytics profile,analytics,1,0.0,2011-08-04 20:40:34,ubrkifix,Reddit,positive,0.4574
How can I find high ranking non-US websites?,analytics,0,2.0,2011-08-09 19:56:09,jeremiahwarren,Reddit,neutral,0.0
Need some quick advice!!!,analytics,1,0.0,2011-08-17 03:41:33,Joobei,Reddit,neutral,0.0
I run a small deal aggregator. This is what the HP Touchpad deal did to my traffic.,analytics,0,0.0,2011-08-25 21:48:28,kbrower,Reddit,neutral,0.0
Analytics Multi-Channel Funnels Overview,analytics,1,0.0,2011-08-31 18:39:50,insite,Reddit,positive,0.1027
I have a second interview lined up tomorrow for a Web Analytics Position but I need help preparing.,analytics,1,0.0,2011-08-31 20:44:40,ClarenceCW,Reddit,positive,0.5499
HBX inventor &amp; Entrepreneur Blaise Barrelet blogs about how far website analytics has come since HitBox,analytics,1,0.0,2011-09-13 23:08:28,kaswing,Reddit,neutral,0.0
"Realtime data viz of users' paths on consultancy.com, with interesting methodology notes.  ",analytics,2,0.0,2011-09-14 02:01:17,kaswing,Reddit,positive,0.4019
"Website Key Performance Indicators, KPIs, You Need to Know",analytics,3,0.0,2011-09-14 19:05:44,Gaylias24,Reddit,neutral,0.0
Spend analysis - an overview,analytics,0,0.0,2011-09-27 09:37:32,[deleted],Reddit,neutral,0.0
Google Analytics gets premium version,analytics,1,1.0,2011-09-30 12:28:43,Gustomaximus,Reddit,neutral,0.0
Tracking Impressions,analytics,2,0.0,2011-10-10 17:48:34,teamcolab,Reddit,positive,0.2263
Anyone in the Cambridge/Boston area interested in hacking on some PitchFX Gameday data together?,analytics,4,0.0,2011-10-13 00:31:20,ohsnaaap,Reddit,positive,0.4019
"Renegade Economist Interviews Steve Keen .. ( Economics Prof, Neoclassical Economics critic, &amp; Aussie)",analytics,1,0.0,2011-10-15 19:47:54,xoday,Reddit,positive,0.1027
Question about three-month comparison in Google Analytics,analytics,1,0.0,2011-10-27 11:11:53,[deleted],Reddit,neutral,0.0
Google Analytics on a Subreddit?,analytics,3,8.0,2011-11-08 19:40:53,Franks2000inchTV,Reddit,neutral,0.0
Just me and my classmate with a huge check after winning Adobe's Web Analytics Competition,analytics,1,0.0,2011-11-12 01:34:51,[deleted],Reddit,positive,0.6908
Just me and my buddy with a huge check after winning the Adobe Web Analytics Competition,analytics,9,9.0,2011-11-12 01:49:05,TylerRiggs,Reddit,positive,0.6908
GA - How can I track clicks on a single link on a transition page hosted on another server/domain?,analytics,2,4.0,2011-11-18 00:43:27,gerbs,Reddit,neutral,0.0
Is there an Omniture debugger/tester that crawls the entire site?,analytics,3,5.0,2011-11-22 00:08:59,Phatferd,Reddit,neutral,0.0
Big Data and New Business Models,analytics,1,0.0,2011-12-12 04:59:36,fdiana,Reddit,neutral,0.0
GA: Cross sub-domain conversion tracking ,analytics,1,0.0,2011-12-13 19:14:46,thesupermikey,Reddit,neutral,0.0
Analytiks gives you the perfect snapshot of your Google Analytics on iOS,analytics,1,0.0,2011-12-15 21:41:49,shegeek,Reddit,positive,0.5719
Google Analytics Question,analytics,0,0.0,2012-01-12 23:33:48,tylerr82,Reddit,neutral,0.0
7 Alternatives to Google Analytics [X-Post from /PPC],analytics,1,0.0,2012-01-17 02:35:18,insite,Reddit,neutral,0.0
Google analytics question : Tracking multiple domains ,analytics,5,5.0,2012-01-23 18:35:25,allistaken,Reddit,neutral,0.0
Omniture training? ,analytics,1,0.0,2012-01-25 23:14:55,Kick79,Reddit,neutral,0.0
Tracking problem,analytics,0,8.0,2012-01-30 23:43:32,oddprocedure,Reddit,negative,-0.4019
Not breaking your Google Analytics (like a pro) | PagerDuty Blog,analytics,1,0.0,2012-02-21 21:55:27,devopsninja,Reddit,positive,0.3612
How to check if Google Analytics account still exists?,analytics,0,0.0,2012-02-28 14:17:18,[deleted],Reddit,neutral,0.0
link adsense to analytics NEW INTERFACE,analytics,1,0.0,2012-03-07 18:41:52,MINECRAFTdotNET,Reddit,neutral,0.0
"My first app for real-time stats of your online activity. Track visits on any sites you want (you don't have to own them), provided that you can paste image from url on them - Need feedback from bloggers, webdevelopers, guys who sell stuff online, and those who put a lot of content online.",analytics,0,0.0,2012-03-21 12:46:55,MichaelStar,Reddit,positive,0.0772
Setting up GA with shopping cart on a different domain.,analytics,1,1.0,2012-03-28 19:09:36,djfoops,Reddit,neutral,0.0
Go to programming languages to learn for web analytics?,analytics,5,12.0,2012-03-30 19:54:09,ctdf,Reddit,neutral,0.0
"[HIRING!] Building an analytics team- multiple salaried openings with benefits and relocation assistance to Chattanooga, TN (a beautiful, fun city)",analytics,1,0.0,2012-04-18 18:10:18,recruitercain,Reddit,positive,0.8777
A Social Media Dashboard for Google Analytics,analytics,1,0.0,2012-04-25 00:15:39,xtmotion,Reddit,neutral,0.0
Google Analytics - Goal Type Event,analytics,1,0.0,2012-05-01 12:59:20,gregsfriend,Reddit,neutral,0.0
"Customizing Google Analytics Starts with Objectives, not Metrics",analytics,0,0.0,2012-05-02 02:55:35,mikkei,Reddit,neutral,0.0
"""What's the difference between """"unique visits"""" and """"unique visitors""""?""",analytics,0,0.0,2012-05-04 12:48:18,beyondawesome,Reddit,neutral,0.0
Google Analytics A/B testing with Wordpress,analytics,2,8.0,2012-05-09 12:42:02,topcat555,Reddit,neutral,0.0
Anybody working in analytics up for an AMA/AMAA?,analytics,1,0.0,2012-05-22 06:24:51,Benthetraveler,Reddit,neutral,0.0
Amazing web statistics you have never heard of before,analytics,1,0.0,2012-05-26 18:47:54,[deleted],Reddit,positive,0.5859
Own sites starting to show up as referral in Analytics like crazy. Any suggestion as to why?,analytics,1,4.0,2012-06-04 22:28:09,enemymechdestroyed,Reddit,neutral,0.0258
Data Analytics: IT’s Ronco Veg-o-Matic for Data,analytics,1,0.0,2012-06-06 21:35:16,wordsmithie,Reddit,neutral,0.0
Track Yahoo Marketing &amp; Microsoft adCenter in Analytics,analytics,3,0.0,2012-06-08 20:04:52,praroop,Reddit,neutral,0.0
Jobplotter.com Site Info,analytics,0,1.0,2012-06-15 01:02:10,jobplotter,Reddit,neutral,0.0
How do you manage your Google Analytics campaign urls?,analytics,5,5.0,2012-06-21 11:24:07,snowliondev,Reddit,neutral,0.0
Track Yahoo Marketing &amp; Microsoft adCenter in Analytics,analytics,1,0.0,2012-06-22 10:05:46,praroop,Reddit,neutral,0.0
Adwords / Bing as a menu item in Google Analytics...,analytics,2,4.0,2012-06-25 19:42:36,ogaddi,Reddit,neutral,0.0
Whose Search Data is it Anyway? – Firefox to encrypt referring search strings,analytics,1,2.0,2012-07-03 19:10:08,gadgetgranny,Reddit,neutral,0.0
Two Handy SiteCatalyst Tools,analytics,3,3.0,2012-07-09 03:49:48,dansen926,Reddit,neutral,0.0
Anybody use Lucky Orange?,analytics,1,0.0,2012-07-17 20:43:38,iLLeT,Reddit,positive,0.4215
Scientific Attribution: Maximizing Digital ROI,analytics,0,1.0,2012-07-24 18:47:06,seobkv,Reddit,neutral,0.0
Data Changes Everything: Delivering on the Promise of Learning Analytics in Higher Education (EDUCAUSE Review) | EDUCAUSE.edu,analytics,5,0.0,2012-07-25 20:17:54,edwsonoma,Reddit,positive,0.3182
"Gmid Associates is a result driven management consulting, analytics outsourcing and data analytics services firm having expertise in verticals like Banking and Financial Analytics, Insurance Analytics, Telecom Analytics, Retail Analytics.",analytics,1,0.0,2012-07-30 15:00:37,muditchandra,Reddit,positive,0.3612
Webinar this Thursday: Multi-Channel Funnels xpost from /MadeForAdsense,analytics,1,0.0,2012-08-07 21:22:29,webproseonet,Reddit,positive,0.1027
How do I create and send reportsin the new version of Google Analytics?,analytics,1,0.0,2012-08-10 14:23:32,Drendo,Reddit,positive,0.2732
The Secrets to Managing Business Analytics Projects,analytics,1,0.0,2012-08-10 18:59:08,aoifemcgivern,Reddit,neutral,0.0
Two Helpful Tips for Google Analytics Users,analytics,1,0.0,2012-08-12 20:58:44,SEOGenX,Reddit,positive,0.4215
Would this tool help small businesses with their analytics?,analytics,1,0.0,2012-08-16 19:19:00,true_ben,Reddit,positive,0.4019
8 Simple yet Powerful RegEx Concepts for Google Analytics,analytics,9,0.0,2012-08-21 15:37:46,mike_arnesen,Reddit,positive,0.4215
You Are the Product: Topsy’s New Pro Analytics Tool as the All-Seeing Eye,analytics,3,1.0,2012-08-21 18:23:19,limefest,Reddit,neutral,0.0
Analysis of Xtranormal EDUC1751,analytics,1,0.0,2012-08-23 10:08:52,EmmaLeeS,Reddit,neutral,0.0
High bounce periodically on Sundays?,analytics,3,7.0,2012-09-05 11:34:08,shortcut187,Reddit,neutral,0.0
Facebook report - Wolfram|Alpha Clip 'n Share,analytics,0,1.0,2012-09-09 14:54:22,javamanromeo,Reddit,positive,0.296
NICE Speech Analytics - Why Combining Phonetics and Transcription Works Best,analytics,1,0.0,2012-09-09 21:29:07,givcan,Reddit,positive,0.8286
"When It Comes to Supply Chain Data, Is Less More?",analytics,3,0.0,2012-09-10 18:29:47,kprevet,Reddit,neutral,0.0
How to analyze a company's financial,analytics,1,0.0,2012-09-12 06:28:38,lagaligo,Reddit,neutral,0.0
Can data science actually become a spectator sport in the analytics community?,analytics,1,0.0,2012-09-13 02:39:42,[deleted],Reddit,neutral,0.0
Bizarre Analytics Riddle - Would Love Some Reddit Help with Analysis ,analytics,2,7.0,2012-09-18 03:28:05,iNinjaNotes,Reddit,positive,0.6808
want to be google analytics certified by the end of the day. advice?,analytics,3,10.0,2012-09-18 18:38:40,laydownlarry,Reddit,positive,0.0772
Call Quality Assurance,analytics,1,0.0,2012-09-18 19:09:25,[deleted],Reddit,positive,0.34
Why Putting the Enterprise in the Cloud Makes Sense,analytics,0,2.0,2012-09-21 21:19:06,Slimys9,Reddit,neutral,0.0
Special Topics in Analytics for MBA?,analytics,1,6.0,2012-09-21 23:36:14,imnotthomas,Reddit,positive,0.4019
Send secret messages to Google Analytics users (anyone have any creative ideas?),analytics,1,0.0,2012-09-23 20:51:51,dataeverywhere,Reddit,positive,0.4404
"NEW POST: Finding the Right Attributes in Visitor Scoring, Lead Scoring, and Customer Scoring   ",analytics,1,0.0,2012-09-24 21:05:22,extractable,Reddit,neutral,0.0
Pandora's Analytics vs Google Analytics performance,analytics,1,0.0,2012-09-26 02:26:18,shopvavavoom,Reddit,neutral,0.0
Democracy Ticker,analytics,1,0.0,2012-10-06 00:06:20,jrockdc,Reddit,neutral,0.0
Want to be trained in SiteCatalyst / Omniture to increase my chances of a job,analytics,1,1.0,2012-10-07 15:53:59,spudgun00,Reddit,positive,0.5267
Gmid Associates: Data Sciences and Analytics,analytics,1,0.0,2012-10-09 22:04:54,Gmid,Reddit,neutral,0.0
Tracking Visits with Piwik Analytics in Rails,analytics,2,2.0,2012-10-11 00:09:39,skelkingur,Reddit,neutral,0.0
Segment Google Analytics reports by age and gender (Facebook hack),analytics,6,4.0,2012-10-11 14:36:54,aladata,Reddit,neutral,0.0
Measuring Search Marketing for Lead Gen: A Basic Primer,analytics,1,0.0,2012-10-12 00:20:55,kjshea,Reddit,neutral,0.0
Need help with relevant dashboard for web publisher,analytics,1,0.0,2012-10-16 05:09:47,[deleted],Reddit,positive,0.4019
Advertising Roi | Visualizing Data | Customized Reporting | Goal Tracking,analytics,2,0.0,2012-10-16 09:00:03,harishsheel007,Reddit,neutral,0.0
Transitions and GeoIP in Piwik 1.9,analytics,3,0.0,2012-10-16 15:14:35,skelkingur,Reddit,neutral,0.0
Google Analytics para tu blog sin tener ni idea,analytics,1,0.0,2012-10-19 12:30:52,anibalbilbao,Reddit,negative,-0.5574
Tracking the IPv6 reach of your Website with Piwik,analytics,1,0.0,2012-10-23 13:08:36,skelkingur,Reddit,neutral,0.0258
Does mobile device traffic cannibalize desktop traffic?,analytics,2,3.0,2012-10-23 22:43:49,[deleted],Reddit,neutral,0.0
"""Do you need a """"BS Detector""""?""",analytics,1,0.0,2012-10-24 19:30:47,dansen926,Reddit,neutral,0.0
Gathering Analytics from Text-Based Browsers?,analytics,1,0.0,2012-10-24 23:24:53,jecxjo,Reddit,neutral,0.0
"created a little GA app as a superior dashboard interface, would appreciate feedback on where next to take it",analytics,3,3.0,2012-10-25 11:38:17,skunkd,Reddit,positive,0.802
Does traffic from my email newsletter ever appear as 'Direct'?,analytics,1,0.0,2012-10-26 12:58:33,[deleted],Reddit,neutral,0.0
Keywords will not be provided.,analytics,1,0.0,2012-10-27 07:28:29,thompsoon,Reddit,neutral,0.0
Google Social Analytics – Another tool in your Google toolbox   | Water Cooler,analytics,1,0.0,2012-10-29 22:41:27,mchantry16,Reddit,neutral,0.0
What’s in a Heatmap? Predictive Eye-Tracking versus Click-Tracking,analytics,2,0.0,2012-10-31 18:27:42,gocanucks1916,Reddit,neutral,0.0
WANTED: A/B TESTING MANIAC IN BAY AREA,analytics,0,0.0,2012-11-04 09:20:14,didyoutestit,Reddit,negative,-0.4767
LCI Blog: Analytics – Find Out What’s Working for Your Business,analytics,1,0.0,2012-11-05 21:55:36,LandisPR,Reddit,neutral,0.0
Digital Analytics jobs in Southern California,analytics,1,0.0,2012-11-09 00:48:32,zenkutsu64,Reddit,neutral,0.0
