title,subreddit,score,num_comments,created_date,author,platform
YouTube's traffic data for music questioned,analytics,3,0.0,2010-02-10 22:06:17,salvage,Reddit
November Sees Number of U.S. Videos Viewed Online Surpass 30 Billion for First Time on Record [comScore],analytics,1,0.0,2010-02-10 22:06:53,salvage,Reddit
So what do you guys all do related to analytics? Why the interest?,analytics,7,4.0,2010-02-11 19:47:22,xtom,Reddit
10 Web Analytics Tools For Tracking Your Visitors,analytics,4,1.0,2010-02-12 18:10:36,[deleted],Reddit
Improving Your Sense of Site,analytics,2,0.0,2010-02-26 20:26:18,[deleted],Reddit
"Google's Invasive, non-Anonymized Ad Targeting: A Quick Confirmation of previously suspected privacy issues",analytics,2,1.0,2010-03-04 20:17:26,xtom,Reddit
700 Million Monthly YouTube Visitors by 2016,analytics,2,0.0,2010-03-21 10:51:48,salvage,Reddit
Best Free Web Analytics Tools for Your Websites,analytics,2,0.0,2010-03-24 03:55:43,wpconstructs,Reddit
"Twitter Now Growing at a Staggering 1,382 Percent",analytics,1,0.0,2010-04-04 13:40:20,[deleted],Reddit
Google Search Funnels: The greatest assist specialist since Magic Johnson,analytics,1,1.0,2010-04-06 23:14:05,dredman,Reddit
How To Analyze Your Site Stats,analytics,1,0.0,2010-04-08 13:09:34,blondishnet,Reddit
22 Absolutely Free Twitter Web Analytics Tools,analytics,2,1.0,2010-04-16 15:46:22,kittuk,Reddit
Analítica Web: herramientas gratuitas para optimizar el uso de nuestro sitio web,analytics,1,1.0,2010-04-26 08:23:25,jlopezto,Reddit
The Four Myths of Web Analytics Every Digital Marketer Must Know,analytics,3,0.0,2010-04-26 22:02:58,strategy20,Reddit
Study: Online TV Viewers Willing To Watch More Ads,analytics,4,1.0,2010-05-02 22:31:27,salvage,Reddit
"Leading online video platform Brightcove: Viewers are increasingly watching longer videos, length-watched grew by an average of 9.46% per month over the past six months... [TubeMogul Report]",analytics,3,0.0,2010-05-10 23:09:55,salvage,Reddit
Blog Analytics: Basics of Analyzing Blog Traffic,analytics,0,0.0,2010-05-20 15:04:01,chokobaka,Reddit
Online video ads are more effective than TV because viewers are forced to watch them,analytics,2,1.0,2010-05-27 04:26:54,salvage,Reddit
Making Data-Driven Business Decisions With Website Optimizer,analytics,1,0.0,2010-06-01 00:50:51,kendle5,Reddit
Prevent Good Metrics From Going Bad,analytics,2,1.0,2010-06-07 18:48:41,theproductguy,Reddit
Piwik: Real-time Open Source Web Analytics Software,analytics,0,2.0,2010-06-09 23:26:56,shopvavavoom,Reddit
"Facebook Hits 20 Million Video Uploads, 2 Billion Video Views Per Month",analytics,3,0.0,2010-06-15 18:16:24,salvage,Reddit
The 1000 most-visited sites on the web [Google/DoubleClick],analytics,5,0.0,2010-06-18 10:41:27,salvage,Reddit
"Google Notches Highest Search Share Ever at 66.4%, Shows ComScore",analytics,2,0.0,2010-06-19 06:13:24,salvage,Reddit
How We Used Data to Win the Presidential Election [VIDEO],analytics,4,0.0,2010-06-21 16:52:44,salvage,Reddit
"Skype has more registered users than Facebook, over 160m more.",analytics,13,2.0,2010-06-25 08:03:23,salvage,Reddit
Making Analytics Data Actionable Using Analytics API Tools,analytics,1,0.0,2010-06-25 13:07:07,lilianMM,Reddit
Google Analytics Individual Qualification Exam Test Notes,analytics,1,1.0,2010-07-06 18:14:15,jensksorensen,Reddit
Twitter Receives 800 Million Search Queries A Day,analytics,6,0.0,2010-07-11 14:44:57,salvage,Reddit
"Compete, Quantcast, Alexa and Nielson get reddit wrong, dhuh. These companies gauge totals with tiny tool-bar user groups.",analytics,1,0.0,2010-07-16 05:13:24,[deleted],Reddit
"Compete, Quantcast, Alexa and Nielson get reddit wrong, dhuh. These companies gauge totals by with tiny user groups from tool-bars and other browser extensions. ",analytics,0,0.0,2010-07-16 05:15:52,salvage,Reddit
HitWise Top 20 Sites &amp; Engines,analytics,2,1.0,2010-07-20 19:06:36,salvage,Reddit
5 Steps to cleaning up your marketing campaigns with Old Spice Body Wash...,analytics,1,0.0,2010-07-23 17:56:10,SocialPMChick,Reddit
number of worldwide email users is projected to increase from over 1.4 billion in 2009 to almost 1.9 billion by 2013. [Radicati],analytics,5,0.0,2010-07-26 18:09:19,salvage,Reddit
7 Game Changing Trends Driving by Marketing Analaytis,analytics,1,0.0,2010-08-02 18:23:11,SigmaMktg,Reddit
6 Applications of Predictive Analytics,analytics,1,0.0,2010-08-23 15:14:40,DataInfoCom,Reddit
Five Analytics Metrics You Can't Afford To Miss ,analytics,1,0.0,2010-09-08 17:45:49,emmaseo,Reddit
Mashable Feature Article on SeeVolution Real Time Analytics,analytics,1,0.0,2010-09-10 08:23:17,Quadw,Reddit
My startup just launched a webTV show on web innovation and analytics. Please check it out (I'm the producer!). First guest is VP of Analytics at PerkStreet Financial,analytics,6,0.0,2010-09-13 21:04:45,mnic001,Reddit
"TubeMogul Q2 Report: Facebook and Twitter are growing faster than the major search engines in terms of video streams referred. If current trends continue, Facebook, growing at 48.3% per month, will be second only to Google within the year.",analytics,3,1.0,2010-09-14 07:59:24,salvage,Reddit
20onFive new episode. This week we interview Phil Sawyer on advertising effectiveness. Last week: Joselin Mane,analytics,1,0.0,2010-09-24 20:31:31,mnic001,Reddit
Track ROI with Google Analytics Goals &amp; Funnels,analytics,0,0.0,2010-09-27 23:20:45,[deleted],Reddit
A Tool to Help Sites Monitor Web Tracking | Jennifer Valentino-DeVries | Voices | AllThingsD,analytics,1,0.0,2010-09-28 19:19:30,kkohler124,Reddit
Data Goes Primetime.,analytics,1,0.0,2010-09-30 17:37:40,SocialPMChick,Reddit
"Just posted an interview with Judah Phillips, Host of Web Analytics Wednesdays (#WAW) in Boston. Any feedback?",analytics,1,0.0,2010-10-07 22:04:51,mnic001,Reddit
Real time Web analytics service Clicky updates interface… and gets an earful,analytics,3,0.0,2010-10-26 03:02:14,siliconflorist,Reddit
What Motivates Analytic Professionals?,analytics,1,0.0,2010-10-26 13:11:29,jaimefitzgerald,Reddit
Research: 86.9% of Unique Visitors Never Watch a Pre-Roll Video Ad,analytics,7,0.0,2010-10-28 04:17:55,salvage,Reddit
Quantitative Analysis is Only Half The Story,analytics,1,0.0,2010-10-29 18:42:04,geniusofwi,Reddit
Why is November getting cut off on the right? I can't figure this out. Window is full sized.,analytics,2,1.0,2010-11-05 03:58:35,kimwim42,Reddit
New WordPress Plugin from SeeVolution Available Today | Analytics News,analytics,1,1.0,2010-11-10 18:59:34,seevolution,Reddit
Great new analytical tool for FB advertising,analytics,2,0.0,2010-11-11 07:04:19,salvage,Reddit
How to Track JavaScript and Ajax Events with Google Analytics,analytics,1,0.0,2010-11-16 18:19:51,craigbuckler,Reddit
How to Monitor Promotional Campaigns with Google Analytics,analytics,1,0.0,2010-11-24 18:43:39,craigbuckler,Reddit
Twitter-lytics? Micro blogging giant announces launch of its own analytics platform,analytics,1,0.0,2010-11-29 13:51:09,mattwalkerseo,Reddit
Optimizing with SeeVolution Website Analytics for Google Places | Analytics News,analytics,1,1.0,2010-11-30 21:11:05,seevolution,Reddit
New SeeVolution Upgrades for Faster Analytics Reporting | Analytics News,analytics,1,1.0,2010-12-01 20:36:46,seevolution,Reddit
Preview of SeeVolution Real-Time Mouse Movement Heatmap Analytics! | Analytics News,analytics,1,1.0,2010-12-11 18:03:24,seevolution,Reddit
Use SeeVolution Website Analytics to Optimize Text | Analytics News,analytics,1,1.0,2010-12-15 04:19:28,seevolution,Reddit
Looking for advanced career opportunities?,analytics,1,0.0,2010-12-15 10:57:54,iqrconsulting,Reddit
Piwik &amp;#8211; eine Open-Source Webanalyse-Software als Alternative zu Google Analytics,analytics,1,0.0,2011-01-01 17:31:40,[deleted],Reddit
"DotCed - Functional Web Analytics - Tagging, Reporting, Analysis, and Strategy - www.dotced.com",analytics,1,1.0,2011-01-06 04:51:18,dotced,Reddit
our global data field [VIDEO],analytics,1,1.0,2011-01-14 07:45:26,matthewcopeland,Reddit
Program Details - Data Analytics Course,analytics,0,0.0,2011-01-19 11:45:30,iqrconsulting,Reddit
potential job in web analytics... need to analyze some data.  what are they looking for?,analytics,2,4.0,2011-01-19 21:52:28,therewontberiots,Reddit
Analytics trend fail.,analytics,1,0.0,2011-01-25 21:36:15,splatt9,Reddit
Speech Analysis | In Obama's Words | The Washington Post,analytics,1,0.0,2011-01-27 23:53:35,[deleted],Reddit
The Asymptote of Data Quality,analytics,1,0.0,2011-02-01 08:20:32,FreshOutOfGeekistan,Reddit
Web Analytics and Metrics: China Discussion,analytics,1,0.0,2011-02-02 21:37:34,kjshea,Reddit
What is the need for Data Analytics?,analytics,1,0.0,2011-02-09 12:51:44,iqrconsulting,Reddit
"Hi, /r/analytics. I have a question about Google Analytics that no one on the forum seems able or willing to answer. Any help is most appreciated.",analytics,4,3.0,2011-02-23 20:49:03,fake_again,Reddit
Webstats - Generierung von aussagekräftigen Zahlen,analytics,1,0.0,2011-02-26 01:09:31,[deleted],Reddit
Webstats - Generierung von aussagekräftigen Zahlen,analytics,1,0.0,2011-02-26 12:46:41,csingerat,Reddit
A Simple Guide to Setting Up Google Analytics,analytics,1,0.0,2011-03-01 11:18:24,dm28,Reddit
I just released a new iPad Google Analytics app! Here's Quicklytics to you all!,analytics,1,0.0,2011-03-15 18:28:39,[deleted],Reddit
Have a look at this brochure for Data Analytics course,analytics,0,0.0,2011-03-24 12:53:40,iqrconsulting,Reddit
DEA think this could be useful?,analytics,1,0.0,2011-04-23 14:23:42,vadoo,Reddit
Analytics mystery... where could a massive spike of direct traffic be coming from?,analytics,3,1.0,2011-05-01 15:48:46,Paranoidmarvin,Reddit
Every second website is using Google Analytics now,analytics,4,0.0,2011-05-02 10:48:35,JackS08,Reddit
Small Business Solutions: Marchex,analytics,1,1.0,2011-05-02 23:05:21,BasilPuglisi,Reddit
TIL Why Gmail referrals don't show up in Google Analytics,analytics,3,1.0,2011-05-03 18:39:38,searchengineoptimist,Reddit
Google Analytics: measure page load time,analytics,7,0.0,2011-05-05 11:04:04,luigiagosti,Reddit
Google Analytics Advanced Segments are badly broken and are reporting incorrect data,analytics,4,0.0,2011-05-09 11:39:41,jamiembrown,Reddit
Customized your Yahoo! Store with Yahoo! Web Analytics,analytics,3,0.0,2011-05-10 12:12:17,percept09,Reddit
"Google Analytics data error is getting worse, not better - serious problems with Google's Advanced Segments",analytics,5,2.0,2011-05-12 11:22:07,jamiembrown,Reddit
Web Usability Analysis for Boost up your Business,analytics,2,0.0,2011-05-13 13:35:18,percept09,Reddit
Omniture/DFA genesis integration,analytics,1,0.0,2011-05-14 00:34:41,jojoisphat,Reddit
How to identify which Google Analytics account is tracking my site?,analytics,3,3.0,2011-05-20 21:10:00,GoogleAnalyticsQ,Reddit
VideoLectures Recommender System Competition is half way through,analytics,2,0.0,2011-05-26 14:46:02,m3g4n3,Reddit
Hack for Google Analytics Beta: How to export all keywords to CSV (workaround for the 500 keyword export limit),analytics,5,1.0,2011-05-26 19:38:07,eponymouse,Reddit
Better Campaign Tracking in Google Analytics,analytics,0,0.0,2011-06-07 08:00:37,tomdiggity,Reddit
How does one get started in the analytic world?,analytics,8,13.0,2011-07-15 00:50:17,SeeDerekRun,Reddit
"I noticed a Google Analytics -UA-XXXX-Y javascript code on most websites, does this necessarily mean that tracking is conducted?",analytics,1,0.0,2011-07-18 19:01:17,SeeDerekRun,Reddit
Is anyone not using Google Analytics and why? ,analytics,1,0.0,2011-07-22 20:18:05,Gustomaximus,Reddit
"""issues with """"include"""" filter """,analytics,3,2.0,2011-07-26 02:13:40,jojoisphat,Reddit
Android Analytics referral tracking,analytics,1,0.0,2011-07-30 10:48:37,devarticles,Reddit
Help! User deleted google analytics profile,analytics,1,0.0,2011-08-04 20:40:34,ubrkifix,Reddit
How can I find high ranking non-US websites?,analytics,0,2.0,2011-08-09 19:56:09,jeremiahwarren,Reddit
Need some quick advice!!!,analytics,1,0.0,2011-08-17 03:41:33,Joobei,Reddit
I run a small deal aggregator. This is what the HP Touchpad deal did to my traffic.,analytics,0,0.0,2011-08-25 21:48:28,kbrower,Reddit
Analytics Multi-Channel Funnels Overview,analytics,1,0.0,2011-08-31 18:39:50,insite,Reddit
I have a second interview lined up tomorrow for a Web Analytics Position but I need help preparing.,analytics,1,0.0,2011-08-31 20:44:40,ClarenceCW,Reddit
HBX inventor &amp; Entrepreneur Blaise Barrelet blogs about how far website analytics has come since HitBox,analytics,1,0.0,2011-09-13 23:08:28,kaswing,Reddit
"Realtime data viz of users' paths on consultancy.com, with interesting methodology notes.  ",analytics,2,0.0,2011-09-14 02:01:17,kaswing,Reddit
"Website Key Performance Indicators, KPIs, You Need to Know",analytics,3,0.0,2011-09-14 19:05:44,Gaylias24,Reddit
Spend analysis - an overview,analytics,0,0.0,2011-09-27 09:37:32,[deleted],Reddit
Google Analytics gets premium version,analytics,1,1.0,2011-09-30 12:28:43,Gustomaximus,Reddit
Tracking Impressions,analytics,2,0.0,2011-10-10 17:48:34,teamcolab,Reddit
Anyone in the Cambridge/Boston area interested in hacking on some PitchFX Gameday data together?,analytics,4,0.0,2011-10-13 00:31:20,ohsnaaap,Reddit
"Renegade Economist Interviews Steve Keen .. ( Economics Prof, Neoclassical Economics critic, &amp; Aussie)",analytics,1,0.0,2011-10-15 19:47:54,xoday,Reddit
Question about three-month comparison in Google Analytics,analytics,1,0.0,2011-10-27 11:11:53,[deleted],Reddit
Google Analytics on a Subreddit?,analytics,3,8.0,2011-11-08 19:40:53,Franks2000inchTV,Reddit
Just me and my classmate with a huge check after winning Adobe's Web Analytics Competition,analytics,1,0.0,2011-11-12 01:34:51,[deleted],Reddit
Just me and my buddy with a huge check after winning the Adobe Web Analytics Competition,analytics,9,9.0,2011-11-12 01:49:05,TylerRiggs,Reddit
GA - How can I track clicks on a single link on a transition page hosted on another server/domain?,analytics,2,4.0,2011-11-18 00:43:27,gerbs,Reddit
Is there an Omniture debugger/tester that crawls the entire site?,analytics,3,5.0,2011-11-22 00:08:59,Phatferd,Reddit
Big Data and New Business Models,analytics,1,0.0,2011-12-12 04:59:36,fdiana,Reddit
GA: Cross sub-domain conversion tracking ,analytics,1,0.0,2011-12-13 19:14:46,thesupermikey,Reddit
Analytiks gives you the perfect snapshot of your Google Analytics on iOS,analytics,1,0.0,2011-12-15 21:41:49,shegeek,Reddit
Google Analytics Question,analytics,0,0.0,2012-01-12 23:33:48,tylerr82,Reddit
7 Alternatives to Google Analytics [X-Post from /PPC],analytics,1,0.0,2012-01-17 02:35:18,insite,Reddit
Google analytics question : Tracking multiple domains ,analytics,5,5.0,2012-01-23 18:35:25,allistaken,Reddit
Omniture training? ,analytics,1,0.0,2012-01-25 23:14:55,Kick79,Reddit
Tracking problem,analytics,0,8.0,2012-01-30 23:43:32,oddprocedure,Reddit
Not breaking your Google Analytics (like a pro) | PagerDuty Blog,analytics,1,0.0,2012-02-21 21:55:27,devopsninja,Reddit
How to check if Google Analytics account still exists?,analytics,0,0.0,2012-02-28 14:17:18,[deleted],Reddit
link adsense to analytics NEW INTERFACE,analytics,1,0.0,2012-03-07 18:41:52,MINECRAFTdotNET,Reddit
"My first app for real-time stats of your online activity. Track visits on any sites you want (you don't have to own them), provided that you can paste image from url on them - Need feedback from bloggers, webdevelopers, guys who sell stuff online, and those who put a lot of content online.",analytics,0,0.0,2012-03-21 12:46:55,MichaelStar,Reddit
Setting up GA with shopping cart on a different domain.,analytics,1,1.0,2012-03-28 19:09:36,djfoops,Reddit
Go to programming languages to learn for web analytics?,analytics,5,12.0,2012-03-30 19:54:09,ctdf,Reddit
"[HIRING!] Building an analytics team- multiple salaried openings with benefits and relocation assistance to Chattanooga, TN (a beautiful, fun city)",analytics,1,0.0,2012-04-18 18:10:18,recruitercain,Reddit
A Social Media Dashboard for Google Analytics,analytics,1,0.0,2012-04-25 00:15:39,xtmotion,Reddit
Google Analytics - Goal Type Event,analytics,1,0.0,2012-05-01 12:59:20,gregsfriend,Reddit
"Customizing Google Analytics Starts with Objectives, not Metrics",analytics,0,0.0,2012-05-02 02:55:35,mikkei,Reddit
"""What's the difference between """"unique visits"""" and """"unique visitors""""?""",analytics,0,0.0,2012-05-04 12:48:18,beyondawesome,Reddit
Google Analytics A/B testing with Wordpress,analytics,2,8.0,2012-05-09 12:42:02,topcat555,Reddit
Anybody working in analytics up for an AMA/AMAA?,analytics,1,0.0,2012-05-22 06:24:51,Benthetraveler,Reddit
Amazing web statistics you have never heard of before,analytics,1,0.0,2012-05-26 18:47:54,[deleted],Reddit
Own sites starting to show up as referral in Analytics like crazy. Any suggestion as to why?,analytics,1,4.0,2012-06-04 22:28:09,enemymechdestroyed,Reddit
Data Analytics: IT’s Ronco Veg-o-Matic for Data,analytics,1,0.0,2012-06-06 21:35:16,wordsmithie,Reddit
Track Yahoo Marketing &amp; Microsoft adCenter in Analytics,analytics,3,0.0,2012-06-08 20:04:52,praroop,Reddit
Jobplotter.com Site Info,analytics,0,1.0,2012-06-15 01:02:10,jobplotter,Reddit
How do you manage your Google Analytics campaign urls?,analytics,5,5.0,2012-06-21 11:24:07,snowliondev,Reddit
Track Yahoo Marketing &amp; Microsoft adCenter in Analytics,analytics,1,0.0,2012-06-22 10:05:46,praroop,Reddit
Adwords / Bing as a menu item in Google Analytics...,analytics,2,4.0,2012-06-25 19:42:36,ogaddi,Reddit
Whose Search Data is it Anyway? – Firefox to encrypt referring search strings,analytics,1,2.0,2012-07-03 19:10:08,gadgetgranny,Reddit
Two Handy SiteCatalyst Tools,analytics,3,3.0,2012-07-09 03:49:48,dansen926,Reddit
Anybody use Lucky Orange?,analytics,1,0.0,2012-07-17 20:43:38,iLLeT,Reddit
Scientific Attribution: Maximizing Digital ROI,analytics,0,1.0,2012-07-24 18:47:06,seobkv,Reddit
Data Changes Everything: Delivering on the Promise of Learning Analytics in Higher Education (EDUCAUSE Review) | EDUCAUSE.edu,analytics,5,0.0,2012-07-25 20:17:54,edwsonoma,Reddit
"Gmid Associates is a result driven management consulting, analytics outsourcing and data analytics services firm having expertise in verticals like Banking and Financial Analytics, Insurance Analytics, Telecom Analytics, Retail Analytics.",analytics,1,0.0,2012-07-30 15:00:37,muditchandra,Reddit
Webinar this Thursday: Multi-Channel Funnels xpost from /MadeForAdsense,analytics,1,0.0,2012-08-07 21:22:29,webproseonet,Reddit
How do I create and send reportsin the new version of Google Analytics?,analytics,1,0.0,2012-08-10 14:23:32,Drendo,Reddit
The Secrets to Managing Business Analytics Projects,analytics,1,0.0,2012-08-10 18:59:08,aoifemcgivern,Reddit
Two Helpful Tips for Google Analytics Users,analytics,1,0.0,2012-08-12 20:58:44,SEOGenX,Reddit
Would this tool help small businesses with their analytics?,analytics,1,0.0,2012-08-16 19:19:00,true_ben,Reddit
8 Simple yet Powerful RegEx Concepts for Google Analytics,analytics,9,0.0,2012-08-21 15:37:46,mike_arnesen,Reddit
You Are the Product: Topsy’s New Pro Analytics Tool as the All-Seeing Eye,analytics,3,1.0,2012-08-21 18:23:19,limefest,Reddit
Analysis of Xtranormal EDUC1751,analytics,1,0.0,2012-08-23 10:08:52,EmmaLeeS,Reddit
High bounce periodically on Sundays?,analytics,3,7.0,2012-09-05 11:34:08,shortcut187,Reddit
Facebook report - Wolfram|Alpha Clip 'n Share,analytics,0,1.0,2012-09-09 14:54:22,javamanromeo,Reddit
NICE Speech Analytics - Why Combining Phonetics and Transcription Works Best,analytics,1,0.0,2012-09-09 21:29:07,givcan,Reddit
"When It Comes to Supply Chain Data, Is Less More?",analytics,3,0.0,2012-09-10 18:29:47,kprevet,Reddit
How to analyze a company's financial,analytics,1,0.0,2012-09-12 06:28:38,lagaligo,Reddit
Can data science actually become a spectator sport in the analytics community?,analytics,1,0.0,2012-09-13 02:39:42,[deleted],Reddit
Bizarre Analytics Riddle - Would Love Some Reddit Help with Analysis ,analytics,2,7.0,2012-09-18 03:28:05,iNinjaNotes,Reddit
want to be google analytics certified by the end of the day. advice?,analytics,3,10.0,2012-09-18 18:38:40,laydownlarry,Reddit
Call Quality Assurance,analytics,1,0.0,2012-09-18 19:09:25,[deleted],Reddit
Why Putting the Enterprise in the Cloud Makes Sense,analytics,0,2.0,2012-09-21 21:19:06,Slimys9,Reddit
Special Topics in Analytics for MBA?,analytics,1,6.0,2012-09-21 23:36:14,imnotthomas,Reddit
Send secret messages to Google Analytics users (anyone have any creative ideas?),analytics,1,0.0,2012-09-23 20:51:51,dataeverywhere,Reddit
"NEW POST: Finding the Right Attributes in Visitor Scoring, Lead Scoring, and Customer Scoring   ",analytics,1,0.0,2012-09-24 21:05:22,extractable,Reddit
Pandora's Analytics vs Google Analytics performance,analytics,1,0.0,2012-09-26 02:26:18,shopvavavoom,Reddit
Democracy Ticker,analytics,1,0.0,2012-10-06 00:06:20,jrockdc,Reddit
Want to be trained in SiteCatalyst / Omniture to increase my chances of a job,analytics,1,1.0,2012-10-07 15:53:59,spudgun00,Reddit
Gmid Associates: Data Sciences and Analytics,analytics,1,0.0,2012-10-09 22:04:54,Gmid,Reddit
Tracking Visits with Piwik Analytics in Rails,analytics,2,2.0,2012-10-11 00:09:39,skelkingur,Reddit
Segment Google Analytics reports by age and gender (Facebook hack),analytics,6,4.0,2012-10-11 14:36:54,aladata,Reddit
Measuring Search Marketing for Lead Gen: A Basic Primer,analytics,1,0.0,2012-10-12 00:20:55,kjshea,Reddit
Need help with relevant dashboard for web publisher,analytics,1,0.0,2012-10-16 05:09:47,[deleted],Reddit
Advertising Roi | Visualizing Data | Customized Reporting | Goal Tracking,analytics,2,0.0,2012-10-16 09:00:03,harishsheel007,Reddit
Transitions and GeoIP in Piwik 1.9,analytics,3,0.0,2012-10-16 15:14:35,skelkingur,Reddit
Google Analytics para tu blog sin tener ni idea,analytics,1,0.0,2012-10-19 12:30:52,anibalbilbao,Reddit
Tracking the IPv6 reach of your Website with Piwik,analytics,1,0.0,2012-10-23 13:08:36,skelkingur,Reddit
Does mobile device traffic cannibalize desktop traffic?,analytics,2,3.0,2012-10-23 22:43:49,[deleted],Reddit
"""Do you need a """"BS Detector""""?""",analytics,1,0.0,2012-10-24 19:30:47,dansen926,Reddit
Gathering Analytics from Text-Based Browsers?,analytics,1,0.0,2012-10-24 23:24:53,jecxjo,Reddit
"created a little GA app as a superior dashboard interface, would appreciate feedback on where next to take it",analytics,3,3.0,2012-10-25 11:38:17,skunkd,Reddit
Does traffic from my email newsletter ever appear as 'Direct'?,analytics,1,0.0,2012-10-26 12:58:33,[deleted],Reddit
Keywords will not be provided.,analytics,1,0.0,2012-10-27 07:28:29,thompsoon,Reddit
Google Social Analytics – Another tool in your Google toolbox   | Water Cooler,analytics,1,0.0,2012-10-29 22:41:27,mchantry16,Reddit
What’s in a Heatmap? Predictive Eye-Tracking versus Click-Tracking,analytics,2,0.0,2012-10-31 18:27:42,gocanucks1916,Reddit
WANTED: A/B TESTING MANIAC IN BAY AREA,analytics,0,0.0,2012-11-04 09:20:14,didyoutestit,Reddit
LCI Blog: Analytics – Find Out What’s Working for Your Business,analytics,1,0.0,2012-11-05 21:55:36,LandisPR,Reddit
Digital Analytics jobs in Southern California,analytics,1,0.0,2012-11-09 00:48:32,zenkutsu64,Reddit
Using Google Analytics For Keyword Research,analytics,1,0.0,2012-11-09 17:13:45,onlinere,Reddit
Do You Know What Your Bounce Rate Is?,analytics,1,0.0,2012-11-09 18:12:47,michellestevens,Reddit
N00b GA E-commerce tracking question,analytics,2,5.0,2012-11-11 21:05:25,savocado,Reddit
Business Outcomes | Strategy Analytics | Financial Analytics | Investment Analytics,analytics,1,0.0,2012-11-12 14:26:55,seenath,Reddit
What the Obama Emails teach us about Email Marketing,analytics,1,0.0,2012-11-14 22:09:55,[deleted],Reddit
Analysis,analytics,1,0.0,2012-11-16 01:27:01,[deleted],Reddit
Designing your Analytics Strategy | SALO Consulting,analytics,1,0.0,2012-11-19 22:58:58,SALOconsulting,Reddit
The Future of Online Display Ads (Infographic),analytics,1,0.0,2012-11-21 13:04:48,Bemuzed,Reddit
Big Data Analytics: How Moneyball has changed the game for everyone,analytics,1,0.0,2012-11-22 12:57:37,Beyondroid,Reddit
Omniture question - benchmarking our blog site,analytics,1,0.0,2012-11-23 17:00:24,[deleted],Reddit
Android vs iOS: which users are happier?,analytics,2,0.0,2012-11-26 21:55:38,Ifinoi,Reddit
"Web Analytics: How to Handle Direct Traffic, Not Provided, Dark Social and Do Not Track",analytics,1,0.0,2012-11-27 21:13:58,rightsource,Reddit
"Why your dashboards suck, and 4 things you can do about it",analytics,1,0.0,2012-11-27 23:41:18,HaveWhatShesHaving,Reddit
"""On marketing's """"big data"""" opportunity and how small businesses can capitalize""",analytics,1,0.0,2012-11-28 00:37:09,JulianneOmlam,Reddit
Which analytics should my friend (really) believe? cirtex web statistics vs google analytics?,analytics,1,0.0,2012-11-29 23:33:20,captain_goodnight,Reddit
Dharmik ALL (Daily analysis for Dow Jones &amp;amp; Daily analysis for EUR/USD),analytics,1,0.0,2012-11-30 03:04:39,bartmartin252,Reddit
SEO Tools: Making Google Analytics Work For You,analytics,0,0.0,2012-12-02 20:57:27,Clundge,Reddit
Is there a tool that will let me manage multiple analytics?,analytics,2,11.0,2012-12-04 02:15:27,ragnvaldr2,Reddit
Mapping the Future: 3 Essential Terms You Must Redefine Today,analytics,1,0.0,2012-12-06 05:09:39,TL212,Reddit
Exporting a custom attributes report to Excel?,analytics,1,0.0,2012-12-07 01:31:38,[deleted],Reddit
Pimp your Analytics with multi-attribution marketing,analytics,1,1.0,2012-12-11 08:14:06,jbarb2903,Reddit
Is Your Brand Great At Digital Marketing? A Diagnostic Framework.,analytics,3,0.0,2012-12-12 09:42:07,Codefly,Reddit
Check out the SiteCatalyst Users Community on G+,analytics,0,2.0,2012-12-13 23:59:49,[deleted],Reddit
Need Help w/ Regular Expressions?  Here is a Handy RegEx Generator to Make Life Easy.,analytics,0,0.0,2012-12-19 14:48:11,sck419,Reddit
