title,subreddit,score,num_comments,created_date,author,platform
We all know correlation (r squared) doesn't equal causation. How does one prove/show causation statistically or analytically?,analytics,6,16.0,2014-12-01 19:52:48,kashmoney7,Reddit
Market Media Releases Free Google Analytics | Beginners Guide - Chapter 3,analytics,1,0.0,2014-12-01 23:27:39,ericNELSON1964,Reddit
Track Contact Form Goal Conversion Rate by Page in One Report?,analytics,3,3.0,2014-12-01 23:48:48,tsunami141,Reddit
[Marketing]How I track banner impressions using Google Tag Manager and Universal Analytics,analytics,1,0.0,2014-12-02 17:10:54,suleman1103,Reddit
"Case Studies: After Installing Voodoo Alerts, Client Realizes Their Losing $11,200 Monthly Due to IE7 Incompatibility - Website Monitoring Blog by Voodoo AlertsWebsite Monitoring Blog by Voodoo Alerts",analytics,1,0.0,2014-12-02 23:57:00,VoodooAlerts,Reddit
New iOS app that makes it really easy to track basic Google Analytics metrics from your Today view,analytics,2,7.0,2014-12-03 03:35:57,[deleted],Reddit
What to learn for potential analytics product?,analytics,3,7.0,2014-12-04 17:19:34,mememuu,Reddit
Real time(!) intelligence alerts,analytics,3,2.0,2014-12-04 22:06:08,lentebriesje,Reddit
How to Promote Your Business Online? Increase Your Sales and Revenue,analytics,1,0.0,2014-12-06 08:18:04,doodleblue,Reddit
Analytics blog for freshers,analytics,1,0.0,2014-12-08 01:01:53,growthfishacademy,Reddit
How to make a 'small multiples' chart in R (basic multivariate data visualization),analytics,2,4.0,2014-12-08 19:08:22,SharpSightLabs,Reddit
Sessions vs. Pageviews: Which Metric Should You Measure?,analytics,1,0.0,2014-12-08 20:17:29,Bemuzed,Reddit
"""GA Help: How to capture """"sitesearch"""" queries occurring within a mobile app...?""",analytics,3,5.0,2014-12-09 07:40:18,gutterandstars,Reddit
Measuring SEO Success in Google Analytics,analytics,1,0.0,2014-12-09 09:14:27,jgojocruz,Reddit
Predictive Models for your Business,analytics,1,0.0,2014-12-09 11:39:15,shlok123,Reddit
Real time Analytics for Insurance Industy,analytics,1,0.0,2014-12-09 11:52:47,awaez,Reddit
Tracking/Flagging Individual Pages?,analytics,2,2.0,2014-12-09 15:54:43,Jelly23,Reddit
Successfully Completed Google Mobile App Analytic Certification,analytics,1,0.0,2014-12-09 21:29:16,[deleted],Reddit
Google Analytics Course,analytics,1,0.0,2014-12-09 21:42:29,ericNELSON1964,Reddit
Holiday Sale: 75% off some SAS/Analytics Books,analytics,3,0.0,2014-12-09 23:27:06,horaceGrant,Reddit
Google tag manager and firing multiple GA from different containers,analytics,7,6.0,2014-12-10 05:20:20,MrMag00,Reddit
Current 1st year MBA student...having a life crisis about switching programs.,analytics,2,5.0,2014-12-10 09:51:28,Munz3215,Reddit
This guy,analytics,16,7.0,2014-12-10 11:03:00,tessellation_rider,Reddit
How to setup Search-and-replace filters - Am I being stupid?,analytics,3,6.0,2014-12-10 13:51:04,kit_son,Reddit
Google Analytics | Beginners Guide - Chapter 4,analytics,1,0.0,2014-12-10 23:22:30,ericNELSON1964,Reddit
Connecting the dots in cross-device customer paths,analytics,1,0.0,2014-12-11 12:02:57,mikp70,Reddit
"What are the best free tools for facebook pages reports, a part from Facebook Insight ?",analytics,3,2.0,2014-12-12 12:43:12,BENNANIALAE,Reddit
What symptoms will using old style GA code cause in a UA account with goals linked into Adwords ?,analytics,2,4.0,2014-12-13 00:17:28,MrMag00,Reddit
"Deciding what to measure for an event based analytics service (such as Calq, Mixpanel, KISSmetrics etc)",analytics,2,0.0,2014-12-13 21:08:30,RRAway,Reddit
Enrolling in BSc Business Analytics - need career advice.,analytics,4,5.0,2014-12-16 03:05:25,yonghf,Reddit
"With Universal Analytics, what is the importance of sending a page object with my event tracking?",analytics,1,5.0,2014-12-16 03:10:13,Groggie,Reddit
Watch Weekly Cohort Retention from Day One,analytics,0,0.0,2014-12-16 06:09:44,rywalker,Reddit
The Pitfalls of Rapid Split-Testing,analytics,1,1.0,2014-12-16 07:26:09,shoreshotweb,Reddit
Magnify Your Analytics To A Granular Level With Event Tracking - Website Monitoring Blog by Voodoo AlertsWebsite Monitoring Blog by Voodoo Alerts,analytics,1,0.0,2014-12-16 21:37:56,VoodooAlerts,Reddit
Shouldn't Google Tag Manager be simple to use?,analytics,1,17.0,2014-12-17 14:57:14,gverrilla,Reddit
Tracking Facebook Users in Google Analytics - An Introductory Guide,analytics,3,0.0,2014-12-17 17:11:43,megalytic,Reddit
How to add a tracking code to all links you make?,analytics,2,8.0,2014-12-18 01:47:26,decoy98,Reddit
Using Real User Monitoring To Make Your Marketing Relevant Once More - Website Monitoring Blog by Voodoo AlertsWebsite Monitoring Blog by Voodoo Alerts,analytics,1,0.0,2014-12-18 03:21:58,VoodooAlerts,Reddit
_setCustomVar Google Analytics issue,analytics,1,0.0,2014-12-18 08:29:13,nellyshark,Reddit
How to track articles in the order which they occurred.(Site catalyst) Urgent request Please,analytics,1,1.0,2014-12-18 11:30:47,familypack,Reddit
"Im looking for something like SOCIALBAKER but free for my facebook brand pages, any help please?",analytics,0,4.0,2014-12-18 14:17:22,[deleted],Reddit
Best place to get some in-depth education on Google Analytics and AdWords etc.?,analytics,1,2.0,2014-12-19 20:35:51,imaworkaholic,Reddit
Remove Semalt from Google Analytics,analytics,1,0.0,2014-12-19 23:43:13,acoustics86,Reddit
Google Analytics Beginners Course Ch. 3,analytics,1,0.0,2014-12-20 00:31:51,WTF12321,Reddit
Google Analytics 101: Getting Started,analytics,0,1.0,2014-12-20 11:20:14,deepanshugahlaut,Reddit
Obsolete SEO Techniques - Old SEO Methods that you need to stop in 2014 and 2015,analytics,0,4.0,2014-12-21 15:53:05,Lifets70,Reddit
4 Helpful Things You Can Do With Google Analytics,analytics,1,0.0,2014-12-22 22:59:32,[deleted],Reddit
How hard is it to get into an M.S. in Analytics program?,analytics,1,0.0,2014-12-25 01:35:05,[deleted],Reddit
Find timing of campaign referral? (Google Analytics),analytics,2,2.0,2014-12-26 03:31:54,coolandsmartrr,Reddit
Tips to increase youtube subscribers and youtube views,analytics,1,0.0,2014-12-26 14:01:51,[deleted],Reddit
Weird spammy referral links in my Google Analytics referral channels.,analytics,3,9.0,2014-12-26 15:59:08,nectar75,Reddit
Creating an exclude filter with multiple criteria?,analytics,1,7.0,2014-12-29 21:22:31,msaz87,Reddit
How To Install Google Analytics on WordPress,analytics,1,1.0,2014-12-30 15:29:11,mehmetcoskun,Reddit
Recommended Web Analytics Software?,analytics,1,18.0,2015-01-01 20:21:21,chewy747,Reddit
Google Analytics | Beginners Guide - Chapter 5,analytics,1,0.0,2015-01-01 21:55:33,ericNELSON1964,Reddit
Dysfunctional Analytics,analytics,1,0.0,2015-01-02 20:08:53,docligot,Reddit
Would anyone be willing to critique my masters in Business Analytics program SOP? Feel free to rip it to shreds.,analytics,8,3.0,2015-01-03 21:13:04,iKidA,Reddit
Is there a way to delete multiple Custom Alerts at once?,analytics,2,0.0,2015-01-04 01:40:38,thomasde,Reddit
"Simple Scatter Plot of 9,948 Reddit Moderators; click and drag to zoom or pinch on touch devices",analytics,1,1.0,2015-01-04 05:30:19,[deleted],Reddit
"Google Partner, Market Media, Releasing Chapter 5 of Google Analytics Beginners Guide",analytics,1,3.0,2015-01-05 23:05:58,ericNELSON1964,Reddit
What tool for auto generate utm-link you use/recommend?,analytics,1,0.0,2015-01-05 23:13:49,PandaLoveFox,Reddit
"Created new views for a website, lost previous month's data",analytics,0,4.0,2015-01-06 14:10:56,alexjames213,Reddit
Group report rows by regex,analytics,0,5.0,2015-01-06 16:33:23,dunisq,Reddit
Built Product to Automatically Pull Insights from Google Analytics. I could use your feedback.,analytics,8,3.0,2015-01-06 19:16:25,jet311,Reddit
Reddit popularity linked to pagerank on Google,analytics,1,0.0,2015-01-06 20:52:41,[deleted],Reddit
Reddit popularity linked to pagerank on Google,analytics,0,0.0,2015-01-06 21:38:27,dublinclontarf,Reddit
Newb Question: Verifying Goal,analytics,0,6.0,2015-01-07 18:17:07,waverlyposter,Reddit
How to Connect Google Analytics with R: A 7 Step Heatmap Tutorial,analytics,1,0.0,2015-01-07 23:43:58,Lukaslo,Reddit
Hitsteps Ultimate Web Analytics is Free now!,analytics,1,0.0,2015-01-08 05:51:03,hitsteps,Reddit
Track users if they booked a hotel through our website.,analytics,1,0.0,2015-01-08 07:53:32,[deleted],Reddit
Google Analytics Write up report.,analytics,1,0.0,2015-01-08 16:08:15,Broosephhhh,Reddit
Measuring Active Users,analytics,1,3.0,2015-01-08 17:00:53,failcookie,Reddit
Importing data by email,analytics,0,3.0,2015-01-08 21:03:00,Robo-boogie,Reddit
Attack of the Spam Referral Sites!,analytics,1,0.0,2015-01-08 23:21:20,thesharc,Reddit
Tracking Campaigns with Google Analytics,analytics,0,2.0,2015-01-09 00:59:05,WishSeo,Reddit
How To Fix Common Google Analytics Notifications,analytics,1,0.0,2015-01-09 10:56:33,kushal_shah,Reddit
"Google Analytics | TrooTracMedia|Digital Marketing Agency &amp; Affiliate Network, Delhi, India",analytics,1,0.0,2015-01-09 11:32:51,TrooTrac,Reddit
Why Do Web Analytics Give Different Numbers?,analytics,1,0.0,2015-01-09 17:34:49,hitsteps,Reddit
The State of Digital Analytics in 2015,analytics,9,0.0,2015-01-09 18:12:40,loopymindset,Reddit
Creating Goals in Google Analytics,analytics,1,0.0,2015-01-09 22:07:18,WishSeo,Reddit
Google Analytic Goals,analytics,0,1.0,2015-01-09 22:55:23,WishSeo,Reddit
How can I track conversion for a user that hits specific pages?,analytics,1,0.0,2015-01-09 23:52:02,LaTokarz,Reddit
Webinar: Google Analytics Data Mining with R (includes 3 Real Applications) - with Google!,analytics,1,0.0,2015-01-10 14:34:17,bsatani,Reddit
"I want to develop the ultimate cooking/recipe sharing app ever, please help me collect data for my market research!",analytics,2,2.0,2015-01-10 15:02:28,Buck_McChamp,Reddit
Specific page demographics on Google Analytics,analytics,3,3.0,2015-01-11 18:29:31,_Steviiee,Reddit
3 Metrics in Google Analytics to Measure User Engagement,analytics,1,0.0,2015-01-12 00:55:09,WishSeo,Reddit
Simple iOS app shows you multiple analytics properties in a single Today widget,analytics,4,0.0,2015-01-12 22:02:26,ryno2019,Reddit
Google Analytics | Beginners Guide - Chapter 5 | Video Blog,analytics,1,0.0,2015-01-12 23:30:35,777KarenStewart777,Reddit
Bounce Rate: Definition and its Importance in Blogging,analytics,1,0.0,2015-01-13 08:23:32,gamingexper,Reddit
Introduction to Big Data - Part 1,analytics,0,0.0,2015-01-13 12:40:08,PoojaKulkarni,Reddit
How is this possible?,analytics,2,10.0,2015-01-13 19:46:18,kevando,Reddit
[Tutorial] Building a dashboard with the Google Analytics Spreadsheet Add-on,analytics,12,1.0,2015-01-14 08:25:24,gutterandstars,Reddit
"Hotjar - Detailed insights, includes heatmaps, feedback and exit polls, surveys and others",analytics,0,0.0,2015-01-14 14:32:22,[deleted],Reddit
Retrieving Custom Segment List from GA API?,analytics,1,4.0,2015-01-14 16:15:17,smittypants,Reddit
Using Google Analytics Data,analytics,1,0.0,2015-01-14 19:18:44,WishSeo,Reddit
Google Analytics Checkup for the New Year,analytics,0,0.0,2015-01-14 20:57:31,megalytic,Reddit
I need help with this extremely weird problem : Subdomains &amp; Analytics,analytics,1,2.0,2015-01-15 16:23:15,[deleted],Reddit
Referring domain with bounce rate in SiteCatalyst?,analytics,1,0.0,2015-01-15 19:58:20,kp2015,Reddit
Your own traffic can be messing up your data.,analytics,1,0.0,2015-01-15 21:42:21,WishSeo,Reddit
Moving from Adobe Analytics to Google Premium,analytics,1,10.0,2015-01-16 00:23:16,loungelife,Reddit
Master Keyword Research in 7 Days,analytics,1,0.0,2015-01-16 12:46:00,RicharGreearyaih,Reddit
Adobe Report Builder and SiteCatalyst Resources Needed,analytics,6,8.0,2015-01-16 16:46:11,failcookie,Reddit
The Complete Digital Analytics Ecosystem: How To Win Big,analytics,1,0.0,2015-01-16 17:31:12,[deleted],Reddit
The Complete Digital Analytics Ecosystem: How To Win Big,analytics,2,7.0,2015-01-16 18:19:24,Skyruner3,Reddit
Best time for GTM Implementation?,analytics,3,8.0,2015-01-16 20:27:31,essee-bro,Reddit
Learn how visitors flow through your website,analytics,1,0.0,2015-01-16 23:00:18,WishSeo,Reddit
If a Girl Smiles at You Does She Like You? Checkout on this aggregator for analytics and Big data.,analytics,0,2.0,2015-01-17 10:26:59,udyog,Reddit
"Uhh, thanks Russia? Can anyone tell me whats up? (More in comments)",analytics,1,12.0,2015-01-17 23:20:42,luckeycat,Reddit
"Analytics For All- Beginners to Experts: An umbrella course that opens doors to an international community, helps you apply analytics in every walk of life and make data backed decisions! Find a connection between the most unrelatable (It's a word!) events to come to extraordinary conclusions.",analytics,1,0.0,2015-01-19 06:55:37,analytics123,Reddit
Making Better Business Decisions With Predictive Analytics,analytics,2,0.0,2015-01-19 17:20:59,Meip,Reddit
Mobile analytics tools worth looking at,analytics,1,0.0,2015-01-19 17:51:37,ittybittyusability,Reddit
Connecting Google Analytics with AppEngine (Python) and d3js,analytics,2,0.0,2015-01-20 04:47:13,Lukaslo,Reddit
A Statistical Formula for What Drives Up Your Bounce Rate,analytics,1,1.0,2015-01-20 16:11:28,jet311,Reddit
Tracking dynamic links on Wordpress site,analytics,1,1.0,2015-01-20 18:59:03,sfamicom,Reddit
"Without analytics, the Internet of Things would provide little value",analytics,0,0.0,2015-01-20 20:02:44,mtl1015,Reddit
GA without coding background,analytics,6,11.0,2015-01-20 22:04:49,mizman25,Reddit
"""""""What's the best tool for web analytics?"""" A personal review.""",analytics,0,0.0,2015-01-21 02:10:59,FR314,Reddit
Professional Associations,analytics,1,1.0,2015-01-21 03:14:43,Short_dawg,Reddit
"I need a serious hardcore chat about attribution. Paid search, paid lead sources. Who wants to get into the weeds with me?",analytics,1,0.0,2015-01-21 04:04:46,[deleted],Reddit
Find out the facebook person who shared/posted about my content,analytics,4,4.0,2015-01-21 10:04:53,romeo-onisim,Reddit
WebCEO Moves Your Site Quality Checks to a New Level,analytics,0,1.0,2015-01-21 14:49:16,[deleted],Reddit
Check it if you are tired to copy filters across GA accounts. Google Analytics filters copy free tool,analytics,1,1.0,2015-01-22 11:42:43,levashovbiz,Reddit
Linking AdWords to Google Analytics &amp; Webmaster Tools,analytics,1,0.0,2015-01-22 22:25:38,Bemuzed,Reddit
Why do my URLs show up as organic search keywords?,analytics,2,3.0,2015-01-23 16:35:28,ChristianBentanke,Reddit
How to Filter Out Fake Referrals and Other Google Analytics Spam,analytics,7,1.0,2015-01-23 17:07:00,megalytic,Reddit
3 Intelligent Ways To Invigorate Your Data Approach,analytics,3,0.0,2015-01-23 18:45:02,essee-bro,Reddit
Can I run a Google Analytics A/B test using 2 entirely separate domains?,analytics,1,7.0,2015-01-23 23:16:04,Kthulu666,Reddit
I need a clever plan to find out who is visiting my online profile.,analytics,1,0.0,2015-01-24 01:47:40,thenoucrew,Reddit
Tool that shows you revenue-maximising prices for your products based on your Google Analytics data,analytics,3,0.0,2015-01-24 13:39:44,SimpleMetrics,Reddit
Painfully basic questions from an intimidated copywriter,analytics,1,0.0,2015-01-24 22:29:54,[deleted],Reddit
Type of Attribution Model that you use for your eCommerce?,analytics,1,0.0,2015-01-25 18:10:08,[deleted],Reddit
Facebook pixel showing wrong hits,analytics,1,3.0,2015-01-25 19:55:29,gverrilla,Reddit
Embedding real-time analytics into business processes,analytics,1,0.0,2015-01-26 05:38:52,fulltimemom,Reddit
Free Google Analytics Audit Tool - Check your Analytics setup in a few seconds!,analytics,1,1.0,2015-01-26 06:30:50,corneliushdo,Reddit
Question about Omniture : Is there any tool were we get page names for the list of URL's given,analytics,5,3.0,2015-01-26 14:01:52,familypack,Reddit
Video Intelligence Data Drives Decision Making,analytics,1,0.0,2015-01-26 17:39:58,Ned007,Reddit
MySiteVitals sends a simple Google Analytics dashboard to your inbox each morning,analytics,1,0.0,2015-01-26 19:26:19,_msv_,Reddit
Facebook Ads &amp; Google Analytics Discrepancies,analytics,6,8.0,2015-01-26 19:27:04,seooptimizers,Reddit
Facebook is driving 25% of all web traffic,analytics,1,0.0,2015-01-26 20:22:57,troy_petersen,Reddit
FREE 1hr Course on Google Tag Manager.,analytics,1,0.0,2015-01-27 01:23:12,d-grex,Reddit
Google Analytics - Minute Dimension (visualizations in R),analytics,1,0.0,2015-01-27 01:37:43,Lukaslo,Reddit
Question: Should you track events in the frontend or backend for a web app,analytics,3,2.0,2015-01-27 12:11:06,joshcrowder,Reddit
Compare several months automatically in Analytics Dashboard reports.,analytics,1,0.0,2015-01-27 14:54:05,Gustav_Teveo,Reddit
Tracking metrics from your Trello board with an information radiator,analytics,0,0.0,2015-01-27 15:53:41,slinna1,Reddit
Why you should learn R first to learn data science,analytics,6,1.0,2015-01-27 16:01:11,SharpSightLabs,Reddit
"I've got three coupons for game analytics platform valid till 31st January, maybe worth checking out.",analytics,2,3.0,2015-01-27 18:44:06,hackal,Reddit
Google Analytics and 301 / 302 redirects - How it works,analytics,1,0.0,2015-01-27 23:23:33,Bemuzed,Reddit
How to Use the Google Analytics Frequency &amp; Recency Report,analytics,1,0.0,2015-01-28 00:16:42,Bemuzed,Reddit
Any Cardiolog Sharepoint Analytics Users?,analytics,1,5.0,2015-01-28 01:26:56,nnulk,Reddit
defer-analytics: easily defer loading and firing events for GA's analytics.js. Useful in reducing noise.,analytics,1,0.0,2015-01-28 11:24:01,__debug__,Reddit
View Google Analytics with graphs and time/time comparisons in a widget for iOS,analytics,0,0.0,2015-01-28 14:55:38,[deleted],Reddit
Choose Your Reporting Tool: Balancing Between Overpaying and Excessive Sparing,analytics,1,0.0,2015-01-28 19:07:59,Kraftblick,Reddit
Defining Assisted Conversions,analytics,1,0.0,2015-01-28 20:09:47,thesharc,Reddit
Does anyone know how to clean out spam referring sites?,analytics,4,8.0,2015-01-28 21:56:31,AaronKleiber,Reddit
Why having a growth-oriented chief data officer matters,analytics,1,0.0,2015-01-28 22:13:08,stratandbiz,Reddit
Request: Looking for users to test a new web analytics service,analytics,1,0.0,2015-01-28 23:22:42,moxdroid,Reddit
How do I measure the effectiveness of Coop banners on an eCommerce?,analytics,1,0.0,2015-01-28 23:39:59,redrockett,Reddit
Google Analytics Event Reporting Help,analytics,1,4.0,2015-01-29 17:26:44,Beloved_,Reddit
Looking for ENTP personality types for a project,analytics,0,0.0,2015-01-29 20:25:42,Usernamemeh,Reddit
5 cool examples of UTM tracking,analytics,1,0.0,2015-01-29 22:59:03,Bemuzed,Reddit
"7000 3-tier links, see immediate results, spread across different platforms, see and order now",analytics,1,0.0,2015-01-30 00:19:04,burtkohl,Reddit
Econometrics or Business Analytics major?,analytics,3,1.0,2015-01-30 13:37:36,academyawardwinner,Reddit
Talking with the Boss - How do I make the transition to full analytics?,analytics,7,10.0,2015-01-30 21:45:32,failcookie,Reddit
[Help with GA Site Search]: Keyword is showing as 'CacheXXXX_StoreLocator' instead of actual keyword,analytics,2,4.0,2015-02-01 10:24:43,gutterandstars,Reddit
Why are half of my page views from Brazil?,analytics,2,9.0,2015-02-01 21:50:17,kateelinb,Reddit
SunDay_!! Super Bowl 2015 [live]. [StEam].. Seahawks..vs..Patriots..XLIX..[online]..TonIght,analytics,1,0.0,2015-02-02 00:26:08,hkhan96,Reddit
Do Super Bowl ads payoff?,analytics,1,0.0,2015-02-02 16:57:48,ajhuntley1990,Reddit
The Superbowl Effect on Traffic (Hourly Analytics Compared to Last Week),analytics,7,7.0,2015-02-02 18:53:32,flexpex,Reddit
Seven Reasons Why America’s Wars Aren’t Ending Anytime Soon !!!,analytics,1,0.0,2015-02-02 21:47:18,Emadx,Reddit
"The WHY, WHAT and HOW of a Shared Services Model for Business Intelligence &amp; Analytics",analytics,1,0.0,2015-02-03 10:33:41,WNSGlobal,Reddit
Why Most Marketers Fail at Web Analytics,analytics,1,3.0,2015-02-03 12:35:42,ynavot,Reddit
"[GUA]: Campaign codes pass in page URL, not in page load image request.",analytics,0,4.0,2015-02-03 21:24:37,[deleted],Reddit
Move a property between Accounts,analytics,2,6.0,2015-02-03 23:33:34,megashitfactory,Reddit
Google Analytics Audit: A 10-Point Checklist to Collect Accurate Data (17/30),analytics,1,0.0,2015-02-04 06:14:47,ninsky01,Reddit
The Key to B2B Marketing Success: Let Analytics Tell the Story,analytics,0,0.0,2015-02-04 20:26:12,SIGMAmarketing,Reddit
Spam/Bot Sites - Master List,analytics,12,4.0,2015-02-04 21:19:10,thisiswilson,Reddit
What's Worth Measuring in Your Startup?,analytics,1,0.0,2015-02-04 22:00:12,karolzielinski,Reddit
People Analytics: The Refreshing New Tool By GoSquared,analytics,1,0.0,2015-02-05 07:27:42,designsncodes,Reddit
How to use Twitter Analytics to Uncover Starbucks’ Paid Tweet Strategy,analytics,2,0.0,2015-02-05 10:24:07,breeanne,Reddit
Mobile Analytics Guide for Mobile Websites,analytics,1,1.0,2015-02-05 10:51:42,breeanne,Reddit
Comparing analytics between 2 sites,analytics,1,3.0,2015-02-05 16:50:51,sparge,Reddit
Looking at Google Analytics data per capita,analytics,2,0.0,2015-02-06 01:01:39,Lukaslo,Reddit
Metrics Watch - Alerts for Google Analytics (and other metrics sources),analytics,0,0.0,2015-02-06 05:13:59,[deleted],Reddit
Google Analytics for Startups: 5 Important Metrics to Use,analytics,1,0.0,2015-02-06 08:16:24,ninsky01,Reddit
Webinar: Everything You Need to Know about Google Tag Manager V2,analytics,1,0.0,2015-02-06 16:06:17,bsatani,Reddit
How to Filter Out Referrer Spam in Google in Under Two Minutes,analytics,8,7.0,2015-02-06 16:22:12,bowpack,Reddit
Behavior flow visualization as a service,analytics,2,0.0,2015-02-06 18:10:50,rywalker,Reddit
Adobe DTM Experience?,analytics,1,8.0,2015-02-07 21:44:17,Gre3kgeek,Reddit
Fake Google Analytic traffic caught red handed,analytics,15,11.0,2015-02-07 23:54:53,orderofout,Reddit
Does anyone want to start a fake company with me? [Serious],analytics,1,6.0,2015-02-09 03:10:30,[deleted],Reddit
Is there any way to calculate potential reach based off impressions?,analytics,3,2.0,2015-02-09 18:42:13,DrVonNostren,Reddit
SPOTLIGHT | ATTN! Data Scientists &amp; Data Analysts |”MODE” JUST GOT BETTER!,analytics,1,0.0,2015-02-10 05:50:17,Friars1993,Reddit
What's the best way to track where the traffic is coming from for a single page in my site?,analytics,1,7.0,2015-02-10 12:25:16,studavis,Reddit
"Electrolux Major Appliances is looking to hire a Senior Finance Analyst in Luton, UK",analytics,1,0.0,2015-02-10 14:18:19,btbsilent,Reddit
Analytics people have trouble communicating with carbon-based life forms. Here's why that's a problem.,analytics,0,0.0,2015-02-10 17:50:15,mtl1015,Reddit
How do you organize your raw data? (Excel),analytics,6,4.0,2015-02-10 19:46:12,failcookie,Reddit
Question about analytic services.,analytics,1,0.0,2015-02-10 22:05:22,CollumMcJingleballs,Reddit
Click-through rate for all queries is 0%?,analytics,0,0.0,2015-02-11 02:29:34,Youtube_Money,Reddit
Weird custom filter by SEO firm - what does this mean/do?,analytics,5,10.0,2015-02-11 06:42:40,Codingo,Reddit
[Request] Tool for producing a single report combining data of multiple GA properties,analytics,0,3.0,2015-02-11 14:09:55,marc404,Reddit
Google Analytics &amp; IBM Coremetrics: UTMs and MMCs in same url?,analytics,3,4.0,2015-02-11 17:02:41,AustinLanceButler,Reddit
Emailing Google Analytics Reports,analytics,0,1.0,2015-02-11 17:41:19,citybricks,Reddit
How should I modify Semantria's sentiment analysis?,analytics,1,3.0,2015-02-11 18:05:50,tu13dekh,Reddit
Confused with internal website Google Analytics and organic search results,analytics,0,4.0,2015-02-11 22:33:30,JerryFodler,Reddit
Question about Google Analytics Event tracking,analytics,5,7.0,2015-02-12 02:23:30,TravellingTraveller,Reddit
Does adding more events to track in analytics reduce the bounce rate as far as Google is concerned?,analytics,1,5.0,2015-02-12 03:26:54,createtoday,Reddit
Google have fixed the original workaround for exporting 5000+ rows in a report. Is there any other way of doing this?,analytics,1,0.0,2015-02-12 13:53:03,paidmediaaccount,Reddit
New customers,analytics,4,2.0,2015-02-12 16:52:01,cpCentered,Reddit
Tracking discrepancy between client and us,analytics,1,6.0,2015-02-12 17:02:07,saqademus,Reddit
"Competitive Intelligence Analysis-Best Tools, Reports, Metrics |Avinash Kaushik",analytics,1,0.0,2015-02-12 23:40:11,bmeier,Reddit
Beginners guide to Google Tag Manager V2,analytics,1,0.0,2015-02-13 11:53:41,bsatani,Reddit
Getting into analytics?,analytics,1,0.0,2015-02-13 17:39:36,ohlawdwut,Reddit
Almost no traffic for exactly 24 hours?,analytics,4,5.0,2015-02-13 17:48:18,Zocheyado,Reddit
"How do I set up analytics for both my main website, and the shopify store?",analytics,1,6.0,2015-02-13 23:18:52,entdude,Reddit
Essential Google Analytics Resources for Marketers: A Complete Guide,analytics,1,0.0,2015-02-14 07:22:26,bsatani,Reddit
Infinite loading websites,analytics,2,6.0,2015-02-15 08:18:43,aboustayyef,Reddit
Set Analysis in Qlikview | Eduguru - Good Blogging,analytics,1,0.0,2015-02-15 19:24:49,replytosatya,Reddit
7 awesome steps of Data Exploration &amp; Data Preparation - Part 1,analytics,1,1.0,2015-02-16 08:46:20,ken_analyst,Reddit
Facebook adverts manager reporting website clicks that are 2xGA,analytics,2,3.0,2015-02-16 16:56:53,XblraCe,Reddit
Affordable Hybrid (JavaScript + Log files) Web Analytics - Now in Beta,analytics,1,0.0,2015-02-16 18:02:49,vlador,Reddit
Are there any good courses out there for becoming an expert at GA or similar? Or for web analytics in general?,analytics,1,7.0,2015-02-16 20:45:11,Honey_Badger_doesnt,Reddit
"Google Analytics: Related Products Feature, the product recommendation feature is now available for ecommerce",analytics,1,0.0,2015-02-16 23:31:37,Lukaslo,Reddit
"Blog about analytics, BI and reporting",analytics,1,1.0,2015-02-17 08:55:26,m-translate,Reddit
