title,subreddit,score,num_comments,created_date,author,platform
Google Chrome To Further Increase Not Provided,analytics,0,1.0,2012-12-20 23:51:35,roiwriter,Reddit
Bounce Rate: Die Absprungrate bei Einstieg - gradlinig.com,analytics,1,0.0,2012-12-21 10:12:47,gradlinigcom,Reddit
How to Find Google Analytics Tracking Code? ,analytics,1,0.0,2012-12-26 13:12:04,rosesmark,Reddit
App Annie: Dashboard for App and Ad Revenue,analytics,0,0.0,2014-01-01 20:34:32,[deleted],Reddit
Learn Advanced Web Analytics and Get Certification,analytics,0,0.0,2014-01-02 13:51:07,daiaindia,Reddit
Official Google Webmaster Central Blog: More detailed search queries in Webmaster Tools,analytics,3,1.0,2014-01-07 19:33:24,Fiddler_s_green,Reddit
App Giveaway: 3 Months of Clicky Pro Plus FREE,analytics,0,0.0,2014-01-08 15:52:22,treppin,Reddit
"Formisimo, A U.K. Startup Tackling Web Form Friction, Exits Beta &amp;amp; Launches Price Plans",analytics,1,0.0,2014-01-08 18:53:42,tomcnew,Reddit
Need help with my internship.,analytics,1,4.0,2014-01-09 02:28:06,mostdiabolical,Reddit
Need help connecting the dots,analytics,2,5.0,2014-01-10 00:26:55,northwoodrow,Reddit
What does your Analytics reports look like?,analytics,10,9.0,2014-01-10 22:36:15,havock,Reddit
How to display exit page per city in GA?,analytics,1,2.0,2014-01-12 23:44:33,hugepnus,Reddit
(not provided) - How do I solve it?,analytics,2,4.0,2014-01-13 12:16:00,nooki1,Reddit
Big Data Analytic Trends for 2014,analytics,1,0.0,2014-01-13 14:49:59,sunita00,Reddit
snorkel - open source event analytics with mongo,analytics,2,1.0,2014-01-13 23:12:25,okayzed,Reddit
Is it possible to do this?,analytics,1,3.0,2014-01-14 12:08:14,no-one_ever,Reddit
Predictive Analytics &amp; Hadoop Consulting Services - Aureus,analytics,0,0.0,2014-01-14 15:27:28,lalit00,Reddit
Quick Site Status Report,analytics,1,2.0,2014-01-15 17:42:40,havock,Reddit
Aureus - Detect Fraud &amp; Improve your Finance Status,analytics,1,0.0,2014-01-16 07:08:45,Swaraj3,Reddit
"Hey Reddit, help! We have some interesting ideas on how to improve subscriptions and freemium, esp. for games, and need your help",analytics,2,0.0,2014-01-17 00:55:39,wwvuillemot,Reddit
Need help with creating an independent study project!,analytics,3,0.0,2014-01-17 23:09:24,yxjxy,Reddit
Add Sensor Data Experience to Your Analytics Toolbox,analytics,4,0.0,2014-01-18 08:34:28,LillianPierson,Reddit
Real Time Dashboard widget for page load times and performance.,analytics,2,1.0,2014-01-21 04:56:39,hugepnus,Reddit
Metrigen just added new option to track your activity on Google+ social network!,analytics,2,0.0,2014-01-21 19:45:20,andiscesnieks,Reddit
"Tool to track user scroll position, hover, anything, in Google Analytics",analytics,1,0.0,2014-01-22 14:19:18,[deleted],Reddit
Easy ways to track metrics in mobile app user acquisition funnels,analytics,1,0.0,2014-01-22 22:21:30,pratik87,Reddit
"Who is using Google Tag Manager? Any Tips, Tricks, or Pitfalls? (X-Post from r/PPC)",analytics,3,1.0,2014-01-23 07:02:36,Emerald_Triangle,Reddit
Anyone in /r/analytics looking for a new role? I am hiring someone to one of my teams at Accenture. It is a level 9 or 10 (depending on experience) and will specialize in customer experience analytics.,analytics,1,3.0,2014-01-23 16:54:44,cronkytonk,Reddit
Google Analytics In Real Life - Landing Page Optimization,analytics,2,0.0,2014-01-23 18:53:55,chasincaroline,Reddit
Can anyone direct me to a good website for analytics/statistics internships?,analytics,2,2.0,2014-01-24 00:23:20,thirdfryeblind,Reddit
"Dear Reddit, how do you find out which web analytics software is a website using?",analytics,7,12.0,2014-01-26 14:03:34,chukchacha,Reddit
Tablet Reporting - Landscape vs. Portrait. Is it worthwhile to report on this?,analytics,3,2.0,2014-01-27 00:38:46,chinchillin88,Reddit
Economía útil y de la buena,analytics,1,0.0,2014-01-29 02:09:04,DomingoFHdezA,Reddit
Analyzed,analytics,1,0.0,2014-01-30 01:22:09,[deleted],Reddit
"""Analytics Event Tracking code DOESN'T WORK. Please help me. Using Universal Analytics (analytics.js) and checking to see if its working with Chrome Add-on """"Event Tracking Tracker""""""",analytics,1,4.0,2014-01-31 00:24:51,helpmeanalytics,Reddit
Handling my company's addiction to precision.,analytics,8,7.0,2014-01-31 19:23:39,Bravot,Reddit
Syllabusrate,analytics,3,0.0,2014-02-01 12:42:01,kr200,Reddit
Trend-Setting Products in Data for 2014,analytics,1,0.0,2014-02-05 16:42:17,ipachanga,Reddit
New Vs Returning Report,analytics,1,6.0,2014-02-06 12:30:04,XblraCe,Reddit
Discovering Your Audience in YouTube Analytics,analytics,1,0.0,2014-02-07 01:12:38,BoomKareena,Reddit
"For those of you using Google Tag Manager, can you help me out with my dataLayer? (X-Post from /r/PPC)",analytics,2,6.0,2014-02-07 06:09:50,Emerald_Triangle,Reddit
"Next generation analytics with yarn, spark and graph lab",analytics,1,0.0,2014-02-07 16:01:15,amishjain,Reddit
How to I customize exports?,analytics,1,3.0,2014-02-08 20:26:28,advrobot,Reddit
ROI Factory is the ultimate marketing analytics and custom dashboard platform for mid-sized companies.,analytics,0,0.0,2014-02-09 10:59:26,[deleted],Reddit
The upcoming trends for 2014: Big Data &amp; Analytics.,analytics,0,0.0,2014-02-10 10:31:10,rishinair,Reddit
BrightTag is the most popular Tag Management System across all US auto makers,analytics,0,1.0,2014-02-10 11:06:32,iastream,Reddit
Transformation in Insurance Industry using Advanced Analytics.,analytics,0,0.0,2014-02-10 11:47:38,rishinair,Reddit
Google Analytics Content Groups for Higher Ed Marketing,analytics,1,0.0,2014-02-10 23:19:47,blanchek,Reddit
Curse you excel,analytics,15,1.0,2014-02-11 00:19:37,TwoScoopsPlease,Reddit
13 Free Google Analytics Tools To Use Everyday,analytics,1,0.0,2014-02-11 14:00:37,graemebenge,Reddit
Mismatch between back end e-commerce transaction data and Universal Analytics Conversion Reports (Using Magento extension),analytics,0,6.0,2014-02-11 15:34:49,gutterandstars,Reddit
Can anyone point me in the direction of training material for CoreMetrics?,analytics,1,2.0,2014-02-11 17:52:36,mikegaz,Reddit
Keyword Not Provided in Google Analytics - Part 1: Queries Report,analytics,5,6.0,2014-02-12 00:43:06,Julesssss,Reddit
"Understanding Search Analytics: Making Better, Data-Driven Decisions",analytics,1,0.0,2014-02-12 07:20:14,BoomKareena,Reddit
Article+video: Join your CRM data with Google Analytics using BigQuery.,analytics,2,1.0,2014-02-12 19:33:33,fhoffa,Reddit
SIX things you can do to be a better web analyst.,analytics,0,3.0,2014-02-13 05:03:19,jrhose,Reddit
Revamping the Insurance Industry using Big Data Analytics.,analytics,1,0.0,2014-02-13 08:25:37,rishinair,Reddit
Riddle me this: Most transactions are before the property was created,analytics,1,4.0,2014-02-13 17:30:19,Expressman,Reddit
Google analytics - need data for a uni project,analytics,1,0.0,2014-02-13 20:39:35,notmudkipfucker,Reddit
Tag Inspector: Find tags firing on your site,analytics,3,1.0,2014-02-14 00:41:32,fnurtfnurt,Reddit
Only 40% of Global Web Traffic Comes From Humans - Pinoria,analytics,3,2.0,2014-02-14 02:12:11,jinjin3662521,Reddit
Love is a Number Data by Aureus Analytics,analytics,1,0.0,2014-02-14 12:01:33,rishinair,Reddit
Noob question: trackevent goal tracking counts,analytics,2,4.0,2014-02-14 23:37:18,random_nickname,Reddit
"Free marketing ROI calculator includes all costs for true marketing ROI, not just Return on Ad Spend. Download and modify in Excel as needed.",analytics,3,0.0,2014-02-15 21:08:48,afm528,Reddit
Revamping the Insurance Industry using Big Data Analytics.,analytics,1,0.0,2014-02-17 01:35:22,[deleted],Reddit
Google Analytics App - I have dashboard (free) - kinda sucks for any real metrics I want - Is the upgrade worth it?,analytics,2,3.0,2014-02-18 07:46:06,Emerald_Triangle,Reddit
Transformation of Technology using Big Data &amp; Analytics,analytics,1,0.0,2014-02-18 09:44:53,rishinair,Reddit
“Not provided” soon at 100%,analytics,2,0.0,2014-02-18 12:42:10,Julesssss,Reddit
Custom Alerts,analytics,1,0.0,2014-02-19 16:50:31,lauradolores,Reddit
Web analytics projects: get off to a good start by avoiding these 10 errors,analytics,1,0.0,2014-02-21 15:53:59,david33000,Reddit
Anyone using Heap Analytics to track interactions on their site?,analytics,0,1.0,2014-02-21 16:12:03,[deleted],Reddit
GA API returning different results,analytics,1,6.0,2014-02-21 17:01:49,havock,Reddit
" """"visits""""", C$2,189,,For example in excel to get organic visits: =getgadata(getgaauthenticationtoken(D$1, C$8,Reddit
Is it possible to track visitors after leaving your site without going through external links?,analytics,1,1.0,2014-02-22 00:28:36,[deleted],Reddit
Page Console,analytics,1,0.0,2014-02-25 18:11:46,Veradley,Reddit
Google Analytics,analytics,1,0.0,2014-02-26 15:45:54,deepasri,Reddit
What will happen to Adobe Analytics?,analytics,5,18.0,2014-02-27 00:21:17,jrhose,Reddit
Managing a rebrand,analytics,1,1.0,2014-02-27 12:22:46,XblraCe,Reddit
GA reporting different stats today than it was yesterday,analytics,1,4.0,2014-02-27 13:23:16,konamikode,Reddit
5 dirty little secrets about Google Analytics funnels,analytics,3,10.0,2014-02-27 16:34:24,cyssou,Reddit
"""We need more responses! Four Question Marketing Analytics Survey extends Adobe's report """"Digital Distress: What Keeps Marketers Up At Night"""". 60 seconds and you could win $50.""",analytics,3,0.0,2014-02-28 14:00:41,afm528,Reddit
How do you guys use API in your line of work?,analytics,5,10.0,2014-03-01 08:13:07,ferae_naturae,Reddit
GA: Two funnels with same goal?,analytics,0,1.0,2014-03-02 00:29:40,jwjody,Reddit
What's the best way to filter your own IP address from google analytics reports? My IP keeps changing,analytics,1,4.0,2014-03-02 17:09:13,ThePumptrackDudeGuy,Reddit
BigML + Tableau = Powerful Predictive Visualizations for Everyone,analytics,1,0.0,2014-03-03 19:50:09,osroca,Reddit
Want to become a analyst; which graduate program should I look at?,analytics,4,6.0,2014-03-04 03:01:43,Feurbach_sock,Reddit
Getting valuable Insights from the 16th Global Conference of Actuaries,analytics,1,0.0,2014-03-05 07:52:04,robo1990,Reddit
Customized Pens that suits your needs.,analytics,1,0.0,2014-03-05 11:32:25,[deleted],Reddit
Removing Session Duration Outliers from GA,analytics,1,0.0,2014-03-05 20:47:36,brentlarue,Reddit
Upload offline conversion into GA,analytics,3,5.0,2014-03-05 21:22:44,gregsfriend,Reddit
"Google's Q4 2013 In Review, Higher Education Search Analysis Report",analytics,1,0.0,2014-03-05 21:38:17,PhilippeTaza,Reddit
"Any time I submit a link from my site to StumbleUpon, six visitors in Beverly Hills immediately show in GA - what's that about?",analytics,2,7.0,2014-03-06 18:32:17,goleg,Reddit
Retail web analytics must broaden: News from warc.com,analytics,0,0.0,2014-03-08 17:34:12,bradyjiang,Reddit
"I'm starting an entry-level analytics job next week. I have little-to-no experience working with analytics. What are some good resources for me to learn more on my own? (blogs, YouTube channels, books, etc.)",analytics,1,0.0,2014-03-09 18:19:50,[deleted],Reddit
Google analytics broken?,analytics,1,5.0,2014-03-09 21:15:14,beyonsense,Reddit
Tracking Ajax Page-views in Universal Analytics using Tag Manager,analytics,3,2.0,2014-03-10 19:18:35,CZKelly,Reddit
1 Reason You Have No Excuse Not to Have Clicky Pro Plus (Hint: We’re Giving It Away for Free!),analytics,0,0.0,2014-03-11 20:25:12,treppin,Reddit
Would someone being linked to my website from an email show up on GA?,analytics,3,7.0,2014-03-11 21:48:50,mostdiabolical,Reddit
Track your mac os x applications easily and quickly with analytics tools | DeskAppTrack,analytics,0,0.0,2014-03-12 10:54:45,betacrul,Reddit
A soft tool to build funnels on the go,analytics,0,0.0,2014-03-12 14:22:17,[deleted],Reddit
Enhance your business by integrating enterprise application.,analytics,1,0.0,2014-03-12 14:57:09,robo1990,Reddit
Which KPIs to measure using mobile analytics?,analytics,3,0.0,2014-03-13 17:19:37,CuriousAboutTech,Reddit
Assets &amp; The Grid: A Continuum Story,analytics,1,0.0,2014-03-13 20:36:29,BlackVeatch,Reddit
3Scale API Analytics,analytics,0,0.0,2014-03-15 02:17:14,ellisdonald92,Reddit
Retailers look to analytics to crack down on fraud,analytics,5,0.0,2014-03-17 17:49:11,mtl1015,Reddit
Crazy Egg – The Best Website To Check What Visitors Do on Your Website,analytics,1,0.0,2014-03-18 19:04:27,xaban,Reddit
Hybrid Data Store,analytics,1,0.0,2014-03-19 09:53:14,tapaskannoujia,Reddit
Reinforce your business quality through testing methodologies.,analytics,1,0.0,2014-03-19 15:26:39,robo1990,Reddit
"Facebook URL tags -- can see it on the Content Overview Dashboard, but not sure where to find it elsewhere?",analytics,2,1.0,2014-03-20 16:49:52,glacierfanclub,Reddit
"Stability Solutions, Microbiology Testing Services",analytics,0,0.0,2014-03-21 08:31:57,Thermolab14,Reddit
Optimize your business cost and revenue through banking &amp; financial services.,analytics,1,0.0,2014-03-21 09:21:55,robo1990,Reddit
Measuring Offline Transactions in Google Analytics,analytics,1,0.0,2014-03-21 21:16:52,jordanscott7,Reddit
How to Enable Google Analytics Demographics and Interest Reports,analytics,1,0.0,2014-03-23 03:19:46,softronixredplanet,Reddit
"Phone Call Tracking on a Budget with Twilio and Google Universal Analytics. First post on new blog, feedback appreciated!",analytics,6,0.0,2014-03-23 06:58:12,dbgonz,Reddit
Does anyone here uses Semantria?,analytics,1,2.0,2014-03-24 13:05:34,TheDhakkan,Reddit
Decision Between two MS Analytics Programs,analytics,4,11.0,2014-03-24 14:40:15,skeeza17,Reddit
Build effective strategies through business analytics solutions.,analytics,1,0.0,2014-03-24 16:02:51,robo1990,Reddit
Anyone have experience with or thoughts about ExpressVisits?,analytics,1,0.0,2014-03-24 21:13:11,davepe,Reddit
Is it possible to track a dialed number in Google Analytics? Details inside,analytics,1,4.0,2014-03-24 22:04:41,jm3281,Reddit
Agencies should give clients Google Analytics reports,analytics,3,0.0,2014-03-25 03:01:16,megalytic,Reddit
Top 10 Free Real-Time Web Analytics Services,analytics,4,1.0,2014-03-25 11:06:22,danieltandaman,Reddit
Tailor Made Enterprise Level Solutions,analytics,1,0.0,2014-03-25 16:30:35,Janedavy123,Reddit
How do you make a google spreadsheet that can pull data into it from both Google Analytics and Adwords?,analytics,5,1.0,2014-03-26 17:17:52,kenyob,Reddit
How to build a great analytics solution - explained.,analytics,2,1.0,2014-03-27 04:29:29,[deleted],Reddit
Social Media Analytics - It's A Never Ending Marathon [Infographic],analytics,1,0.0,2014-03-27 10:52:19,stuartjdavidson,Reddit
Infographic on elections Data &amp; Statistics of India 2014.,analytics,1,0.0,2014-03-27 13:24:53,robo1990,Reddit
Introducing QQL: The First Social Media Analytics Query Language,analytics,2,2.0,2014-03-27 18:57:15,nierhoff,Reddit
Marketing Technologist Implementation Projects and Administration,analytics,0,0.0,2014-03-27 19:37:29,afm528,Reddit
Some Conversions not showing up - in AdWords or GA - any ideas? (X-Post-ish from /r/PPC),analytics,1,6.0,2014-03-28 05:18:22,Emerald_Triangle,Reddit
In-Page Web Analytics,analytics,1,1.0,2014-03-30 15:26:24,Angel359,Reddit
A list of Omniture and Google Analytics Debuggers,analytics,8,2.0,2014-03-30 17:56:28,bmann008,Reddit
5 Key SaaS Metrics You Need To Know &amp; How To Calculate Them,analytics,4,0.0,2014-04-01 02:23:22,parzo,Reddit
trying to eatimate page views on a competitors sitr,analytics,1,0.0,2014-04-02 05:17:18,[deleted],Reddit
Heap Analytics vs Mixpanel - Which is better?,analytics,7,1.0,2014-04-03 22:39:38,radamantium,Reddit
Transformation of Big Data in health care industry.,analytics,1,0.0,2014-04-04 15:40:16,arekarrishi90,Reddit
[META] Discussion about breaking of web analytics and data analytics into different subs,analytics,1,0.0,2014-04-04 20:12:37,[deleted],Reddit
"Google.com Referral Traffic, cannibalizing Google Organic Search Traffic",analytics,5,2.0,2014-04-04 23:21:58,undeadsushi,Reddit
A Conversion Hacker’s List of Conversion Optimization Tools,analytics,5,2.0,2014-04-06 15:58:05,yourconversionsucks,Reddit
Assess your data through Claim Analytics.,analytics,1,0.0,2014-04-07 16:23:09,arekarrishi90,Reddit
Don’t stop your A/B tests part-way through,analytics,5,1.0,2014-04-07 21:20:22,raviparikh2,Reddit
Analytics Deep Dive Part One: 4 Metrics Your Company is Probably Reading Wrong,analytics,5,1.0,2014-04-08 21:47:43,adityakhannamech,Reddit
Google Publishes New Technology with the Invention of the Universal Google Analytics | SEM,analytics,1,0.0,2014-04-08 22:41:37,maheshgiri,Reddit
Twitter authentication hurts making sense of referrals,analytics,1,0.0,2014-04-09 21:00:54,colinmathews,Reddit
Roll up account but only for some properties ?,analytics,1,3.0,2014-04-10 03:41:01,hippister,Reddit
How To Create Your Own Formula For Social Media Success With QQL,analytics,2,0.0,2014-04-15 17:42:58,nierhoff,Reddit
Qmonix HTTP communication protocol documentation is now available.,analytics,1,0.0,2014-04-16 11:34:09,qmonix,Reddit
LaMetric shows Google Analytics and App figures metrics for the whole team in the office,analytics,0,0.0,2014-04-16 12:57:58,AnastasiaLav,Reddit
Analyzing how consumers are using an app - do you agree that it's one of the biggest challenges facing mobile marketers?,analytics,1,1.0,2014-04-16 15:24:02,CuriousAboutTech,Reddit
3 tips to ensure your digital strategy doesn’t stall – part 1,analytics,2,0.0,2014-04-17 19:55:34,jhornby64,Reddit
Is it possible to separate visits by Google domain?,analytics,1,2.0,2014-04-17 20:23:11,imyxle,Reddit
New Relic v. Google Analytics (for marketing),analytics,1,0.0,2014-04-18 15:26:30,atwater1988,Reddit
A Case Study About Lead Generation From Our Partner Crafted,analytics,2,7.0,2014-04-22 14:53:23,taniamorgen,Reddit
Question on YouTube analytics,analytics,1,0.0,2014-04-23 13:46:07,sanjana_s,Reddit
How/Why Agencies use Megalytic for their Google Analytics Client Reports,analytics,0,0.0,2014-04-23 21:42:00,megalytic,Reddit
The best iphone app for Google Analytics,analytics,1,0.0,2014-04-24 04:44:34,e-cord,Reddit
So one of my GA accounts appears to be missing...,analytics,2,6.0,2014-04-24 17:14:58,gutterandstars,Reddit
Box Tech Blog » Solving D3 Graph Interaction In StatusWolf [x-post from d3js],analytics,2,0.0,2014-04-25 04:33:46,discogestalt,Reddit
Tools for analyzing Tweets content????,analytics,1,4.0,2014-04-27 17:27:51,hsilvar,Reddit
What are the biggest problems you face in your job as an analyst?,analytics,6,10.0,2014-04-27 18:18:27,meenamaesa,Reddit
How can I get an internship in Analytics with little/no experience?,analytics,1,9.0,2014-04-28 12:59:13,seby408,Reddit
17 Google Analytics Worth Measuring for Local SEO,analytics,0,0.0,2014-04-28 15:53:45,csheehy,Reddit
Get your hands on Universal Analytics from Google Analytics,analytics,1,0.0,2014-04-29 16:58:43,farhanfawzer,Reddit
Dimension Widening USE-CASE: Integrate Your SEO Data into Universal Analytics,analytics,1,0.0,2014-04-30 13:30:53,bsatani,Reddit
Does anyone else have a goal to reach every country in the world?,analytics,5,4.0,2014-05-01 02:44:08,geotagger,Reddit
Google analytics Goal Funnel is weird....,analytics,2,9.0,2014-05-01 19:12:18,thevinesevolve,Reddit
Why do odd cities show up in Google Analytics data for hyperlocal websites?,analytics,3,2.0,2014-05-02 06:53:49,wredlich,Reddit
Calq.io - Analytics for custom data. Looking for feedback. Test for free.,analytics,3,5.0,2014-05-02 15:41:38,RRAway,Reddit
Any tips for the graduate analysts?,analytics,2,4.0,2014-05-03 11:51:21,woyalwumble,Reddit
Advice on tracking pageviews by Author on Wordpress in Google Analytics,analytics,2,3.0,2014-05-04 21:34:22,glenbelt,Reddit
Is there any way of finding out the popularity distribution of audio formats among torrenters/illegal downloaders?,analytics,2,1.0,2014-05-05 00:15:13,Mushraman,Reddit
Any analysts here going to the E-Metrics Summit in Toronto?,analytics,1,1.0,2014-05-06 19:56:33,eddyofyork,Reddit
Activating Google Universal Analytics with Adobe's DTM,analytics,3,1.0,2014-05-07 00:45:25,RRS_ATL,Reddit
Audit an entire website's Google Analytics implementation (Feedback welcomed),analytics,1,2.0,2014-05-07 17:59:27,simohayha,Reddit
Setting up advanced analytics: Where do you start?,analytics,2,0.0,2014-05-07 18:57:35,mtl1015,Reddit
Video: Lean Analytics: One Metric That Matters (OMTM),analytics,0,0.0,2014-05-09 12:44:01,Habitualcaveman,Reddit
How A/B Testing Works and How to Use It With Google Analytics,analytics,1,0.0,2014-05-12 12:08:04,designbox,Reddit
"Social Media Marketing,Target Market Analysis &amp; Research | Blueocean Marketing Intelligence",analytics,0,1.0,2014-05-12 13:25:22,sahanbn,Reddit
When You're Too Lazy to Read The Official Help: Google Analytics FAQ,analytics,2,0.0,2014-05-12 16:47:47,honzafelt,Reddit
"Google Analytics now mixes Web and App Data, help",analytics,2,2.0,2014-05-12 20:43:55,12Troops,Reddit
AMA about analytics over at Yabbly,analytics,0,2.0,2014-05-13 02:17:42,[deleted],Reddit
Let your Analysis Flow with Google Analytics’ Events Flow,analytics,1,0.0,2014-05-15 10:36:50,[deleted],Reddit
Putting a classic &amp; universal GA on the same page,analytics,0,8.0,2014-05-16 00:05:37,partiallypro,Reddit
Tracking YouTube Videos using Google Analytics,analytics,6,0.0,2014-05-16 22:09:54,megalytic,Reddit
Good sample size over five years in GA for analysis?,analytics,1,3.0,2014-05-18 22:14:00,[deleted],Reddit
Help with Google Analytics,analytics,1,15.0,2014-05-19 10:06:27,kkin1995,Reddit
How to make a Web Analytics presentation to the CEO,analytics,8,2.0,2014-05-19 18:55:27,megalytic,Reddit
Universal Google Analytics for Wordpress,analytics,4,2.0,2014-05-20 18:27:32,svolinsky,Reddit
Why you should buy from a startup,analytics,2,1.0,2014-05-20 20:27:56,avazlqd,Reddit
Can I use more than one utm_content entry?,analytics,2,1.0,2014-05-20 21:55:14,BevansDesign,Reddit
How To Track Facebook Advertising Campaigns in Google Analytics,analytics,4,0.0,2014-05-21 02:59:34,megalytic,Reddit
Using Heatmaps in Retail,analytics,2,1.0,2014-05-21 17:43:35,dodge901,Reddit
Business Experiments Explained: Factors and Levels,analytics,1,0.0,2014-05-21 18:08:38,TheCorrFocus,Reddit
"It's the metadata, stupid: The New York Times misses the point of article tagging",analytics,1,1.0,2014-05-21 22:32:02,JetsmanJ,Reddit
How to choose a digital analytics vendor,analytics,1,1.0,2014-05-22 19:30:50,[deleted],Reddit
Here's a plugin to simplify form tracking w/ Mixpanel (x-post from r/javascript),analytics,1,0.0,2014-05-23 01:58:50,squishy_boots,Reddit
Aluminium semi-fabricated markets in Asia; The presentation is intended to provide the reader a flavor of the aluminium semi fabricated markets in Asia and has been collated from various published sources and the library of Madras Consultancy Group.,analytics,1,0.0,2014-05-23 14:13:05,daisypete,Reddit
Improve your Web Analytics Reports with Compelling Comments,analytics,1,0.0,2014-05-23 15:30:23,[deleted],Reddit
How I Improved my Web Analytics Reports with Compelling Comments,analytics,2,0.0,2014-05-23 15:31:48,megalytic,Reddit
Spinnakr - Making Real-Time Web Analytics Actionable,analytics,0,1.0,2014-05-26 19:03:42,[deleted],Reddit
Everyday exercises to improve skills | Where do I start?,analytics,1,2.0,2014-05-27 23:11:44,seby408,Reddit
Suggestions on interesting topics for an analytics meetup group?,analytics,2,2.0,2014-05-28 00:47:04,gutterandstars,Reddit
"3 analytics tools to manage your Twitter, Facebook, G+ and other Socials",analytics,1,0.0,2014-05-28 11:59:08,techvoize,Reddit
Measure Content Engagement with Google Analytics and this Free WordPress Plugin,analytics,1,0.0,2014-05-29 00:15:20,megalytic,Reddit
An Inbound Approach To Turning More Leads Into Customers.,analytics,1,1.0,2014-05-29 14:23:59,canddialice,Reddit
"Q: When Alexa says that X% of traffic to site came via Search Engines, does it mean only organic?",analytics,4,2.0,2014-06-02 17:49:24,gutterandstars,Reddit
hotel pricing forecast,analytics,0,1.0,2014-06-03 20:21:18,Jack_Wellington,Reddit
Anyone else getting this error while setting up an advanced segment in GA?,analytics,3,4.0,2014-06-04 18:30:45,gutterandstars,Reddit
How To Solve The Biggest Problems With Analytics,analytics,1,0.0,2014-06-05 15:28:28,jmolz,Reddit
hotel pricing forecasting tool for revenue managers,analytics,0,0.0,2014-06-06 04:43:22,Jack_Wellington,Reddit
Google Tag Manager question,analytics,3,2.0,2014-06-06 18:45:10,deesquared,Reddit
How I used Google Analytics and Cohort Analysis to measure the effectiveness of our Blog Marketing,analytics,1,0.0,2014-06-06 20:11:23,megalytic,Reddit
Where to develop SAS skills?,analytics,3,4.0,2014-06-06 20:44:41,[deleted],Reddit
What Tutorial or Courses for SEM and Analytics would you recommend/used to learn?,analytics,3,1.0,2014-06-07 00:30:47,nipoco,Reddit
11 Free Ways to Track your Competitors | Practical Ecommerce,analytics,3,0.0,2014-06-07 09:23:02,gutterandstars,Reddit
"Does anyone here use Piwik instead of/ along with GA? Pros/Cons and feedback, please?",analytics,7,4.0,2014-06-09 10:08:28,gutterandstars,Reddit
Custom Alert Help - Monitoring product SKU increases/spikes,analytics,1,0.0,2014-06-09 19:54:35,Emerald_Triangle,Reddit
Web Analytics - How to Create a Meaningful Measurement Model ?,analytics,3,0.0,2014-06-16 21:40:22,adityakhannamech,Reddit
AT&amp;T and Udacity partner to launch Nanodegrees | including in Data Analytics,analytics,2,0.0,2014-06-17 12:07:47,[deleted],Reddit
Can I Load Google Tag Manager Twice on a Page?,analytics,3,0.0,2014-06-18 04:58:06,volomike,Reddit
Top 5 Filters for Accurate Analytics (GA),analytics,1,0.0,2014-06-18 07:31:41,madhumitac,Reddit
How to calculate offline billboard impressions?,analytics,1,0.0,2014-06-18 09:48:14,surajgadage,Reddit
5 Things Every Social Media Analytics Report Must Have,analytics,1,0.0,2014-06-18 13:37:31,sendsocialmedia,Reddit
