title,subreddit,score,num_comments,created_date,author,platform
need serious help - Various views/properties,analytics,1,0.0,2014-06-20 13:07:16,SEM_123,Reddit
Ecommerce Tracking in Universal Analytics,analytics,2,0.0,2014-06-20 14:45:10,megalytic,Reddit
Why am I getting visitors from India??,analytics,1,2.0,2014-06-20 15:24:19,BarryB64,Reddit
How Marketers Can Get A Better Handle on Data,analytics,3,0.0,2014-06-20 18:24:36,pdebois,Reddit
Event Tracking: Action is Reddit. Label is shared page. Possible to find the subreddit posted too?,analytics,1,1.0,2014-06-20 21:21:46,kittenbrutality,Reddit
Know your websites worth!,analytics,3,0.0,2014-06-20 23:05:02,WebStatsO,Reddit
Ever have a huge change on a variation that was winning?,analytics,1,0.0,2014-06-21 04:05:39,chronomagus,Reddit
Datameer fighting crime with social data analytics,analytics,2,0.0,2014-06-22 01:32:05,thefranster,Reddit
Xtra.ga - Google Analytics by Email,analytics,2,0.0,2014-06-23 10:38:25,kislitsyn,Reddit
Looking for entry level solution engineers,analytics,1,1.0,2014-06-23 23:09:01,[deleted],Reddit
How to translate business goals to analytics goals,analytics,1,1.0,2014-06-27 16:31:15,megalytic,Reddit
Don’t Trust Your Google Analytics Data Just yet: Get Rid of Noise With These Fundamental 9 Filters,analytics,2,3.0,2014-07-01 13:46:42,ynavot,Reddit
Making Google Analytics predictive with forecasting. Free tool,analytics,5,6.0,2014-07-02 00:32:14,ryno,Reddit
Improve your Digital Marketing with Insight from Geographic Stats in Google Analytics,analytics,1,0.0,2014-07-03 15:49:34,megalytic,Reddit
Have any of you analysts used SiSense?,analytics,2,0.0,2014-07-03 18:50:28,johnnyauburn,Reddit
"A More Modern Approach to Analytics, Part 1",analytics,1,0.0,2014-07-04 18:43:21,seanmeverett,Reddit
"Analytics, Experimentation, and Results of Building a Blog: Month Three",analytics,1,0.0,2014-07-06 06:58:42,[deleted],Reddit
Full Screen Google Analytics via Bookmarklet,analytics,0,0.0,2014-07-07 05:34:37,_manchester_,Reddit
Visual Mobile Analytics – The Key to App Optimization,analytics,1,0.0,2014-07-07 10:15:50,JannyGarrets,Reddit
UC Berkeley Breeds Data Scientists Exclusively Online: $60K for 18 Months,analytics,1,0.0,2014-07-08 02:20:40,[deleted],Reddit
The History of BI: The 1980's and 90's,analytics,1,0.0,2014-07-08 02:33:48,[deleted],Reddit
The Ultimate Guide for Upgrading to Universal Analytics,analytics,1,0.0,2014-07-09 14:08:53,bsatani,Reddit
Podcasts?,analytics,2,0.0,2014-07-10 06:27:06,DataWave47,Reddit
Predicting Startup Success,analytics,1,0.0,2014-07-10 20:38:22,czuriaga,Reddit
Something is broken! GA Campaign Tracking isn't working.,analytics,1,0.0,2014-07-11 02:06:46,karghkbdzx,Reddit
Groupon Finds ‘Direct’ Traffic Is Really Organic Search - Husky SEO,analytics,1,0.0,2014-07-11 16:08:18,Huskyseo,Reddit
Luna Metrics: 7-Minute UX Audit for Landing Pages,analytics,0,0.0,2014-07-12 12:33:40,gutterandstars,Reddit
Help adding an IP filter,analytics,2,3.0,2014-07-14 21:32:35,black_eyed_susan,Reddit
Universal Analytics vs Classic GA - basic metrics don't match,analytics,1,0.0,2014-07-15 19:56:31,[deleted],Reddit
Viewing average page load time all pages of same type,analytics,1,3.0,2014-07-16 17:24:26,jwjody,Reddit
Help Searching for Analytics Positions,analytics,5,7.0,2014-07-16 18:23:23,Wiskeybadger,Reddit
Why do I have some days where my average page load time is zero yet there's 10s of thousands of page views?,analytics,5,7.0,2014-07-16 22:05:45,jwjody,Reddit
"*sigh* Google Analytics, why do you make me feel so stupid? (A question about ecommerce tracking)",analytics,1,5.0,2014-07-17 18:45:35,[deleted],Reddit
Google Analytics App User Accuracy vs iTunes Connect &amp; Google Dev Console,analytics,2,0.0,2014-07-17 22:50:24,zanzibarmangosteen,Reddit
I Am Super Stumped: Why Are My New Users 102% of Total Users? (more details in comments),analytics,1,5.0,2014-07-18 01:43:38,coldenbu,Reddit
Analytics Referral Traffic For Internal Quotes,analytics,1,1.0,2014-07-18 16:56:54,Swiss91,Reddit
Google Launches Analytics Download For iOS,analytics,0,1.0,2014-07-19 23:07:52,timezonlinemarketing,Reddit
What are some of the most interesting metrics you've come across or discovered?,analytics,7,0.0,2014-07-20 14:48:43,Poop_shark,Reddit
The History of BI: The 2000's and Now,analytics,2,0.0,2014-07-20 16:38:39,[deleted],Reddit
How can Google Analytics help my business?,analytics,3,6.0,2014-07-21 00:16:13,AllforAll100,Reddit
"Three Forecasts You Should Know: Big Data, Business Intelligence &amp; Analytics",analytics,3,0.0,2014-07-21 17:07:24,[deleted],Reddit
Operations and Analytics Go Hand in Hand – Here’s 3 Reasons Why,analytics,1,0.0,2014-07-21 21:27:29,aaronkumar,Reddit
Separating Paypal purchases from on-site payment in GA Goals,analytics,1,0.0,2014-07-22 23:18:30,jeremyers,Reddit
Track social efforts via Google Analytics,analytics,0,1.0,2014-07-23 13:47:03,InboundInfantry,Reddit
Tips for Cross-Domain Tracking in Google Analytics,analytics,0,0.0,2014-07-23 14:45:32,megalytic,Reddit
Using Website Analytics to Understand Your Prospects,analytics,0,0.0,2014-07-24 15:27:32,megalytic,Reddit
Sharing Google Analytics Reports with Your Organization,analytics,0,0.0,2014-07-24 21:30:17,megalytic,Reddit
Analytics in Different Areas,analytics,1,1.0,2014-07-25 07:51:11,srinimf,Reddit
redictive analytics real estate marketing startup raises $12M [x/RETech],analytics,1,0.0,2014-07-26 07:06:28,CitizenJosh,Reddit
Need Help! Issue with Google Tag Manager,analytics,1,0.0,2014-07-28 09:14:36,surajgadage,Reddit
"If you are not buying traffic you have a hobby not a business, 10 secrets to become a media buying expert",analytics,1,0.0,2014-07-29 18:36:52,jadaswardd,Reddit
Configure Google Analytics Cross Domain Tracking for the Booking Engine,analytics,1,0.0,2014-07-30 14:03:28,anrois,Reddit
How to Approach a Redesign with Digital Analytics in Mind,analytics,5,0.0,2014-07-30 16:09:08,PlaidPiperPup,Reddit
Daily cohort analysis in Google Analytics,analytics,1,2.0,2014-07-30 21:27:55,nukeio,Reddit
Dangers of Shortened URLs for Analytics,analytics,4,0.0,2014-07-30 23:13:33,megalytic,Reddit
Consistent Google Analytics Tagging for Better Campaign Tracking,analytics,1,0.0,2014-08-01 14:27:34,megalytic,Reddit
Facebook Analytics. What’s all the Fuss about?,analytics,1,0.0,2014-08-01 14:53:24,[deleted],Reddit
Here's a great scenery pic I saw today - majestic mountains. (thought I'd share for any without a view),analytics,1,0.0,2014-08-02 10:25:57,Emerald_Triangle,Reddit
The Skills Recruiters Look for When Hiring Analytics Talent,analytics,0,0.0,2014-08-04 08:23:13,poojaprakash,Reddit
Any Google Analytics or Adword Specialists?,analytics,3,8.0,2014-08-04 09:41:51,jkbizman,Reddit
Xiaomi is world's fifth largest smartphone maker: Strategy Analytics,analytics,1,0.0,2014-08-04 12:00:32,BEyond_INSOFE,Reddit
How Data Analytics Can Help In Better Pricing Decisions?,analytics,2,1.0,2014-08-05 03:49:25,jagran1,Reddit
Unlimited insights from web and mobile sites,analytics,1,0.0,2014-08-05 23:55:44,[deleted],Reddit
Tealeaf Users,analytics,3,14.0,2014-08-06 04:17:09,DarthQuerious,Reddit
Make the Most of Your Website with Google Analytics,analytics,0,0.0,2014-08-06 15:49:12,[deleted],Reddit
Is there a service to simplify the important/easily-forgotten SEO/conversion info from GA?,analytics,1,1.0,2014-08-06 22:58:50,pieandablowie,Reddit
How To Use Google Analytics To Filter Out The Bots And Spiders,analytics,1,0.0,2014-08-07 14:27:42,ubaid77,Reddit
Adobe ad hoc (discover) - time segmenta,analytics,2,0.0,2014-08-07 18:43:45,laperlanecktie,Reddit
Active Users App: Google Analytics Real-time in your Mac menu bar (Free),analytics,3,0.0,2014-08-07 22:41:29,SimpleMetrics,Reddit
How to reduce the bounce rate by using Google analytics for SEO,analytics,1,0.0,2014-08-09 17:59:52,ubaid77,Reddit
Multiple A/B/n Tests in Marketing with ANOVA and R,analytics,1,0.0,2014-08-10 23:44:53,whiteraven2,Reddit
Free Webinar: Universal Analytics,analytics,1,0.0,2014-08-11 05:55:06,bsatani,Reddit
Software/Service to generate behavior flow reports from GA,analytics,1,2.0,2014-08-11 16:59:47,PotterOneHalf,Reddit
Measure engagement / account health metrics for your SaaS app,analytics,1,0.0,2014-08-12 08:29:19,[deleted],Reddit
Segmenting Brand and Generic Paid Search Traffic in Google Analytics,analytics,1,0.0,2014-08-12 08:43:08,jessxkcd,Reddit
Smart Dashboard Modules: Insightful Dimensions And Best Metrics,analytics,2,1.0,2014-08-12 10:24:40,jessxkcd,Reddit
Show Reddit: Measure engagement / account health metrics for your SaaS app,analytics,2,0.0,2014-08-12 10:44:18,prateekbhatt,Reddit
Question: What are the best resources to learn about mobile app UX ? (and how it impacts metrics... x-post from /r/Userexperience),analytics,2,0.0,2014-08-12 16:37:01,gutterandstars,Reddit
I'm not sure which web tools I should be using to measure stuff I'm interested in tracking. Can you please give me some insight?,analytics,1,0.0,2014-08-12 18:43:27,[deleted],Reddit
Try a business analytics course,analytics,1,0.0,2014-08-13 13:33:42,learningimarticus,Reddit
Google Webmaster tools,analytics,1,5.0,2014-08-13 22:12:04,waverlyposter,Reddit
Filtered Views Just Not Adding Up,analytics,1,3.0,2014-08-14 11:27:59,Swiss91,Reddit
Resolving Differences in Data between Google AdWords and Analytics,analytics,2,0.0,2014-08-15 19:02:10,megalytic,Reddit
Information Is Power: Investing in Your Analytics,analytics,0,0.0,2014-08-16 04:36:07,DistilNetworks,Reddit
What is Business Analytics?,analytics,1,0.0,2014-08-16 10:32:17,learningimarticus,Reddit
Custom GA Dashboard w/ Assisted Conversions?,analytics,1,1.0,2014-08-19 19:08:46,db1189,Reddit
Interested in analytics as possible profession - all education in accounting.,analytics,1,3.0,2014-08-19 22:39:17,jerseyse410,Reddit
Mobile web traffic has nearly tripled on one app developer’s website,analytics,1,0.0,2014-08-20 02:04:05,[deleted],Reddit
Awesome Analytics Chrome Extension by Google,analytics,1,0.0,2014-08-21 02:05:46,dar1an,Reddit
Is anyone else having problems with Real-Time Overview crashing?,analytics,2,2.0,2014-08-21 11:11:24,fuutott,Reddit
Happy to help you with Enhanced Ecommerce,analytics,3,6.0,2014-08-23 06:52:14,bsatani,Reddit
Google Voice Analytics: Is it possible?,analytics,2,10.0,2014-08-25 04:40:10,Dj_Nussdog,Reddit
[Dev] Tool to check how well your Google Analytics account is set up,analytics,1,1.0,2014-08-26 04:22:39,[deleted],Reddit
50+ Incredible Resources to learn Google Analytics,analytics,3,0.0,2014-08-26 12:01:50,webgoms,Reddit
What is Data Analytics,analytics,1,1.0,2014-08-26 12:55:35,alicebradly,Reddit
FB is on the Radar – Organizations Begin to Analyze Social Data in Earnest,analytics,1,0.0,2014-08-26 20:02:19,manikashah,Reddit
Business Analytics at Imarticus,analytics,1,0.0,2014-08-27 13:26:12,learningimarticus,Reddit
Using Google Tag Manager for Mobile,analytics,1,0.0,2014-08-27 23:23:29,dmbdba,Reddit
Twitter Opens Its Analytics Dashboard To Everyone!,analytics,14,1.0,2014-08-28 01:26:40,kkoolook,Reddit
Reduce or avoid the flicker of AB tests - jQuery .available() plugin,analytics,2,4.0,2014-08-28 02:43:33,johnanish,Reddit
The best way to pursue a business analytics,analytics,1,0.0,2014-08-28 13:12:01,learningimarticus,Reddit
What does '&lt;1' mean in Page Depth report / GA...?,analytics,2,5.0,2014-08-28 15:42:40,gutterandstars,Reddit
Twitter 2.0: Bigger and Better,analytics,1,0.0,2014-09-01 03:12:57,FR314,Reddit
Ptengine is disrupting website analytics,analytics,1,0.0,2014-09-02 18:19:23,rancea,Reddit
Want Your Company to Succeed? Use Your Head When It Comes to Marketing Analytics,analytics,1,0.0,2014-09-03 05:19:03,LillianPierson,Reddit
How A Data Scientist Thinks.,analytics,1,0.0,2014-09-03 09:42:30,kuna99,Reddit
What are visitors/sessions called after bounce rate? (or any other level),analytics,2,2.0,2014-09-05 05:57:04,MrMag00,Reddit
Optimize your business cost and revenue through banking &amp; financial services.,analytics,1,0.0,2014-09-08 08:44:49,lisataylor00,Reddit
Address specific business and operations challenges through ASAP,analytics,1,0.0,2014-09-08 08:57:01,ransinha,Reddit
Even my Grandma Can Do This Course- Jigsaw Academy Launches ‘Analytics for Business’ Course,analytics,1,0.0,2014-09-09 12:31:06,poojaprakash,Reddit
What is Data Analytics,analytics,1,0.0,2014-09-09 15:09:19,alicebradly,Reddit
The Hidden SaaS Metric: Cost of Cancellation,analytics,1,0.0,2014-09-09 15:42:50,scottmcquin,Reddit
Real estate agents and brokers will have better selection of apps as data standards catch on [x/RealEstateTechnology],analytics,1,0.0,2014-09-10 15:43:56,CitizenJosh,Reddit
4 SaaS Metrics That You Might Not Know,analytics,1,0.0,2014-09-10 21:29:50,scottmcquin,Reddit
Reduce your loss ratio through Claim Analytics.,analytics,0,0.0,2014-09-11 13:11:17,mariaswan007,Reddit
Will the Cost of Customer Acquisition Kill Your Company?,analytics,1,0.0,2014-09-11 19:33:41,scottmcquin,Reddit
Value of Advanced Analytics in Insurance.,analytics,1,0.0,2014-09-12 17:19:04,dineshkarthik1420,Reddit
How to Buy Services for Bot Detection and Mitigation - | Distil Networks,analytics,1,0.0,2014-09-12 21:11:36,DistilNetworks,Reddit
Business leaders prefer gut feeling to data,analytics,1,0.0,2014-09-13 09:39:36,lindiabradley,Reddit
Could someone please explain what is tag management and Qubit Opentag?,analytics,2,11.0,2014-09-15 10:13:23,behrangsa,Reddit
Referral Traffic doesn't make sense,analytics,3,6.0,2014-09-15 12:39:24,Swiss91,Reddit
Essential Vitamins &amp; Minerals Your Body Requires.,analytics,1,0.0,2014-09-16 13:27:43,robo1990,Reddit
How to Use Google Analytics Website Search Reports,analytics,1,0.0,2014-09-16 23:52:20,funpakmaza,Reddit
How to get Google Analytics statistics directly on your own website?,analytics,1,0.0,2014-09-18 01:02:11,lionsground,Reddit
The Most Overlooked Thing Site Owners Forget About Conversion,analytics,0,2.0,2014-09-18 08:19:24,flowspark,Reddit
Tips to Build a Successful Data Analytics Career In United Kingdom,analytics,1,0.0,2014-09-19 20:36:45,poojaprakash,Reddit
Implementing Google Analytics Event Tracking,analytics,5,7.0,2014-09-22 11:51:03,LuizCentenaro,Reddit
The Administrator of the analytics page has disappeared off the face of the earth. Can I add a page with the web property id?,analytics,1,1.0,2014-09-22 15:17:14,dylansavage,Reddit
Clarification regarding Google Analytics &amp; Multiple Properties,analytics,2,2.0,2014-09-23 11:19:00,nellyshark,Reddit
5 Ways to Boost Customer Retention for Insurers through Social Analytics,analytics,1,0.0,2014-09-23 11:58:59,riyasen007,Reddit
Piwik vs Google Analytics. A detailed review.,analytics,4,0.0,2014-09-24 02:21:44,brilliantzen,Reddit
Help with google analytics. Age demographics appearing as keywords.,analytics,1,3.0,2014-09-25 05:37:09,SilkAzula,Reddit
Calculating Lead Generation Value,analytics,1,0.0,2014-09-29 04:31:25,cometton,Reddit
Help with analyzing 25 million data points.,analytics,4,11.0,2014-09-29 16:42:45,[deleted],Reddit
3 Google Analytics Hacks for Marketers,analytics,2,1.0,2014-09-30 13:56:03,kieranwils,Reddit
Getting a lot of spam referral traffic to my Home Page (what to do?) - Google Analytics,analytics,1,2.0,2014-10-01 13:29:31,SEOoBserve,Reddit
eCommerce Analytics: Why you need it?,analytics,6,0.0,2014-10-02 19:34:22,MineWhat,Reddit
How does Google (Universal) Analytics set a first-party cookie? Thought only,analytics,1,8.0,2014-10-02 21:00:58,WAMP_WAMP,Reddit
"Newb question - by supporting Display Advertising, what exactly am I doing to my site or my users?",analytics,1,0.0,2014-10-03 15:27:03,super_serious_guy,Reddit
New Job with a large focus on analytics - Have questions about events and goals.,analytics,1,0.0,2014-10-03 17:10:23,Voxbox_1,Reddit
Tracking event goals. I'm pulling my hair out over this,analytics,0,7.0,2014-10-03 19:18:20,Dharma_Monkey,Reddit
Why Not A/B Testing is For Idiots,analytics,3,0.0,2014-10-03 19:47:31,cdrux,Reddit
"Survey of 1,000+ Websites Uses Google Analytics Data to Compare Engagement from Social Networks, Acquisition Channels, Mobile Devices",analytics,6,0.0,2014-10-06 17:27:47,megalytic,Reddit
Insurers Leveraging Social Media to Improve Customer Retention,analytics,1,0.0,2014-10-07 11:14:45,samdris,Reddit
Insurers Leveraging Social Media to Improve Customer Retention,analytics,1,0.0,2014-10-07 12:08:39,dineshkarthik1420,Reddit
Can anyone help me build a customized Google Analytics report?,analytics,1,3.0,2014-10-07 21:31:21,GoodTravelYoung,Reddit
Track our conversions back to the initial referrer to the website?,analytics,2,6.0,2014-10-07 23:45:43,mcrob,Reddit
How to calculate total time of all sessions?,analytics,2,2.0,2014-10-08 04:24:02,zanzibarmangosteen,Reddit
Discover Facts &amp; Myths about a Data Scientist,analytics,1,0.0,2014-10-08 09:02:03,akashdp,Reddit
Visualize Real Time Twitter Trends With Kibana,analytics,1,0.0,2014-10-08 11:19:04,harsh067,Reddit
Can we have a real talk about paid search?,analytics,1,0.0,2014-10-10 01:24:56,[deleted],Reddit
Classic GA still logs Linux box spiders as visits,analytics,4,1.0,2014-10-10 16:25:51,konamikode,Reddit
Анализ конкурентов в сервисе Spywords,analytics,1,0.0,2014-10-10 17:50:32,abramov-a-m,Reddit
GA iOS app: possible to see full referral paths?,analytics,1,0.0,2014-10-11 06:41:47,jackjohnbrown,Reddit
Web Analytics to Insights using Google Analytics,analytics,7,7.0,2014-10-11 23:22:14,WardMaker,Reddit
Predictive Analytics key to great software quality? Intro to Grip.QA,analytics,1,0.0,2014-10-12 20:00:11,TechID,Reddit
How To Install Google Analytics On A Self Hosted WordPress In 2015,analytics,1,0.0,2014-10-13 02:53:54,ubaid77,Reddit
Kissmetrics or mixpanel?,analytics,1,0.0,2014-10-14 02:27:19,[deleted],Reddit
How do you manage during the wild west of analytics?,analytics,0,1.0,2014-10-14 20:12:39,mtl1015,Reddit
"My company recently came out with this, Introducing Conversation Anaylitics",analytics,1,0.0,2014-10-14 20:13:33,Bernie_Beaver,Reddit
Filtering Your BOT Traffic with Google Analytics,analytics,1,0.0,2014-10-14 22:01:21,VoodooAlerts,Reddit
Attribute Content Groups to Conversions,analytics,1,1.0,2014-10-16 02:47:17,essee-bro,Reddit
"Benchmarking Analytics Performance: The Options, Dos, Don'ts",analytics,1,0.0,2014-10-16 13:44:53,ShariqEhsan,Reddit
Announcing User Insights by Taplytics,analytics,1,1.0,2014-10-16 19:22:42,cdrux,Reddit
6 Social Media Analytics Tools for Merchants,analytics,0,0.0,2014-10-18 15:36:36,MineWhat,Reddit
Firesale for analytics amongst CIO,analytics,1,0.0,2014-10-20 00:13:04,illuminairi,Reddit
How can key visual mobile metrics help you improve your app’s design?,analytics,1,0.0,2014-10-20 14:37:55,CuriousAboutTech,Reddit
"Extract, Prepare and Blend your data with Big Data Analytics tools",analytics,1,0.0,2014-10-21 14:58:25,Rohitin34,Reddit
Exploring Cohort Analysis - Part One,analytics,3,0.0,2014-10-21 16:44:27,mariotalavera,Reddit
84% Of Enterprises See Big Data Analytics Changing Their Industries' Competitive Landscapes In The Next Year,analytics,2,0.0,2014-10-22 19:34:05,worldcupforlife,Reddit
TaxHash - Need Assistance in getting Accounting team to 'hash' out streaming accounting system for smart devices. : Accounting,analytics,2,0.0,2014-10-22 20:53:15,onexiv,Reddit
Suspected Hacking - Now thousands of sessions from SPAM urls,analytics,3,4.0,2014-10-23 18:35:53,Scottoiler,Reddit
Service provider vs network domain dimension,analytics,2,1.0,2014-10-23 23:05:10,lentebriesje,Reddit
A very basic Google Analytics question,analytics,2,4.0,2014-10-24 11:11:17,Waiorua,Reddit
Career Advice - progressing up the ladder?,analytics,5,17.0,2014-10-24 19:14:24,failcookie,Reddit
All the best GA and GTM blogs collected in one place,analytics,4,4.0,2014-10-24 21:11:44,shawne,Reddit
How to Setup Google Analytics: 5 Quick Videos That Make it Easy,analytics,1,0.0,2014-10-24 21:35:27,learninbound,Reddit
With Big Data Comes Big Opportunity: Ensure Against Gender Pay Gaps,analytics,1,0.0,2014-10-25 23:43:56,duncanpredicts,Reddit
Experiential Learning,analytics,1,0.0,2014-10-27 12:03:09,learnanalyttica,Reddit
Bing Ads Launches Universal Event Tracking,analytics,1,0.0,2014-10-27 18:14:21,ScriptilabsIMS,Reddit
3 Reasons Why You Should be Monitoring Session Times,analytics,1,0.0,2014-10-29 02:12:40,VoodooAlerts,Reddit
Career Advice - Where to Begin,analytics,1,0.0,2014-10-29 03:32:14,EgregiousDeviation,Reddit
Brillio Expands Advanced Analytics Capabilities with Acquisition of Marketelligent,analytics,1,0.0,2014-10-29 18:21:14,bethtrier1,Reddit
Best Practice for GA Tags on Web (Universal VS Standard) &amp; GTM,analytics,1,6.0,2014-10-30 03:54:45,Flichman,Reddit
Simplified Big Data Analytics,analytics,1,1.0,2014-10-30 13:19:14,rautsan,Reddit
Google Analytics | Beginners Guide - Chapter 1 | Video Blog,analytics,1,0.0,2014-10-30 22:43:07,ericNELSON1964,Reddit
Why I Don’t Put Recommendations on Dashboards,analytics,1,0.0,2014-10-31 10:28:20,LukasGrebe,Reddit
Using Google Analytics Events to Track Engagement,analytics,1,2.0,2014-10-31 14:53:01,megalytic,Reddit
How to create a scatterplot in R [OC],analytics,0,4.0,2014-11-01 16:01:44,SharpSightLabs,Reddit
"RFM Customer Segmentation in R, Pandas and Apache Spark",analytics,1,0.0,2014-11-02 21:50:52,whiteraven2,Reddit
"10 sites, need one overview for all",analytics,1,0.0,2014-11-03 09:46:44,SEM_123,Reddit
thereMustBeA (betterWay) ;,analytics,1,0.0,2014-11-03 17:57:28,mikeylieberman,Reddit
How A/B Testing Works (for Non-Mathematicians),analytics,1,0.0,2014-11-04 01:05:02,innoarchitech,Reddit
How Webplio provides insights from Google Analytics for easier website optimization,analytics,2,0.0,2014-11-04 02:01:50,WardMaker,Reddit
Giving pageviews correct paths from a different subdomain with GTM,analytics,1,6.0,2014-11-04 12:18:35,jh0nn,Reddit
COMO CONTROLAR LAS ESTADISTICAS DE TU WEB,analytics,1,0.0,2014-11-04 17:20:19,MejorConsejos,Reddit
Tracking an iframe form from another site,analytics,2,5.0,2014-11-05 01:05:56,[deleted],Reddit
Google Analytics | Beginners Guide - Chapter 2,analytics,1,0.0,2014-11-06 00:29:59,ericNELSON1964,Reddit
How to reject and remove SeMalt Traffic today...,analytics,1,0.0,2014-11-07 13:31:17,teddingham,Reddit
How to create a digital analytics portfolio,analytics,7,0.0,2014-11-07 18:11:36,_binnie_,Reddit
Regarding implementation what is bi framework?,analytics,3,3.0,2014-11-08 03:11:18,Dr_Monkee,Reddit
The Consequences of Workforce Management without Analytics.,analytics,1,0.0,2014-11-10 12:08:36,tickto-inc,Reddit
"CDK Global is looking for a Support Analyst in Hungerford, UK",analytics,1,0.0,2014-11-10 17:02:42,JulieMellson,Reddit
Data Mining Orange County (Orlando Area) Crime,analytics,0,0.0,2014-11-11 04:47:50,[deleted],Reddit
Making advanced analytics work for you,analytics,2,1.0,2014-11-12 15:28:00,jehb,Reddit
Google vs Piwik Analytics discrepancy,analytics,2,3.0,2014-11-13 19:01:29,cabear,Reddit
"Where the data science jobs are, by sector and by state",analytics,6,0.0,2014-11-15 08:32:11,SharpSightLabs,Reddit
Who owns your digital content?,analytics,1,0.0,2014-11-17 09:07:21,charlie7602,Reddit
Predictive Modeling: Using R to Understand Heteroskedasticity and Fix it,analytics,1,0.0,2014-11-17 11:26:49,lindiabradley,Reddit
Google Analytics Help - 'Tracking Not Installed'?,analytics,2,6.0,2014-11-18 00:24:55,Ajnin123,Reddit
Google Analytics Glossary Terms &amp; Definitions,analytics,1,0.0,2014-11-18 02:41:44,ericNELSON1964,Reddit
Predictive Analytics in Ecommerce,analytics,1,0.0,2014-11-18 14:56:04,Rpandey099,Reddit
Market Media Releases Google Analytics Glossary Terms and Definitions,analytics,1,0.0,2014-11-18 22:09:16,ericNELSON1964,Reddit
"Help with Assisted Conversions report in MCF, Google Analytics",analytics,2,4.0,2014-11-18 22:13:53,gutterandstars,Reddit
Market Media Releases Google Analytics Glossary Terms and Definitions,analytics,1,0.0,2014-11-18 23:36:24,ericNELSON1964,Reddit
"CDK Global is looking for a ‪‎Support‬ ‪Analyst‬ in Hungerford, UK",analytics,1,0.0,2014-11-19 00:48:59,JulieMellson,Reddit
Cross domain tracking with analytics,analytics,1,0.0,2014-11-19 06:40:10,steveblom,Reddit
Adobe Dynamic Tag Manager (DTM) questions,analytics,1,3.0,2014-11-20 08:22:40,nellyshark,Reddit
Possible education for researcher who just finished MBA looking into analytics,analytics,2,3.0,2014-11-21 00:47:13,[deleted],Reddit
Tracking WordPress Posts Popularity,analytics,2,1.0,2014-11-21 05:17:05,waverlyposter,Reddit
Evolution of the web analytics department,analytics,1,0.0,2014-11-22 06:34:59,charlie7602,Reddit
Smashing Magazine discusses how to use visual mobile analytics to refine the onboarding exsperience - Great insights!,analytics,1,0.0,2014-11-23 16:50:14,CuriousAboutTech,Reddit
What Google Analytics can tell you about SEO success.,analytics,1,0.0,2014-11-23 17:05:17,sambarnes90,Reddit
"Hi all, check out my new Analytics blog",analytics,1,0.0,2014-11-23 23:43:18,Leeds_Analytics,Reddit
"How to build an R line chart, step by step (xpost: /r/dataisbeautiful) [OC]",analytics,3,0.0,2014-11-24 16:32:29,SharpSightLabs,Reddit
"Awesome way to share content, while also driving traffic! With Metrics too :)",analytics,0,0.0,2014-11-25 17:51:22,Dark-Wing-Duck,Reddit
UTM parameters,analytics,1,0.0,2014-11-26 15:16:56,moriyonet,Reddit
Find the most-talked conversation/topics around a brand,analytics,1,0.0,2014-11-26 19:49:42,a_methyst,Reddit
People who became regular visitors,analytics,2,4.0,2014-11-27 11:31:22,aboustayyef,Reddit
A few questions for an expert!,analytics,3,8.0,2014-11-27 19:05:19,itsthe90s,Reddit
Help with a Report - Page &amp; Transactions,analytics,1,0.0,2014-11-29 02:42:43,Emerald_Triangle,Reddit
"For those interested, Twitter Counter is having a Cyber Monday lifetime deal for 50% off their service",analytics,1,0.0,2014-11-30 20:36:31,Joeynoh,Reddit
